Title,Authors,Venue,Year,URL
Human-AI Shared Control via Policy Dissection.,"Quanyi Li, Zhenghao Peng, Haibin Wu, Lan Feng, Bolei Zhou",NeurIPS,2022,http://papers.nips.cc/paper_files/paper/2022/hash/3a02da3fdfd592d9a5273101c3546611-Abstract-Conference.html
Online Neural Sequence Detection with Hierarchical Dirichlet Point Process.,"Weihan Li, Yu Qi, Gang Pan 0001",NeurIPS,2022,http://papers.nips.cc/paper_files/paper/2022/hash/2c3b636b64ca1dfdae3e096e4deeaa42-Abstract-Conference.html
MetaMask: Revisiting Dimensional Confounder for Self-Supervised Learning.,"Jiangmeng Li, Wenwen Qiang, Yanan Zhang, Wenyi Mo, Changwen Zheng, Bing Su 0001, Hui Xiong 0001",NeurIPS,2022,http://papers.nips.cc/paper_files/paper/2022/hash/fb575ab4d882a4c734641155a5f30911-Abstract-Conference.html
Instance-optimal PAC Algorithms for Contextual Bandits.,"Zhaoqi Li, Lillian J. Ratliff, Houssam Nassif, Kevin G. Jamieson, Lalit Jain",NeurIPS,2022,http://papers.nips.cc/paper_files/paper/2022/hash/f4821075019a058700f6e6738eea1365-Abstract-Conference.html
Detecting Abrupt Changes in Sequential Pairwise Comparison Data.,"Wanshan Li, Alessandro Rinaldo, Daren Wang",NeurIPS,2022,http://papers.nips.cc/paper_files/paper/2022/hash/f6ccfa588d2a95bef5a3b101c02524c9-Abstract-Conference.html
NSNet: A General Neural Probabilistic Framework for Satisfiability Problems.,"Zhaoyu Li, Xujie Si",NeurIPS,2022,http://papers.nips.cc/paper_files/paper/2022/hash/a40462acc6959034c6aa6dfb8e696415-Abstract-Conference.html
Globally Gated Deep Linear Networks.,"Qianyi Li, Haim Sompolinsky",NeurIPS,2022,http://papers.nips.cc/paper_files/paper/2022/hash/e0f393e7980a24fd12fa6f15adfa25fb-Abstract-Conference.html
Contextual Bandits with Knapsacks for a Conversion Model.,"Zhen Li, Gilles Stoltz",NeurIPS,2022,http://papers.nips.cc/paper_files/paper/2022/hash/e75a1c8af8d9438df1057fdaa42913eb-Abstract-Conference.html
Does Self-supervised Learning Really Improve Reinforcement Learning from Pixels?,"Xiang Li 0109, Jinghuan Shang, Srijan Das, Michael S. Ryoo",NeurIPS,2022,http://papers.nips.cc/paper_files/paper/2022/hash/c75abb33341363ee874a71f81dc45a3a-Abstract-Conference.html
A Differentiable Semantic Metric Approximation in Probabilistic Embedding for Cross-Modal Retrieval.,"Hao Li, Jingkuan Song, Lianli Gao, Pengpeng Zeng, Haonan Zhang, Gongfu Li",NeurIPS,2022,http://papers.nips.cc/paper_files/paper/2022/hash/4e786a87e7ae249de2b1aeaf5d8fde82-Abstract-Conference.html
Learning to Attack Federated Learning: A Model-based Reinforcement Learning Attack Framework.,"Henger Li, Xiaolin Sun, Zizhan Zheng",NeurIPS,2022,http://papers.nips.cc/paper_files/paper/2022/hash/e2ef0cae667dbe9bfdbcaed1bd91807b-Abstract-Conference.html
Moment Distributionally Robust Tree Structured Prediction.,"Yeshu Li, Danyal Saeed, Xinhua Zhang, Brian D. Ziebart, Kevin Gimpel",NeurIPS,2022,http://papers.nips.cc/paper_files/paper/2022/hash/4f92d2f498b88f1bd43732312272967a-Abstract-Conference.html
Diffusion-LM Improves Controllable Text Generation.,"Xiang Lisa Li, John Thickstun, Ishaan Gulrajani, Percy Liang, Tatsunori B. Hashimoto",NeurIPS,2022,http://papers.nips.cc/paper_files/paper/2022/hash/1be5bc25d50895ee656b8c2d9eb89d6a-Abstract-Conference.html
TOIST: Task Oriented Instance Segmentation Transformer with Noun-Pronoun Distillation.,"Pengfei Li 0007, Beiwen Tian, Yongliang Shi, Xiaoxue Chen, Hao Zhao 0002, Guyue Zhou, Ya-Qin Zhang",NeurIPS,2022,http://papers.nips.cc/paper_files/paper/2022/hash/70270a1bc28ecb2a2aefad566c5e556b-Abstract-Conference.html
Geodesic Self-Attention for 3D Point Clouds.,"Zhengyu Li, Xuan Tang, Zihao Xu 0002, Xihao Wang, Hui Yu, Mingsong Chen, Xian Wei",NeurIPS,2022,http://papers.nips.cc/paper_files/paper/2022/hash/28e4ee96c94e31b2d040b4521d2b299e-Abstract-Conference.html
Communication Efficient Federated Learning for Generalized Linear Bandits.,"Chuanhao Li, Hongning Wang",NeurIPS,2022,http://papers.nips.cc/paper_files/paper/2022/hash/faa8be9311811ba7c36fa1ceec13b862-Abstract-Conference.html
GraphDE: A Generative Framework for Debiased Learning and Out-of-Distribution Detection on Graphs.,"Zenan Li, Qitian Wu, Fan Nie, Junchi Yan",NeurIPS,2022,http://papers.nips.cc/paper_files/paper/2022/hash/c34262c35aa5f8c1a091822cbb2020c2-Abstract-Conference.html
CoNSoLe: Convex Neural Symbolic Learning.,"Haoran Li 0005, Yang Weng, Hanghang Tong",NeurIPS,2022,http://papers.nips.cc/paper_files/paper/2022/hash/2608470747b9b55b89de1c0d70418cab-Abstract-Conference.html
Communication Efficient Distributed Learning for Kernelized Contextual Bandits.,"Chuanhao Li, Huazheng Wang, Mengdi Wang, Hongning Wang",NeurIPS,2022,http://papers.nips.cc/paper_files/paper/2022/hash/7d1043b688002734b49b766cc2fc478d-Abstract-Conference.html
AMP: Automatically Finding Model Parallel Strategies with Heterogeneity Awareness.,"Dacheng Li, Hongyi Wang 0001, Eric P. Xing, Hao Zhang",NeurIPS,2022,http://papers.nips.cc/paper_files/paper/2022/hash/2b4bfa1cebe78d125fefd7ea6ffcfc6d-Abstract-Conference.html
Q-ViT: Accurate and Fully Quantized Low-bit Vision Transformer.,"Yanjing Li, Sheng Xu 0007, Baochang Zhang 0001, Xianbin Cao 0001, Peng Gao 0007, Guodong Guo",NeurIPS,2022,http://papers.nips.cc/paper_files/paper/2022/hash/deb921bff461a7b0a5c344a4871e7101-Abstract-Conference.html
Defending Against Adversarial Attacks via Neural Dynamic System.,"Xiyuan Li, Zou Xin, Weiwei Liu",NeurIPS,2022,http://papers.nips.cc/paper_files/paper/2022/hash/299a08ee712d4752c890938da99a77c6-Abstract-Conference.html
Estimating Noise Transition Matrix with Label Correlations for Noisy Multi-Label Learning.,"Shikun Li, Xiaobo Xia, Hansong Zhang 0003, Yibing Zhan, Shiming Ge, Tongliang Liu",NeurIPS,2022,http://papers.nips.cc/paper_files/paper/2022/hash/98f8c89ae042c512e6c87e0e0c2a0f98-Abstract-Conference.html
EfficientFormer: Vision Transformers at MobileNet Speed.,"Yanyu Li, Geng Yuan, Yang Wen, Ju Hu, Georgios Evangelidis 0002, Sergey Tulyakov, Yanzhi Wang, Jian Ren 0005",NeurIPS,2022,http://papers.nips.cc/paper_files/paper/2022/hash/5452ad8ee6ea6e7dc41db1cbd31ba0b8-Abstract-Conference.html
Concentration of Data Encoding in Parameterized Quantum Circuits.,"Guangxi Li, Ruilin Ye, Xuanqiang Zhao, Xin Wang 0022",NeurIPS,2022,http://papers.nips.cc/paper_files/paper/2022/hash/7b2d0730df1edd8c97df4bf83696025d-Abstract-Conference.html
Learning Invariant Graph Representations for Out-of-Distribution Generalization.,"Haoyang Li 0001, Ziwei Zhang 0001, Xin Wang 0019, Wenwu Zhu 0001",NeurIPS,2022,http://papers.nips.cc/paper_files/paper/2022/hash/4d4e0ab9d8ff180bf5b95c258842d16e-Abstract-Conference.html
On Efficient Online Imitation Learning via Classification.,"Yichen Li, Chicheng Zhang",NeurIPS,2022,http://papers.nips.cc/paper_files/paper/2022/hash/d0d5dd7bd2ee9f095e50084c2ba3a716-Abstract-Conference.html
Learning Two-Player Markov Games: Neural Function Approximation and Correlated Equilibrium.,"Chris Junchi Li, Dongruo Zhou, Quanquan Gu, Michael I. Jordan",NeurIPS,2022,http://papers.nips.cc/paper_files/paper/2022/hash/d6f681da2151687df12cc21a1c1e3527-Abstract-Conference.html
The Stability-Efficiency Dilemma: Investigating Sequence Length Warmup for Training GPT Models.,"Conglong Li, Minjia Zhang, Yuxiong He",NeurIPS,2022,http://papers.nips.cc/paper_files/paper/2022/hash/aac02401755a65904cf977a33136af4a-Abstract-Conference.html
SoteriaFL: A Unified Framework for Private Federated Learning with Communication Compression.,"Zhize Li, Haoyu Zhao, Boyue Li, Yuejie Chi",NeurIPS,2022,http://papers.nips.cc/paper_files/paper/2022/hash/1b645a77cf48821afc3ee7e5b5d42617-Abstract-Conference.html
SemMAE: Semantic-Guided Masking for Learning Masked Autoencoders.,"Gang Li, Heliang Zheng, Daqing Liu, Chaoyue Wang, Bing Su 0001, Changwen Zheng",NeurIPS,2022,http://papers.nips.cc/paper_files/paper/2022/hash/5c186016d0844767209dc36e9e61441b-Abstract-Conference.html
Distributed Learning of Conditional Quantiles in the Reproducing Kernel Hilbert Space.,Heng Lian,NeurIPS,2022,http://papers.nips.cc/paper_files/paper/2022/hash/4c12e97f2e05304a451e18c9c945036f-Abstract-Conference.html
Scaling &amp; Shifting Your Features: A New Baseline for Efficient Model Tuning.,"Dongze Lian, Daquan Zhou, Jiashi Feng, Xinchao Wang",NeurIPS,2022,http://papers.nips.cc/paper_files/paper/2022/hash/00bb4e415ef117f2dee2fc3b778d806d-Abstract-Conference.html
Drawing out of Distribution with Neuro-Symbolic Generative Models.,"Yichao Liang, Josh Tenenbaum 0001, Tuan Anh Le 0001, N. Siddharth 0001",NeurIPS,2022,http://papers.nips.cc/paper_files/paper/2022/hash/6248a3b8279a39b3668a8a7c0e29164d-Abstract-Conference.html
Nonlinear Sufficient Dimension Reduction with a Stochastic Neural Network.,"Siqi Liang 0005, Yan Sun 0011, Faming Liang",NeurIPS,2022,http://papers.nips.cc/paper_files/paper/2022/hash/af5509c72a244497c999ac39ba068ff4-Abstract-Conference.html
M³ViT: Mixture-of-Experts Vision Transformer for Efficient Multi-task Learning with Model-Accelerator Co-design.,"Hanxue Liang, Zhiwen Fan, Rishov Sarkar, Ziyu Jiang, Tianlong Chen, Kai Zou, Yu Cheng 0001, Cong Hao, Zhangyang Wang",NeurIPS,2022,http://papers.nips.cc/paper_files/paper/2022/hash/b653f34d576d1790481e3797cb740214-Abstract-Conference.html
Recurrent Video Restoration Transformer with Guided Deformable Attention.,"Jingyun Liang, Yuchen Fan, Xiaoyu Xiang, Rakesh Ranjan, Eddy Ilg, Simon Green, Jiezhang Cao, Kai Zhang 0008, Radu Timofte, Luc Van Gool",NeurIPS,2022,http://papers.nips.cc/paper_files/paper/2022/hash/02687e7b22abc64e651be8da74ec610e-Abstract-Conference.html
Asymptotic Behaviors of Projected Stochastic Approximation: A Jump Diffusion Perspective.,"Jiadong Liang, Yuze Han, Xiang Li 0050, Zhihua Zhang 0004",NeurIPS,2022,http://papers.nips.cc/paper_files/paper/2022/hash/dfdc9c54cd62f2b2bfd8b090b3489b7f-Abstract-Conference.html
Stability and Generalization of Kernel Clustering: from Single Kernel to Multiple Kernel.,"Weixuan Liang, Xinwang Liu 0002, Yong Liu 0018, Sihang Zhou 0001, Jun-Jie Huang 0001, Siwei Wang 0001, Jiyuan Liu 0003, Yi Zhang 0104, En Zhu",NeurIPS,2022,http://papers.nips.cc/paper_files/paper/2022/hash/da0945c639b376b84941256c7371dd45-Abstract-Conference.html
Efficient Adversarial Training without Attacking: Worst-Case-Aware Robust Reinforcement Learning.,"Yongyuan Liang, Yanchao Sun, Ruijie Zheng, Furong Huang",NeurIPS,2022,http://papers.nips.cc/paper_files/paper/2022/hash/8d6b1d775014eff18256abeb207202ad-Abstract-Conference.html
NUWA-Infinity: Autoregressive over Autoregressive Generation for Infinite Visual Synthesis.,"Jian Liang, Chenfei Wu, Xiaowei Hu 0006, Zhe Gan, Jianfeng Wang, Lijuan Wang, Zicheng Liu 0001, Yuejian Fang, Nan Duan",NeurIPS,2022,http://papers.nips.cc/paper_files/paper/2022/hash/6358cd0cd6607fdf4870595795eb1710-Abstract-Conference.html
Effective Adaptation in Multi-Task Co-Training for Unified Autonomous Driving.,"Xiwen Liang, Yangxin Wu, Jianhua Han, Hang Xu, Chunjing Xu, Xiaodan Liang",NeurIPS,2022,http://papers.nips.cc/paper_files/paper/2022/hash/7c319b62e2257b34cb0e1040ced2e007-Abstract-Conference.html
GMMSeg: Gaussian Mixture based Generative Semantic Segmentation Models.,"Chen Liang, Wenguan Wang, Jiaxu Miao, Yi Yang 0001",NeurIPS,2022,http://papers.nips.cc/paper_files/paper/2022/hash/cb1c4782f159b55380b4584671c4fd88-Abstract-Conference.html
Toward Robust Spiking Neural Network Against Adversarial Perturbation.,"Ling Liang, Kaidi Xu, Xing Hu 0001, Lei Deng 0003, Yuan Xie 0001",NeurIPS,2022,http://papers.nips.cc/paper_files/paper/2022/hash/42bc612558891859b1b8717051f2c7b0-Abstract-Conference.html
BEVFusion: A Simple and Robust LiDAR-Camera Fusion Framework.,"Tingting Liang, Hongwei Xie, Kaicheng Yu, Zhongyu Xia, Zhiwei Lin, Yongtao Wang, Tao Tang, Bing Wang, Zhi Tang 0001",NeurIPS,2022,http://papers.nips.cc/paper_files/paper/2022/hash/43d2b7fbee8431f7cef0d0afed51c691-Abstract-Conference.html
Expediting Large-Scale Vision Transformer for Dense Prediction without Fine-tuning.,"Weicong Liang, Yuhui Yuan, Henghui Ding, Xiao Luo 0001, Weihong Lin, Ding Jia, Zheng Zhang 0022, Chao Zhang 0001, Han Hu 0001",NeurIPS,2022,http://papers.nips.cc/paper_files/paper/2022/hash/e6c2e85db1f1039177c4495ccd399ac4-Abstract-Conference.html
Mind the Gap: Understanding the Modality Gap in Multi-modal Contrastive Representation Learning.,"Weixin Liang, Yuhui Zhang, Yongchan Kwon, Serena Yeung, James Y. Zou",NeurIPS,2022,http://papers.nips.cc/paper_files/paper/2022/hash/702f4db7543a7432431df588d57bc7c9-Abstract-Conference.html
Multi-dataset Training of Transformers for Robust Action Recognition.,"Junwei Liang 0001, Enwei Zhang, Jun Zhang 0018, Chunhua Shen",NeurIPS,2022,http://papers.nips.cc/paper_files/paper/2022/hash/5d2e24df9cfaad3189833b819c40b392-Abstract-Conference.html
WT-MVSNet: Window-based Transformers for Multi-view Stereo.,"Jinli Liao, Yikang Ding, Yoli Shavit, Dihe Huang, Shihao Ren, Jia Guo, Wensen Feng, Kai Zhang 0012",NeurIPS,2022,http://papers.nips.cc/paper_files/paper/2022/hash/38e511a690709603d4cc3a1c52b4a9fd-Abstract-Conference.html
Nonstationary Dual Averaging and Online Fair Allocation.,"Luofeng Liao, Yuan Gao, Christian Kroer",NeurIPS,2022,http://papers.nips.cc/paper_files/paper/2022/hash/f0bc367ccb66afc776fcac8d15549516-Abstract-Conference.html
Chefs&apos; Random Tables: Non-Trigonometric Random Features.,"Valerii Likhosherstov, Krzysztof Marcin Choromanski, Kumar Avinava Dubey, Frederick Liu, Tamás Sarlós, Adrian Weller",NeurIPS,2022,http://papers.nips.cc/paper_files/paper/2022/hash/df2d62b96a4003203450cf89cd338bb7-Abstract-Conference.html
Distributional Reinforcement Learning for Risk-Sensitive Policies.,"Shiau Hong Lim, Ilyas Malik",NeurIPS,2022,http://papers.nips.cc/paper_files/paper/2022/hash/c88a2bd0e793550d0e885aa6e31ca277-Abstract-Conference.html
Learning Symmetric Rules with SATNet.,"Sangho Lim, Eun-Gyeol Oh, Hongseok Yang",NeurIPS,2022,http://papers.nips.cc/paper_files/paper/2022/hash/5642b9811a9ac5281be1cc84c275f251-Abstract-Conference.html
Chaotic Regularization and Heavy-Tailed Limits for Deterministic Gradient Descent.,"Soon Hoe Lim, Yijun Wan, Umut Simsekli",NeurIPS,2022,http://papers.nips.cc/paper_files/paper/2022/hash/a9a238a00f7e885389fc02d65fb00994-Abstract-Conference.html
ZIN: When and How to Learn Invariance Without Environment Partition?,"Yong Lin, Shengyu Zhu 0001, Lu Tan, Peng Cui 0001",NeurIPS,2022,http://papers.nips.cc/paper_files/paper/2022/hash/9b77f07301b1ef1fe810aae96c12cb7b-Abstract-Conference.html
SwinTrack: A Simple and Strong Baseline for Transformer Tracking.,"Liting Lin, Heng Fan 0001, Zhipeng Zhang, Yong Xu 0007, Haibin Ling",NeurIPS,2022,http://papers.nips.cc/paper_files/paper/2022/hash/6a5c23219f401f3efd322579002dbb80-Abstract-Conference.html
"Personalized Federated Learning towards Communication Efficiency, Robustness and Fairness.","Shiyun Lin, Yuze Han, Xiang Li 0050, Zhihua Zhang 0004",NeurIPS,2022,http://papers.nips.cc/paper_files/paper/2022/hash/c47e6286162ec5442e06fe2b7cb7145f-Abstract-Conference.html
"Bounded-Regret MPC via Perturbation Analysis: Prediction Error, Constraints, and Nonlinearity.","Yiheng Lin, Yang Hu, Guannan Qu, Tongxin Li, Adam Wierman",NeurIPS,2022,http://papers.nips.cc/paper_files/paper/2022/hash/eadeef7c51ad86989cc3b311cb49ec89-Abstract-Conference.html
Could Giant Pre-trained Image Models Extract Universal Representations?,"Yutong Lin, Ze Liu, Zheng Zhang 0022, Han Hu 0001, Nanning Zheng 0001, Stephen Lin 0001, Yue Cao 0001",NeurIPS,2022,http://papers.nips.cc/paper_files/paper/2022/hash/3776558654d8db1bfcb9ebde0e01184e-Abstract-Conference.html
NeuForm: Adaptive Overfitting for Neural Shape Editing.,"Connor Z. Lin, Niloy J. Mitra, Gordon Wetzstein, Leonidas J. Guibas, Paul Guerrero 0001",NeurIPS,2022,http://papers.nips.cc/paper_files/paper/2022/hash/623e5a86fcedca573d33390dd1173e6b-Abstract-Conference.html
Continual Learning with Evolving Class Ontologies.,"Zhiqiu Lin, Deepak Pathak, Yu-Xiong Wang, Deva Ramanan, Shu Kong",NeurIPS,2022,http://papers.nips.cc/paper_files/paper/2022/hash/3255a7554605a88800f4e120b3a929e1-Abstract-Conference.html
Bayesian Risk Markov Decision Processes.,"Yifan Lin, Yuxuan Ren, Enlu Zhou",NeurIPS,2022,http://papers.nips.cc/paper_files/paper/2022/hash/6f7d90b1198fec96defd80b5ebd5bc81-Abstract-Conference.html
Mind Reader: Reconstructing complex images from brain activities.,"Sikun Lin, Thomas Sprague, Ambuj K. Singh",NeurIPS,2022,http://papers.nips.cc/paper_files/paper/2022/hash/bee5125b773414d3d6eeb4334fbc5453-Abstract-Conference.html
Conformal Prediction with Temporal Quantile Adjustments.,"Zhen Lin, Shubhendu Trivedi, Jimeng Sun 0001",NeurIPS,2022,http://papers.nips.cc/paper_files/paper/2022/hash/c8d2860e1b51a1ffadc7ed0a06f8d8f5-Abstract-Conference.html
Unsupervised Cross-Task Generalization via Retrieval Augmentation.,"Bill Yuchen Lin, Kangmin Tan, Chris Miller, Beiwen Tian, Xiang Ren 0001",NeurIPS,2022,http://papers.nips.cc/paper_files/paper/2022/hash/8a0d3ae989a382ce6e50312bc35bf7e1-Abstract-Conference.html
Text-Adaptive Multiple Visual Prototype Matching for Video-Text Retrieval.,"Chengzhi Lin, Ancong Wu, Junwei Liang 0001, Jun Zhang 0018, Wenhang Ge, Wei-Shi Zheng 0001, Chunhua Shen",NeurIPS,2022,http://papers.nips.cc/paper_files/paper/2022/hash/fc65fab891d83433bd3c8d966edde311-Abstract-Conference.html
Egocentric Video-Language Pretraining.,"Kevin Qinghong Lin, Jinpeng Wang 0001, Mattia Soldan, Michael Wray, Rui Yan 0001, Eric Zhongcong Xu, Difei Gao, Rong-Cheng Tu, Wenzhe Zhao, Weijie Kong, Chengfei Cai, Hongfa Wang, Dima Damen, Bernard Ghanem, Wei Liu 0005, Mike Zheng Shou",NeurIPS,2022,http://papers.nips.cc/paper_files/paper/2022/hash/31fb284a0aaaad837d2930a610cd5e50-Abstract-Conference.html
Generative Status Estimation and Information Decoupling for Image Rain Removal.,"Di Lin 0002, Xin Wang 0118, Jia Shen, Renjie Zhang, Ruonan Liu, Miaohui Wang, Wuyuan Xie, Qing Guo 0005, Ping Li 0016",NeurIPS,2022,http://papers.nips.cc/paper_files/paper/2022/hash/1dc2fe8d9ae956616f86bab3ce5edc59-Abstract-Conference.html
REVIVE: Regional Visual Representation Matters in Knowledge-Based Visual Question Answering.,"Yuanze Lin, Yujia Xie, Dongdong Chen 0001, Yichong Xu, Chenguang Zhu 0001, Lu Yuan",NeurIPS,2022,http://papers.nips.cc/paper_files/paper/2022/hash/44956951349095f74492a5471128a7e0-Abstract-Conference.html
Beyond Not-Forgetting: Continual Learning with Backward Knowledge Transfer.,"Sen Lin 0001, Li Yang 0009, Deliang Fan, Junshan Zhang",NeurIPS,2022,http://papers.nips.cc/paper_files/paper/2022/hash/6728fcf94660c59c938319a6833a6073-Abstract-Conference.html
Exploiting Semantic Relations for Glass Surface Detection.,"Jiaying Lin, Yuen Hei Yeung, Rynson W. H. Lau",NeurIPS,2022,http://papers.nips.cc/paper_files/paper/2022/hash/8d162f48c816af5f8c114eb437e8b28b-Abstract-Conference.html
Gradient-Free Methods for Deterministic and Stochastic Nonsmooth Nonconvex Optimization.,"Tianyi Lin, Zeyu Zheng, Michael I. Jordan",NeurIPS,2022,http://papers.nips.cc/paper_files/paper/2022/hash/a78f142aec481e68c75276756e0a0d91-Abstract-Conference.html
Fair and Optimal Decision Trees: A Dynamic Programming Approach.,"Jacobus G. M. van der Linden, Mathijs de Weerdt, Emir Demirovic",NeurIPS,2022,http://papers.nips.cc/paper_files/paper/2022/hash/fe248e22b241ae5a9adf11493c8c12bc-Abstract-Conference.html
Active Exploration for Inverse Reinforcement Learning.,"David Lindner, Andreas Krause 0001, Giorgia Ramponi",NeurIPS,2022,http://papers.nips.cc/paper_files/paper/2022/hash/26d01e5ed42d8dcedd6aa0e3e99cffc4-Abstract-Conference.html
Anytime-Valid Inference For Multinomial Count Data.,"Michael Lindon, Alan Malek",NeurIPS,2022,http://papers.nips.cc/paper_files/paper/2022/hash/12f3bd5d2b7d93eadc1bf508a0872dc2-Abstract-Conference.html
Action-modulated midbrain dopamine activity arises from distributed control policies.,"Jack Lindsey, Ashok Litwin-Kumar",NeurIPS,2022,http://papers.nips.cc/paper_files/paper/2022/hash/24cb8b08f3cb2f59671e33faac4790e6-Abstract-Conference.html
VectorAdam for Rotation Equivariant Geometry Optimization.,"Selena Ling, Nicholas Sharp, Alec Jacobson",NeurIPS,2022,http://papers.nips.cc/paper_files/paper/2022/hash/1a774f3555593986d7d95e4780d9e4f4-Abstract-Conference.html
Theory and Approximate Solvers for Branched Optimal Transport with Multiple Sources.,"Peter Lippmann, Enrique Fita Sanmartín, Fred A. Hamprecht",NeurIPS,2022,http://papers.nips.cc/paper_files/paper/2022/hash/0206c1c20a18915da23df5e61966fc6a-Abstract-Conference.html
A Unified Diversity Measure for Multiagent Reinforcement Learning.,"Zongkai Liu, Chao Yu 0004, Yaodong Yang 0002, Peng Sun, Zifan Wu, Yuan Li",NeurIPS,2022,http://papers.nips.cc/paper_files/paper/2022/hash/435cce71b4007699041dfffa4f034079-Abstract-Conference.html
Revisiting Graph Contrastive Learning from the Perspective of Graph Spectrum.,"Nian Liu, Xiao Wang 0017, Deyu Bo, Chuan Shi, Jian Pei",NeurIPS,2022,http://papers.nips.cc/paper_files/paper/2022/hash/13b45b44e26c353c64cba9529bf4724f-Abstract-Conference.html
Masked Autoencoding for Scalable and Generalizable Decision Making.,"Fangchen Liu, Hao Liu 0055, Aditya Grover, Pieter Abbeel",NeurIPS,2022,http://papers.nips.cc/paper_files/paper/2022/hash/51fda94414996902ddaaa35561b97294-Abstract-Conference.html
Parameter-free Dynamic Graph Embedding for Link Prediction.,"Jiahao Liu, Dongsheng Li 0002, Hansu Gu, Tun Lu, Peng Zhang 0060, Ning Gu",NeurIPS,2022,http://papers.nips.cc/paper_files/paper/2022/hash/b14d7175755b180dc2163e15e3110cb6-Abstract-Conference.html
Robust Model Selection and Nearly-Proper Learning for GMMs.,"Allen Liu, Jerry Li 0001, Ankur Moitra",NeurIPS,2022,http://papers.nips.cc/paper_files/paper/2022/hash/8f75af4704feac629a560f4ad6b67cef-Abstract-Conference.html
Navigating Memory Construction by Global Pseudo-Task Simulation for Continual Learning.,"Yejia Liu, Wang Zhu 0001, Shaolei Ren",NeurIPS,2022,http://papers.nips.cc/paper_files/paper/2022/hash/3013680bf2d072b5f3851aec70b39a59-Abstract-Conference.html
Debugging and Explaining Metric Learning Approaches: An Influence Function Based Perspective.,"Ruofan Liu, Yun Lin 0001, Xianglin Yang, Jin Song Dong",NeurIPS,2022,http://papers.nips.cc/paper_files/paper/2022/hash/3322a9a72a1707de14badd5e552ff466-Abstract-Conference.html
Dataset Distillation via Factorization.,"Songhua Liu, Kai Wang 0036, Xingyi Yang, Jingwen Ye, Xinchao Wang",NeurIPS,2022,http://papers.nips.cc/paper_files/paper/2022/hash/07bc722f08f096e6ea7ee99349ff0a86-Abstract-Conference.html
Estimating the Arc Length of the Optimal ROC Curve and Lower Bounding the Maximal AUC.,Song Liu,NeurIPS,2022,http://papers.nips.cc/paper_files/paper/2022/hash/ef0c0a23a1a8219c4fc381614664df3e-Abstract-Conference.html
Seeing the forest and the tree: Building representations of both individual and collective dynamics with transformers.,"Ran Liu, Mehdi Azabou, Max Dabagia, Jingyun Xiao, Eva L. Dyer",NeurIPS,2022,http://papers.nips.cc/paper_files/paper/2022/hash/1022661f3f43406065641f16ce25eafa-Abstract-Conference.html
Meta-Reward-Net: Implicitly Differentiable Reward Learning for Preference-based Reinforcement Learning.,"Runze Liu 0002, Fengshuo Bai, Yali Du 0001, Yaodong Yang 0001",NeurIPS,2022,http://papers.nips.cc/paper_files/paper/2022/hash/8be9c134bb193d8bd3827d4df8488228-Abstract-Conference.html
DeVRF: Fast Deformable Voxel Radiance Fields for Dynamic Scenes.,"Jiawei Liu, Yan-Pei Cao, Weijia Mao, Wenqiao Zhang, David Junhao Zhang, Jussi Keppo, Ying Shan, Xiaohu Qie, Mike Zheng Shou",NeurIPS,2022,http://papers.nips.cc/paper_files/paper/2022/hash/eeb57fdf745eb31a3c7ef22c59a4661d-Abstract-Conference.html
Deep Generalized Schrödinger Bridge.,"Guan-Horng Liu, Tianrong Chen, Oswin So, Evangelos A. Theodorou",NeurIPS,2022,http://papers.nips.cc/paper_files/paper/2022/hash/3d17b7f7d52c83ab6e97e2dc0bda2e71-Abstract-Conference.html
Unsupervised Multi-View Object Segmentation Using Radiance Field Propagation.,"Xinhang Liu, Jiaben Chen, Huai Yu, Yu-Wing Tai, Chi-Keung Tang",NeurIPS,2022,http://papers.nips.cc/paper_files/paper/2022/hash/70de9e3948645a1be2de657f14d85c6d-Abstract-Conference.html
Spatial Pruned Sparse Convolution for Efficient 3D Object Detection.,"Jianhui Liu, Yukang Chen, Xiaoqing Ye, Zhuotao Tian, Xiao Tan 0001, Xiaojuan Qi 0001",NeurIPS,2022,http://papers.nips.cc/paper_files/paper/2022/hash/2ce10f144bb93449767f355c01f24cc1-Abstract-Conference.html
Retaining Knowledge for Learning with Dynamic Definition.,"Zichang Liu, Benjamin Coleman, Tianyi Zhang 0011, Anshumali Shrivastava",NeurIPS,2022,http://papers.nips.cc/paper_files/paper/2022/hash/5fcd540792da599adf1b932624e98f1f-Abstract-Conference.html
Conformalized Fairness via Quantile Regression.,"Meichen Liu, Lei Ding 0013, Dengdeng Yu, Wulong Liu, Linglong Kong, Bei Jiang",NeurIPS,2022,http://papers.nips.cc/paper_files/paper/2022/hash/4b52b3c50110fc10f6a1a86055682ea2-Abstract-Conference.html
BOND: Benchmarking Unsupervised Outlier Node Detection on Static Attributed Graphs.,"Kay Liu, Yingtong Dou, Yue Zhao 0016, Xueying Ding, Xiyang Hu, Ruitong Zhang, Kaize Ding, Canyu Chen, Hao Peng 0001, Kai Shu, Lichao Sun 0001, Jundong Li, George H. Chen, Zhihao Jia, Philip S. Yu",NeurIPS,2022,http://papers.nips.cc/paper_files/paper/2022/hash/acc1ec4a9c780006c9aafd595104816b-Abstract-Datasets_and_Benchmarks.html
Beyond accuracy: generalization properties of bio-plausible temporal credit assignment rules.,"Yuhan Helena Liu, Arna Ghosh, Blake A. Richards, Eric Shea-Brown, Guillaume Lajoie",NeurIPS,2022,http://papers.nips.cc/paper_files/paper/2022/hash/9226f8122feb9c229c1efd9270ce7021-Abstract-Conference.html
MGNNI: Multiscale Graph Neural Networks with Implicit Layers.,"Juncheng Liu, Bryan Hooi, Kenji Kawaguchi, Xiaokui Xiao",NeurIPS,2022,http://papers.nips.cc/paper_files/paper/2022/hash/86485259bbe57852dc93477b1deb1f2b-Abstract-Conference.html
Masked Prediction: A Parameter Identifiability View.,"Bingbin Liu, Daniel J. Hsu, Pradeep Ravikumar, Andrej Risteski",NeurIPS,2022,http://papers.nips.cc/paper_files/paper/2022/hash/85dd09d356ca561169b2c03e43cf305e-Abstract-Conference.html
