Title,Authors,Venue,Year,URL
coVariance Neural Networks.,"Saurabh Sihag, Gonzalo Mateos, Corey McMillan, Alejandro Ribeiro",NeurIPS,2022,http://papers.nips.cc/paper_files/paper/2022/hash/6cb00ce1a21a090a3dae04cebebd8341-Abstract-Conference.html
A Simple and Optimal Policy Design for Online Learning with Safety against Heavy-tailed Risk.,"David Simchi-Levi, Zeyu Zheng, Feng Zhu",NeurIPS,2022,http://papers.nips.cc/paper_files/paper/2022/hash/dae8afc6b990aa0b3b5efaa096fbd7fa-Abstract-Conference.html
Simple Unsupervised Object-Centric Learning for Complex and Naturalistic Videos.,"Gautam Singh, Yi-Fu Wu, Sungjin Ahn",NeurIPS,2022,http://papers.nips.cc/paper_files/paper/2022/hash/735c847a07bf6dd4486ca1ace242a88c-Abstract-Conference.html
Ask4Help: Learning to Leverage an Expert for Embodied Tasks.,"Kunal Pratap Singh, Luca Weihs, Alvaro Herrasti, Jonghyun Choi, Aniruddha Kembhavi, Roozbeh Mottaghi",NeurIPS,2022,http://papers.nips.cc/paper_files/paper/2022/hash/674ad201bc8fa74b3c9979230aa0c63b-Abstract-Conference.html
Defining and Characterizing Reward Gaming.,"Joar Skalse, Nikolaus H. R. Howe, Dmitrii Krasheninnikov, David Krueger 0001",NeurIPS,2022,http://papers.nips.cc/paper_files/paper/2022/hash/3d719fee332caa23d5038b8a90e81796-Abstract-Conference.html
EpiGRAF: Rethinking training of 3D GANs.,"Ivan Skorokhodov, Sergey Tulyakov, Yiqun Wang 0001, Peter Wonka",NeurIPS,2022,http://papers.nips.cc/paper_files/paper/2022/hash/9b01333262789ea3a65a5fab4c22feae-Abstract-Conference.html
Physics-Informed Implicit Representations of Equilibrium Network Flows.,"Kevin D. Smith, Francesco Seccamonte, Ananthram Swami, Francesco Bullo",NeurIPS,2022,http://papers.nips.cc/paper_files/paper/2022/hash/2f891d026c7ba978168621842bc6fe73-Abstract-Conference.html
Approximate Euclidean lengths and distances beyond Johnson-Lindenstrauss.,"Aleksandros Sobczyk, Mathieu Luisier",NeurIPS,2022,http://papers.nips.cc/paper_files/paper/2022/hash/7ac1846846f02b42dcfab5c40bc6ae56-Abstract-Conference.html
Fair Wrapping for Black-box Predictions.,"Alexander Soen, Ibrahim M. Alabdulmohsin, Sanmi Koyejo, Yishay Mansour, Nyalleng Moorosi, Richard Nock, Ke Sun 0001, Lexing Xie",NeurIPS,2022,http://papers.nips.cc/paper_files/paper/2022/hash/876b45367d9069f0e91e359c57155ab1-Abstract-Conference.html
Where to Pay Attention in Sparse Training for Feature Selection?,"Ghada Sokar, Zahra Atashgahi, Mykola Pechenizkiy, Decebal Constantin Mocanu",NeurIPS,2022,http://papers.nips.cc/paper_files/paper/2022/hash/0aa800df4298539770b57824afc77a89-Abstract-Conference.html
360-MLC: Multi-view Layout Consistency for Self-training and Hyper-parameter Tuning.,"Bolivar Solarte, Chin-Hsuan Wu, Yueh-Cheng Liu, Yi-Hsuan Tsai, Min Sun 0001",NeurIPS,2022,http://papers.nips.cc/paper_files/paper/2022/hash/286e7ab0ce6a68282394c92361c27b57-Abstract-Conference.html
Monte Carlo Tree Search based Variable Selection for High Dimensional Bayesian Optimization.,"Lei Song, Ke Xue 0001, Xiaobin Huang, Chao Qian 0001",NeurIPS,2022,http://papers.nips.cc/paper_files/paper/2022/hash/b6a171867138c80de2a35a6125d6757c-Abstract-Conference.html
FLAIR: Federated Learning Annotated Image Repository.,"Congzheng Song, Filip Granqvist, Kunal Talwar",NeurIPS,2022,http://papers.nips.cc/paper_files/paper/2022/hash/f64e55d03e2fe61aa4114e49cb654acb-Abstract-Datasets_and_Benchmarks.html
On the Robustness of Graph Neural Diffusion to Topology Perturbations.,"Yang Song 0012, Qiyu Kang, Sijie Wang, Kai Zhao, Wee Peng Tay",NeurIPS,2022,http://papers.nips.cc/paper_files/paper/2022/hash/29a0ea49a103a233b17c0705cdeccb66-Abstract-Conference.html
Transcormer: Transformer for Sentence Scoring with Sliding Language Modeling.,"Kaitao Song, Yichong Leng, Xu Tan 0003, Yicheng Zou, Tao Qin 0001, Dongsheng Li 0002",NeurIPS,2022,http://papers.nips.cc/paper_files/paper/2022/hash/486ff0b164cf92b0255fe39863bcf99e-Abstract-Conference.html
Communication-Efficient Topologies for Decentralized Learning with $O(1)$ Consensus Rate.,"Zhuoqing Song, Weijian Li, Kexin Jin, Lei Shi 0010, Ming Yan 0006, Wotao Yin, Kun Yuan",NeurIPS,2022,http://papers.nips.cc/paper_files/paper/2022/hash/0790ef700dd0072f4940abda9b7d0005-Abstract-Conference.html
Coordinate Linear Variance Reduction for Generalized Linear Programming.,"Chaobing Song, Cheuk Yin Lin, Stephen J. Wright 0001, Jelena Diakonikolas",NeurIPS,2022,http://papers.nips.cc/paper_files/paper/2022/hash/8a54a80ffc2834689ffdd0920202018e-Abstract-Conference.html
Sample-Efficient Learning of Correlated Equilibria in Extensive-Form Games.,"Ziang Song, Song Mei, Yu Bai 0017",NeurIPS,2022,http://papers.nips.cc/paper_files/paper/2022/hash/1a17a06de88cf77f25cda0da91615a54-Abstract-Conference.html
RankFeat: Rank-1 Feature Removal for Out-of-distribution Detection.,"Yue Song, Nicu Sebe, Wei Wang 0108",NeurIPS,2022,http://papers.nips.cc/paper_files/paper/2022/hash/71c9eb0913e6c7fda3afd69c914b1a0c-Abstract-Conference.html
Distributed Optimization for Overparameterized Problems: Achieving Optimal Dimension Independent Communication Complexity.,"Bingqing Song, Ioannis C. Tsaknakis, Chung-Yiu Yau, Hoi-To Wai, Mingyi Hong 0001",NeurIPS,2022,http://papers.nips.cc/paper_files/paper/2022/hash/28795419a644f41ede3fa058b13fc622-Abstract-Conference.html
OGC: Unsupervised 3D Object Segmentation from Rigid Dynamics of Point Clouds.,"Ziyang Song, Bo Yang 0027",NeurIPS,2022,http://papers.nips.cc/paper_files/paper/2022/hash/c6e3856954d23bec921f2d13d8c0e0e7-Abstract-Conference.html
Efficient and Effective Multi-task Grouping via Meta Learning on Task Combinations.,"Xiaozhuang Song, Shun Zheng, Wei Cao, James J. Q. Yu, Jiang Bian 0002",NeurIPS,2022,http://papers.nips.cc/paper_files/paper/2022/hash/f50f282a3093d36471008b045bd478af-Abstract-Conference.html
M2N: Mesh Movement Networks for PDE Solvers.,"Wenbin Song, Mingrui Zhang, Joseph G. Wallwork, Junpeng Gao, Zheng Tian 0002, Fanglei Sun, Matthew D. Piggott, Junqing Chen, Zuoqiang Shi, Xiang Chen, Jun Wang 0012",NeurIPS,2022,http://papers.nips.cc/paper_files/paper/2022/hash/2f88d8061f12abae9d14d376fd69c933-Abstract-Conference.html
Universality of Group Convolutional Neural Networks Based on Ridgelet Analysis on Groups.,"Sho Sonoda, Isao Ishikawa, Masahiro Ikeda",NeurIPS,2022,http://papers.nips.cc/paper_files/paper/2022/hash/fcc3dc27672a12510babe448d665e152-Abstract-Conference.html
Training stochastic stabilized supralinear networks by dynamics-neutral growth.,"Wayne Soo, Máté Lengyel",NeurIPS,2022,http://papers.nips.cc/paper_files/paper/2022/hash/bc827452450356f9f558f4e4568d553b-Abstract-Conference.html
Enhancing Safe Exploration Using Safety State Augmentation.,"Aivar Sootla, Alexander I. Cowen-Rivers, Jun Wang 0012, Haitham Bou-Ammar",NeurIPS,2022,http://papers.nips.cc/paper_files/paper/2022/hash/debd0ae2083160397a22a4a8831c7230-Abstract-Conference.html
Explain My Surprise: Learning Efficient Long-Term Memory by predicting uncertain outcomes.,"Artyom Y. Sorokin, Nazar Buzun, Leonid Pugachev, Mikhail Burtsev 0001",NeurIPS,2022,http://papers.nips.cc/paper_files/paper/2022/hash/ef7f6a2f18415e0e89edf50def91ecb6-Abstract-Conference.html
Beyond neural scaling laws: beating power law scaling via data pruning.,"Ben Sorscher, Robert Geirhos, Shashank Shekhar, Surya Ganguli, Ari Morcos",NeurIPS,2022,http://papers.nips.cc/paper_files/paper/2022/hash/7b75da9b61eda40fa35453ee5d077df6-Abstract-Conference.html
Shape And Structure Preserving Differential Privacy.,"Carlos Soto 0002, Karthik Bharath, Matthew Reimherr, Aleksandra B. Slavkovic",NeurIPS,2022,http://papers.nips.cc/paper_files/paper/2022/hash/9c84feb75eae1ef6389f31b3ef050b6a-Abstract-Conference.html
Sleeper Agent: Scalable Hidden Trigger Backdoors for Neural Networks Trained from Scratch.,"Hossein Souri, Liam Fowl, Rama Chellappa, Micah Goldblum, Tom Goldstein",NeurIPS,2022,http://papers.nips.cc/paper_files/paper/2022/hash/79eec295a3cd5785e18c61383e7c996b-Abstract-Conference.html
Decision Trees with Short Explainable Rules.,"Victor Feitosa Souza, Ferdinando Cicalese, Eduardo Sany Laber, Marco Molinaro 0001",NeurIPS,2022,http://papers.nips.cc/paper_files/paper/2022/hash/500637d931d4feb99d5cce84af1f53ba-Abstract-Conference.html
Provably expressive temporal graph networks.,"Amauri H. Souza, Diego Mesquita, Samuel Kaski, Vikas Garg 0001",NeurIPS,2022,http://papers.nips.cc/paper_files/paper/2022/hash/d029c97ee0db162c60f2ebc9cb93387e-Abstract-Conference.html
On the Convergence Theory for Hessian-Free Bilevel Algorithms.,"Daouda Sow, Kaiyi Ji, Yingbin Liang",NeurIPS,2022,http://papers.nips.cc/paper_files/paper/2022/hash/1a82986c9f321217f2ed407a14dcfa0b-Abstract-Conference.html
TTOpt: A Maximum Volume Quantized Tensor Train-based Optimization and its Application to Reinforcement Learning.,"Konstantin Sozykin, Andrei Chertkov, Roman Schutski, Anh-Huy Phan 0001, Andrzej S. Cichocki, Ivan V. Oseledets",NeurIPS,2022,http://papers.nips.cc/paper_files/paper/2022/hash/a730abbcd6cf4a371ca9545db5922442-Abstract-Conference.html
Online Algorithms for the Santa Claus Problem.,"Max Springer, MohammadTaghi Hajiaghayi, Debmalya Panigrahi, Mohammad Reza Khani",NeurIPS,2022,http://papers.nips.cc/paper_files/paper/2022/hash/c681fb2bf1d785fbc766f3ea14758aab-Abstract-Conference.html
Rare Gems: Finding Lottery Tickets at Initialization.,"Kartik Sreenivasan, Jy-yong Sohn, Liu Yang, Matthew Grinde, Alliot Nagle, Hongyi Wang 0001, Eric P. Xing, Kangwook Lee 0001, Dimitris S. Papailiopoulos",NeurIPS,2022,http://papers.nips.cc/paper_files/paper/2022/hash/5d52b102ebd672023628cac20e9da5ff-Abstract-Conference.html
Convergent Representations of Computer Programs in Human and Artificial Neural Networks.,"Shashank Srikant, Ben Lipkin, Anna A. Ivanova, Evelina Fedorenko, Una-May O&apos;Reilly",NeurIPS,2022,http://papers.nips.cc/paper_files/paper/2022/hash/77b5aaf2826c95c98e5eb4ab830073de-Abstract-Conference.html
Efficient Training of Low-Curvature Neural Networks.,"Suraj Srinivas, Kyle Matoba, Himabindu Lakkaraju, François Fleuret",NeurIPS,2022,http://papers.nips.cc/paper_files/paper/2022/hash/a6ec568ede6584b20dccfb6c2e4f2b58-Abstract-Conference.html
CLiMB: A Continual Learning Benchmark for Vision-and-Language Tasks.,"Tejas Srinivasan, Ting-Yun Chang, Leticia Leonor Pinto Alva, Georgios Chochlakis, Mohammad Rostami, Jesse Thomason",NeurIPS,2022,http://papers.nips.cc/paper_files/paper/2022/hash/bd3611971089d466ab4ca96a20f7ab13-Abstract-Datasets_and_Benchmarks.html
Toward Efficient Robust Training against Union of $\ell_p$ Threat Models.,"Gaurang Sriramanan, Maharshi Gor, Soheil Feizi",NeurIPS,2022,http://papers.nips.cc/paper_files/paper/2022/hash/a627b9468c319c13a70b7c2fb8df65a3-Abstract-Conference.html
Assistive Teaching of Motor Control Tasks to Humans.,"Megha Srivastava, Erdem Biyik, Suvir Mirchandani, Noah D. Goodman, Dorsa Sadigh",NeurIPS,2022,http://papers.nips.cc/paper_files/paper/2022/hash/b6fa3ed9624c184bd73e435123bd576a-Abstract-Conference.html
What You See is What You Classify: Black Box Attributions.,"Steven Stalder, Nathanaël Perraudin, Radhakrishna Achanta, Fernando Pérez-Cruz, Michele Volpi",NeurIPS,2022,http://papers.nips.cc/paper_files/paper/2022/hash/0073cc73e1873b35345209b50a3dab66-Abstract-Conference.html
Learning Dense Object Descriptors from Multiple Views for Low-shot Category Generalization.,"Stefan Stojanov, Anh Thai, Zixuan Huang 0001, James M. Rehg",NeurIPS,2022,http://papers.nips.cc/paper_files/paper/2022/hash/517a0884c56008f8bf9d5912ca771d71-Abstract-Conference.html
Posterior Matching for Arbitrary Conditioning.,"Ryan R. Strauss, Junier B. Oliva",NeurIPS,2022,http://papers.nips.cc/paper_files/paper/2022/hash/72dad0866fa5b0ef20cec94b8bd5763a-Abstract-Conference.html
Formalizing Consistency and Coherence of Representation Learning.,"Harald Strömfelt, Luke Dickens, Artur S. d&apos;Avila Garcez, Alessandra Russo",NeurIPS,2022,http://papers.nips.cc/paper_files/paper/2022/hash/2d95270d763751439626d91f57e9a750-Abstract-Conference.html
CARLANE: A Lane Detection Benchmark for Unsupervised Domain Adaptation from Simulation to multiple Real-World Domains.,"Bonifaz Stuhr, Johann Haselberger, Julian Gebele",NeurIPS,2022,http://papers.nips.cc/paper_files/paper/2022/hash/19a260641ebaf68d412f427e591bb74a-Abstract-Datasets_and_Benchmarks.html
INRAS: Implicit Neural Representation for Audio Scenes.,"Kun Su, Mingfei Chen, Eli Shlizerman",NeurIPS,2022,http://papers.nips.cc/paper_files/paper/2022/hash/35d5ad984cc0ddd84c6f1c177a2066e5-Abstract-Conference.html
A Contrastive Framework for Neural Text Generation.,"Yixuan Su, Tian Lan, Yan Wang 0060, Dani Yogatama, Lingpeng Kong, Nigel Collier",NeurIPS,2022,http://papers.nips.cc/paper_files/paper/2022/hash/871cae8f599cb8bbfcb0f58fe1af95ad-Abstract-Conference.html
Revisiting Realistic Test-Time Training: Sequential Inference and Adaptation by Anchored Clustering.,"Yongyi Su, Xun Xu 0002, Kui Jia",NeurIPS,2022,http://papers.nips.cc/paper_files/paper/2022/hash/6fcc2190f456464160921e98393bf50e-Abstract-Conference.html
Global Convergence of Federated Learning for Mixed Regression.,"Lili Su, Jiaming Xu, Pengkun Yang",NeurIPS,2022,http://papers.nips.cc/paper_files/paper/2022/hash/c132c02176577c4319a878f6417a331a-Abstract-Conference.html
GBA: A Tuning-free Approach to Switch between Synchronous and Asynchronous Training for Recommendation Models.,"Wenbo Su, Yuanxing Zhang, Yufeng Cai, Kaixu Ren, Pengjie Wang, Huimin Yi, Yue Song, Jing Chen, Hongbo Deng, Jian Xu 0015, Lin Qu, Bo Zheng 0007",NeurIPS,2022,http://papers.nips.cc/paper_files/paper/2022/hash/be0a8ecf8b2743a4117557c5eca0fb79-Abstract-Conference.html
Distributed Influence-Augmented Local Simulators for Parallel MARL in Large Networked Systems.,"Miguel Suau, Jinke He, Mustafa Mert Çelikok, Matthijs T. J. Spaan, Frans A. Oliehoek",NeurIPS,2022,http://papers.nips.cc/paper_files/paper/2022/hash/b5c8c1c117618267944b2617add0a766-Abstract-Conference.html
Generalization for multiclass classification with overparameterized linear models.,"Vignesh Subramanian, Rahul Arya, Anant Sahai",NeurIPS,2022,http://papers.nips.cc/paper_files/paper/2022/hash/94b472a1842cd7c56dcb125fb2765fbd-Abstract-Conference.html
On the Discrimination Risk of Mean Aggregation Feature Imputation in Graphs.,"Arjun Subramonian, Kai-Wei Chang, Yizhou Sun",NeurIPS,2022,http://papers.nips.cc/paper_files/paper/2022/hash/d4c2f25bf0c33065b7d4fb9be2a9add1-Abstract-Conference.html
Robust Anytime Learning of Markov Decision Processes.,"Marnix Suilen, Thiago D. Simão, David Parker 0001, Nils Jansen 0001",NeurIPS,2022,http://papers.nips.cc/paper_files/paper/2022/hash/b931c44c35ce09e942edab7003eb3daa-Abstract-Conference.html
"How to talk so AI will learn: Instructions, descriptions, and autonomy.","Theodore R. Sumers, Robert D. Hawkins, Mark K. Ho, Tom Griffiths 0001, Dylan Hadfield-Menell",NeurIPS,2022,http://papers.nips.cc/paper_files/paper/2022/hash/e0cfde0ff720fa9674bb976e7f1b99d4-Abstract-Conference.html
"Debiased, Longitudinal and Coordinated Drug Recommendation through Multi-Visit Clinic Records.","Hongda Sun 0001, Shufang Xie 0003, Shuqi Li, Yuhan Chen, Ji-Rong Wen, Rui Yan 0001",NeurIPS,2022,http://papers.nips.cc/paper_files/paper/2022/hash/b295b3a940706f431076c86b78907757-Abstract-Conference.html
Mirror Descent Maximizes Generalized Margin and Can Be Implemented Efficiently.,"Haoyuan Sun, Kwangjun Ahn, Christos Thrampoulidis, Navid Azizan",NeurIPS,2022,http://papers.nips.cc/paper_files/paper/2022/hash/c9694bf4f9bf3626f7d21158bab74f8e-Abstract-Conference.html
Singular Value Fine-tuning: Few-shot Segmentation requires Few-parameters Fine-tuning.,"Yanpeng Sun, Qiang Chen 0007, Xiangyu He, Jian Wang 0066, Haocheng Feng, Junyu Han, Errui Ding, Jian Cheng 0001, Zechao Li, Jingdong Wang 0001",NeurIPS,2022,http://papers.nips.cc/paper_files/paper/2022/hash/f3bfbd65743e60c685a3845bd61ce15f-Abstract-Conference.html
SKFlow: Learning Optical Flow with Super Kernels.,"Shangkun Sun, Yuanqi Chen, Yu Zhu, Guodong Guo, Ge Li",NeurIPS,2022,http://papers.nips.cc/paper_files/paper/2022/hash/4990dad2c1696224de42573d0222554a-Abstract-Conference.html
Optimal Scaling for Locally Balanced Proposals in Discrete Spaces.,"Haoran Sun, Hanjun Dai, Dale Schuurmans",NeurIPS,2022,http://papers.nips.cc/paper_files/paper/2022/hash/96c6f409a374b5c81d2efa4bc5526f27-Abstract-Conference.html
Does GNN Pretraining Help Molecular Representation?,"Ruoxi Sun 0002, Hanjun Dai, Adams Wei Yu",NeurIPS,2022,http://papers.nips.cc/paper_files/paper/2022/hash/4ec360efb3f52643ac43fda570ec0118-Abstract-Conference.html
Entropy-Driven Mixed-Precision Quantization for Deep Network Design.,"Zhenhong Sun, Ce Ge, Junyan Wang 0001, Ming C. Lin, Hesen Chen, Hao Li 0030, Xiuyu Sun",NeurIPS,2022,http://papers.nips.cc/paper_files/paper/2022/hash/86e7ebb16d33d59e62d1b0a079ea058d-Abstract-Conference.html
Exploit Reward Shifting in Value-Based Deep-RL: Optimistic Curiosity-Based Exploration and Conservative Exploitation via Linear Reward Shaping.,"Hao Sun, Lei Han 0001, Rui Yang 0010, Xiaoteng Ma, Jian Guo, Bolei Zhou",NeurIPS,2022,http://papers.nips.cc/paper_files/paper/2022/hash/f600d1a3f6a63f782680031f3ce241a7-Abstract-Conference.html
DualCoOp: Fast Adaptation to Multi-Label Recognition with Limited Annotations.,"Ximeng Sun, Ping Hu 0001, Kate Saenko",NeurIPS,2022,http://papers.nips.cc/paper_files/paper/2022/hash/c5169260ef32d1bd3597c14d8c89b034-Abstract-Conference.html
Bayesian Spline Learning for Equation Discovery of Nonlinear Dynamics with Quantified Uncertainty.,"Luning Sun, Daniel Huang 0005, Hao Sun 0002, Jian-Xun Wang 0001",NeurIPS,2022,http://papers.nips.cc/paper_files/paper/2022/hash/2df278b7fbbea06c3892d2f4388640b6-Abstract-Conference.html
Interaction Modeling with Multiplex Attention.,"Fan-Yun Sun, Isaac Kauvar, Ruohan Zhang, Jiachen Li 0001, Mykel J. Kochenderfer, Jiajun Wu 0001, Nick Haber",NeurIPS,2022,http://papers.nips.cc/paper_files/paper/2022/hash/7e6361a5d73a8fab093dd8453e0b106f-Abstract-Conference.html
Exploring Example Influence in Continual Learning.,"Qing Sun, Fan Lyu, Fanhua Shang, Wei Feng 0005, Liang Wan",NeurIPS,2022,http://papers.nips.cc/paper_files/paper/2022/hash/ad2fa437f7c23e4e9875599c6065d18a-Abstract-Conference.html
Surprising Instabilities in Training Deep Networks and a Theoretical Analysis.,"Yuxin Sun, Dong Lao, Ganesh Sundaramoorthi, Anthony J. Yezzi",NeurIPS,2022,http://papers.nips.cc/paper_files/paper/2022/hash/7b97adeafa1c51cf65263459ca9d0d7c-Abstract-Conference.html
ShuffleMixer: An Efficient ConvNet for Image Super-Resolution.,"Long Sun, Jinshan Pan, Jinhui Tang 0001",NeurIPS,2022,http://papers.nips.cc/paper_files/paper/2022/hash/6e60a9023d2c63f7f0856910129ae753-Abstract-Conference.html
Rethinking Image Restoration for Object Detection.,"Shangquan Sun, Wenqi Ren, Tao Wang, Xiaochun Cao",NeurIPS,2022,http://papers.nips.cc/paper_files/paper/2022/hash/1cac8326ce3fbe79171db9754211530c-Abstract-Conference.html
A Communication-efficient Algorithm with Linear Convergence for Federated Minimax Learning.,"Zhenyu Sun, Ermin Wei",NeurIPS,2022,http://papers.nips.cc/paper_files/paper/2022/hash/28553688c204ddbb06a51e00684f8bb7-Abstract-Conference.html
You Never Stop Dancing: Non-freezing Dance Generation via Bank-constrained Manifold Projection.,"Jiangxin Sun, Chunyu Wang, Huang Hu, Hanjiang Lai, Zhi Jin, Jian-Fang Hu",NeurIPS,2022,http://papers.nips.cc/paper_files/paper/2022/hash/40bfe6177e8aed33c982264cf9e6e62c-Abstract-Conference.html
Controllable 3D Face Synthesis with Conditional Generative Occupancy Fields.,"Keqiang Sun, Shangzhe Wu, Zhaoyang Huang, Ning Zhang, Quan Wang, Hongsheng Li 0001",NeurIPS,2022,http://papers.nips.cc/paper_files/paper/2022/hash/67b0e7c7c2a5780aeefe3b79caac106e-Abstract-Conference.html
Long-Form Video-Language Pre-Training with Multimodal Temporal Contrastive Learning.,"Yuchong Sun, Hongwei Xue, Ruihua Song, Bei Liu 0001, Huan Yang 0005, Jianlong Fu",NeurIPS,2022,http://papers.nips.cc/paper_files/paper/2022/hash/f8290ccc2905538be1a7f7914ccef629-Abstract-Conference.html
PaCo: Parameter-Compositional Multi-task Reinforcement Learning.,"Lingfeng Sun, Haichao Zhang 0001, Wei Xu 0017, Masayoshi Tomizuka",NeurIPS,2022,http://papers.nips.cc/paper_files/paper/2022/hash/86b8ad667206fb9a52ae575fbf1cd6be-Abstract-Conference.html
Towards Lightweight Black-Box Attack Against Deep Neural Networks.,"Chenghao Sun, Yonggang Zhang, Chaoqun Wan, Qizhou Wang, Ya Li, Tongliang Liu, Bo Han 0003, Xinmei Tian 0001",NeurIPS,2022,http://papers.nips.cc/paper_files/paper/2022/hash/7a9745f251508a053425a256490b0665-Abstract-Conference.html
Reduced Representation of Deformation Fields for Effective Non-rigid Shape Matching.,"Ramana Sundararaman, Riccardo Marin, Emanuele Rodolà, Maks Ovsjanikov",NeurIPS,2022,http://papers.nips.cc/paper_files/paper/2022/hash/43d1d3bdd92204c96fa4ac3c578f6a33-Abstract-Conference.html
LST: Ladder Side-Tuning for Parameter and Memory Efficient Transfer Learning.,"Yi-Lin Sung, Jaemin Cho 0001, Mohit Bansal",NeurIPS,2022,http://papers.nips.cc/paper_files/paper/2022/hash/54801e196796134a2b0ae5e8adef502f-Abstract-Conference.html
Surprise Minimizing Multi-Agent Learning with Energy-based Models.,"Karush Suri, Xiao Qi Shi, Konstantinos N. Plataniotis, Yuri A. Lawryshyn",NeurIPS,2022,http://papers.nips.cc/paper_files/paper/2022/hash/28dad4a70f748a2980998d3ed0f1b8d2-Abstract-Conference.html
Representing Spatial Trajectories as Distributions.,"Dídac Surís, Carl Vondrick",NeurIPS,2022,http://papers.nips.cc/paper_files/paper/2022/hash/58f4a9ca9031ff197cb4a61b456574bf-Abstract-Conference.html
Algorithms that Approximate Data Removal: New Results and Limitations.,"Vinith M. Suriyakumar, Ashia C. Wilson",NeurIPS,2022,http://papers.nips.cc/paper_files/paper/2022/hash/77c7faab15002432ba1151e8d5cc389a-Abstract-Conference.html
Parallel Tempering With a Variational Reference.,"Nikola Surjanovic, Saifuddin Syed, Alexandre Bouchard-Côté, Trevor Campbell",NeurIPS,2022,http://papers.nips.cc/paper_files/paper/2022/hash/03cd3cf3f74d4f9ce5958de269960884-Abstract-Conference.html
Continuously Tempered PDMP samplers.,"Matthew Sutton, Robert Salomone, Augustin Chevallier, Paul Fearnhead",NeurIPS,2022,http://papers.nips.cc/paper_files/paper/2022/hash/b5b939436789f76f08b9d0da5e81af7c-Abstract-Conference.html
Sequence Model Imitation Learning with Unobserved Contexts.,"Gokul Swamy, Sanjiban Choudhury, J. Andrew Bagnell, Zhiwei Steven Wu",NeurIPS,2022,http://papers.nips.cc/paper_files/paper/2022/hash/708e58b0b99e3e62d42022b4564bad7a-Abstract-Conference.html
Minimax Optimal Online Imitation Learning via Replay Estimation.,"Gokul Swamy, Nived Rajaraman, Matthew Peng, Sanjiban Choudhury, J. Andrew Bagnell, Steven Wu 0001, Jiantao Jiao, Kannan Ramchandran",NeurIPS,2022,http://papers.nips.cc/paper_files/paper/2022/hash/2e809adc337594e0fee330a64acbb982-Abstract-Conference.html
On the Interpretability of Regularisation for Neural Networks Through Model Gradient Similarity.,"Vincent Szolnoky, Viktor Andersson, Balázs Kulcsár, Rebecka Jörnsten",NeurIPS,2022,http://papers.nips.cc/paper_files/paper/2022/hash/67b0579a7298d9cf39c59404d867bdd7-Abstract-Conference.html
Sparse Winning Tickets are Data-Efficient Image Recognizers.,"Mukund Varma T., Xuxi Chen, Zhenyu Zhang 0015, Tianlong Chen, Subhashini Venugopalan, Zhangyang Wang",NeurIPS,2022,http://papers.nips.cc/paper_files/paper/2022/hash/1e0bfe8bbaa0e70809f0a8ccd9c2ff3e-Abstract-Conference.html
Unsupervised Learning From Incomplete Measurements for Inverse Problems.,"Julián Tachella, Dongdong Chen 0004, Mike E. Davies 0001",NeurIPS,2022,http://papers.nips.cc/paper_files/paper/2022/hash/203e651b448deba5de5f45430c45ea04-Abstract-Conference.html
Meta-Learning with Self-Improving Momentum Target.,"Jihoon Tack, Jongjin Park, Hankook Lee, Jaeho Lee 0001, Jinwoo Shin",NeurIPS,2022,http://papers.nips.cc/paper_files/paper/2022/hash/29440165fee0471389ba3f80a7b3f95f-Abstract-Conference.html
Visual correspondence-based explanations improve AI robustness and human-AI team accuracy.,"Mohammad Reza Taesiri, Giang Nguyen 0004, Anh Nguyen 0002",NeurIPS,2022,http://papers.nips.cc/paper_files/paper/2022/hash/ddb8486bf9ee0fdeca1866a13a96e98e-Abstract-Conference.html
MaskTune: Mitigating Spurious Correlations by Forcing to Explore.,"Saeid Asgari Taghanaki, Aliasghar Khani, Fereshte Khani, Ali Gholami, Linh Tran, Ali Mahdavi-Amiri, Ghassan Hamarneh",NeurIPS,2022,http://papers.nips.cc/paper_files/paper/2022/hash/93be245fce00a9bb2333c17ceae4b732-Abstract-Conference.html
Learning Interface Conditions in Domain Decomposition Solvers.,"Ali Taghibakhshi, Nicolas Nytko, Tareq Uz Zaman, Scott P. MacLachlan, Luke N. Olson, Matthew West 0001",NeurIPS,2022,http://papers.nips.cc/paper_files/paper/2022/hash/2f8928efe957139e9c0efc98f173f4be-Abstract-Conference.html
Spartan: Differentiable Sparsity via Regularized Transportation.,"Kai Sheng Tai, Tai-Peng Tian, Ser Nam Lim",NeurIPS,2022,http://papers.nips.cc/paper_files/paper/2022/hash/1afb9ca4adf1d9cb3c87ff3e22a29049-Abstract-Conference.html
On the Effect of Pre-training for Transformer in Different Modality on Offline Reinforcement Learning.,Shiro Takagi,NeurIPS,2022,http://papers.nips.cc/paper_files/paper/2022/hash/c5eddf0069fe150ac2c768e2969e38d1-Abstract-Conference.html
PDEBench: An Extensive Benchmark for Scientific Machine Learning.,"Makoto Takamoto, Timothy Praditia, Raphael Leiteritz, Daniel MacKinlay, Francesco Alesiani, Dirk Pflüger, Mathias Niepert",NeurIPS,2022,http://papers.nips.cc/paper_files/paper/2022/hash/0a9747136d411fb83f0cf81820d44afb-Abstract-Datasets_and_Benchmarks.html
Semantic Exploration from Language Abstractions and Pretrained Representations.,"Allison C. Tam, Neil C. Rabinowitz, Andrew K. Lampinen, Nicholas A. Roy, Stephanie C. Y. Chan, DJ Strouse, Jane Wang 0001, Andrea Banino, Felix Hill",NeurIPS,2022,http://papers.nips.cc/paper_files/paper/2022/hash/a28e024ccd623ed113fb19683fa0910d-Abstract-Conference.html
