Title,Authors,Venue,Year,URL
A Comprehensive Study on Large-Scale Graph Training: Benchmarking and Rethinking.,"Keyu Duan, Zirui Liu 0001, Peihao Wang, Wenqing Zheng, Kaixiong Zhou, Tianlong Chen, Xia Hu 0001, Zhangyang Wang",NeurIPS,2022,http://papers.nips.cc/paper_files/paper/2022/hash/23ee05bf1f4ade71c0f8f5ca722df601-Abstract-Datasets_and_Benchmarks.html
Scalable Interpretability via Polynomials.,"Abhimanyu Dubey, Filip Radenovic, Dhruv Mahajan 0001",NeurIPS,2022,http://papers.nips.cc/paper_files/paper/2022/hash/ee81a23d6b83ac15fbeb5b7a30934e0b-Abstract-Conference.html
Fast Stochastic Composite Minimization and an Accelerated Frank-Wolfe Algorithm under Parallelization.,"Benjamin Dubois-Taine, Francis R. Bach, Quentin Berthet, Adrien B. Taylor",NeurIPS,2022,http://papers.nips.cc/paper_files/paper/2022/hash/d903c4bb4e77f5de1ec92da2cf9dc8db-Abstract-Conference.html
Improving Self-Supervised Learning by Characterizing Idealized Representations.,"Yann Dubois, Stefano Ermon, Tatsunori B. Hashimoto, Percy Liang",NeurIPS,2022,http://papers.nips.cc/paper_files/paper/2022/hash/494f876fad056843f310ad647274dd99-Abstract-Conference.html
Subspace Recovery from Heterogeneous Data with Non-isotropic Noise.,"John C. Duchi, Vitaly Feldman, Lunjia Hu, Kunal Talwar",NeurIPS,2022,http://papers.nips.cc/paper_files/paper/2022/hash/26ded5c8ee8ec1bc4caced4e1c9b1584-Abstract-Conference.html
Graph Neural Networks are Dynamic Programmers.,"Andrew Joseph Dudzik, Petar Velickovic",NeurIPS,2022,http://papers.nips.cc/paper_files/paper/2022/hash/8248b1ded388fcdbbd121bcdfea3068c-Abstract-Conference.html
Quantifying Statistical Significance of Neural Network-based Image Segmentation by Selective Inference.,"Vo Nguyen Le Duy, Shogo Iwazaki, Ichiro Takeuchi",NeurIPS,2022,http://papers.nips.cc/paper_files/paper/2022/hash/cd706106802dbea2068efd7031c3b420-Abstract-Conference.html
Long Range Graph Benchmark.,"Vijay Prakash Dwivedi, Ladislav Rampásek, Michael Galkin, Ali Parviz, Guy Wolf, Anh Tuan Luu, Dominique Beaini",NeurIPS,2022,http://papers.nips.cc/paper_files/paper/2022/hash/8c3c666820ea055a77726d66fc7d447f-Abstract-Datasets_and_Benchmarks.html
DiSC: Differential Spectral Clustering of Features.,"Ram Dyuthi Sristi, Gal Mishne, Ariel Jaffe",NeurIPS,2022,http://papers.nips.cc/paper_files/paper/2022/hash/a84953147312ea2e8b020e53a267321b-Abstract-Conference.html
Dataset Inference for Self-Supervised Models.,"Adam Dziedzic, Haonan Duan, Muhammad Ahmad Kaleem, Nikita Dhawan, Jonas Guan, Yannis Cattan, Franziska Boenisch, Nicolas Papernot",NeurIPS,2022,http://papers.nips.cc/paper_files/paper/2022/hash/4ebf0617b32da2cd083c3b17c7285cce-Abstract-Conference.html
Non-Markovian Reward Modelling from Trajectory Labels via Interpretable Multiple Instance Learning.,"Joseph Early, Tom Bewley, Christine Evers, Sarvapali D. Ramchurn",NeurIPS,2022,http://papers.nips.cc/paper_files/paper/2022/hash/b157cfde6794e93b2353b9712bbd45a5-Abstract-Conference.html
Probable Domain Generalization via Quantile Risk Minimization.,"Cian Eastwood, Alexander Robey, Shashank Singh 0011, Julius von Kügelgen, Hamed Hassani, George J. Pappas, Bernhard Schölkopf",NeurIPS,2022,http://papers.nips.cc/paper_files/paper/2022/hash/6f11132f6ecbbcafafdf6decfc98f7be-Abstract-Conference.html
Is Sortition Both Representative and Fair?,"Soroush Ebadian, Gregory Kehne, Evi Micha, Ariel D. Procaccia, Nisarg Shah 0001",NeurIPS,2022,http://papers.nips.cc/paper_files/paper/2022/hash/165bbd0a0a1b9470ec34d5afec582d2e-Abstract-Conference.html
On Learning and Refutation in Noninteractive Local Differential Privacy.,"Alexander Edmonds, Aleksandar Nikolov, Toniann Pitassi",NeurIPS,2022,http://papers.nips.cc/paper_files/paper/2022/hash/7418d4cfa9c095d8bd06af7deb95ad54-Abstract-Conference.html
Training Uncertainty-Aware Classifiers with Conformalized Deep Learning.,"Bat-Sheva Einbinder, Yaniv Romano, Matteo Sesia, Yanfei Zhou",NeurIPS,2022,http://papers.nips.cc/paper_files/paper/2022/hash/8c96b559340daa7bb29f56ccfbbc9c2f-Abstract-Conference.html
A Lagrangian Duality Approach to Active Learning.,"Juan Elenter, Navid Naderializadeh, Alejandro Ribeiro",NeurIPS,2022,http://papers.nips.cc/paper_files/paper/2022/hash/f475bdd151d8b5fa01215aeda925e75c-Abstract-Conference.html
SAVi++: Towards End-to-End Object-Centric Learning from Real-World Videos.,"Gamaleldin F. Elsayed, Aravindh Mahendran, Sjoerd van Steenkiste, Klaus Greff, Michael C. Mozer, Thomas Kipf",NeurIPS,2022,http://papers.nips.cc/paper_files/paper/2022/hash/ba1a6ba05319e410f0673f8477a871e3-Abstract-Conference.html
A time-resolved theory of information encoding in recurrent neural networks.,"Rainer Engelken, Sven Goedeke",NeurIPS,2022,http://papers.nips.cc/paper_files/paper/2022/hash/e6f29fb27bb400f89f5584c175005679-Abstract-Conference.html
Forward-Backward Latent State Inference for Hidden Continuous-Time semi-Markov Chains.,"Nicolai Engelmann, Heinz Koeppl",NeurIPS,2022,http://papers.nips.cc/paper_files/paper/2022/hash/36ecc1d1b883afc0e882876cbdd123ab-Abstract-Conference.html
Adversarial Reprogramming Revisited.,"Matthias Englert, Ranko Lazic 0001",NeurIPS,2022,http://papers.nips.cc/paper_files/paper/2022/hash/b734c30b9c955c535e333f0301f5e45c-Abstract-Conference.html
Sparse Interaction Additive Networks via Feature Interaction Detection and Sparse Selection.,"James Enouen, Yan Liu 0002",NeurIPS,2022,http://papers.nips.cc/paper_files/paper/2022/hash/5a3674849d6d6d23ac088b9a2552f323-Abstract-Conference.html
Differentially Private Graph Learning via Sensitivity-Bounded Personalized PageRank.,"Alessandro Epasto, Vahab Mirrokni, Bryan Perozzi, Anton Tsitsulin, Peilin Zhong",NeurIPS,2022,http://papers.nips.cc/paper_files/paper/2022/hash/8df90a1440ce782d1f5607b7a38f2531-Abstract-Conference.html
Memory Efficient Continual Learning with Transformers.,"Beyza Ermis, Giovanni Zappella, Martin Wistuba, Aditya Rawal, Cédric Archambeau",NeurIPS,2022,http://papers.nips.cc/paper_files/paper/2022/hash/4522de4178bddb36b49aa26efad537cf-Abstract-Conference.html
Anonymous Bandits for Multi-User Systems.,"Hossein Esfandiari, Vahab Mirrokni, Jon Schneider",NeurIPS,2022,http://papers.nips.cc/paper_files/paper/2022/hash/50a057e9fe79ffa3f4120fb6fb88071a-Abstract-Conference.html
Learning on the Edge: Online Learning with Stochastic Feedback Graphs.,"Emmanuel Esposito, Federico Fusco, Dirk van der Hoeven, Nicolò Cesa-Bianchi",NeurIPS,2022,http://papers.nips.cc/paper_files/paper/2022/hash/e0e956681b04ac126679e8c7dd706b2e-Abstract-Conference.html
On Sample Optimality in Personalized Collaborative and Federated Learning.,"Mathieu Even, Laurent Massoulié, Kevin Scaman",NeurIPS,2022,http://papers.nips.cc/paper_files/paper/2022/hash/01cea7793f3c68af2e4989fc66bf8fb0-Abstract-Conference.html
Mismatched No More: Joint Model-Policy Optimization for Model-Based RL.,"Benjamin Eysenbach, Alexander Khazatsky, Sergey Levine, Ruslan Salakhutdinov",NeurIPS,2022,http://papers.nips.cc/paper_files/paper/2022/hash/935151cc6cb5d8b6816133b75233775a-Abstract-Conference.html
Imitating Past Successes can be Very Suboptimal.,"Benjamin Eysenbach, Soumith Udatha, Russ Salakhutdinov, Sergey Levine",NeurIPS,2022,http://papers.nips.cc/paper_files/paper/2022/hash/284afdc2309f9667d2d4fb9290235b0c-Abstract-Conference.html
Contrastive Learning as Goal-Conditioned Reinforcement Learning.,"Benjamin Eysenbach, Tianjun Zhang, Sergey Levine, Ruslan Salakhutdinov",NeurIPS,2022,http://papers.nips.cc/paper_files/paper/2022/hash/e7663e974c4ee7a2b475a4775201ce1f-Abstract-Conference.html
Harmonizing the object recognition strategies of deep neural networks with humans.,"Thomas Fel, Ivan F. Rodriguez Rodriguez, Drew Linsley, Thomas Serre",NeurIPS,2022,http://papers.nips.cc/paper_files/paper/2022/hash/3d681cc4487b97c08e5aa67224dd74f2-Abstract-Conference.html
HUMUS-Net: Hybrid Unrolled Multi-scale Network Architecture for Accelerated MRI Reconstruction.,"Zalan Fabian, Berk Tinaz, Mahdi Soltanolkotabi",NeurIPS,2022,http://papers.nips.cc/paper_files/paper/2022/hash/a1bb3f96e255ae1e04325ae166bcef0f-Abstract-Conference.html
Subquadratic Kronecker Regression with Applications to Tensor Decomposition.,"Matthew Fahrbach, Gang Fu, Mehrdad Ghadiri",NeurIPS,2022,http://papers.nips.cc/paper_files/paper/2022/hash/b9121bbb3112975d33c527f046ae68f2-Abstract-Conference.html
A Multi-Resolution Framework for U-Nets with Applications to Hierarchical VAEs.,"Fabian Falck, Christopher Williams, Dominic Danks, George Deligiannidis, Christopher Yau, Chris C. Holmes, Arnaud Doucet, Matthew Willetts",NeurIPS,2022,http://papers.nips.cc/paper_files/paper/2022/hash/63f471bb806bf5a3c0a19a99acf5a12a-Abstract-Conference.html
Private Graph All-Pairwise-Shortest-Path Distance Release with Improved Error Rate.,"Chenglin Fan, Ping Li 0001, Xiaoyun Li",NeurIPS,2022,http://papers.nips.cc/paper_files/paper/2022/hash/71b17f00017da0d73823ccf7fbce2d4f-Abstract-Conference.html
Debiasing Graph Neural Networks via Learning Disentangled Causal Substructure.,"Shaohua Fan, Xiao Wang 0017, Yanhu Mo, Chuan Shi, Jian Tang",NeurIPS,2022,http://papers.nips.cc/paper_files/paper/2022/hash/9e47a0bc530cc88b09b7670d2c130a29-Abstract-Conference.html
Robust Bayesian Regression via Hard Thresholding.,"Zheyi Fan, Zhaohui Li, Qingpei Hu",NeurIPS,2022,http://papers.nips.cc/paper_files/paper/2022/hash/6a4262293ca91c5af2dfab24bd343b43-Abstract-Conference.html
A Simple Approach to Automated Spectral Clustering.,"Jicong Fan 0001, Yiheng Tu, Zhao Zhang 0001, Mingbo Zhao, Haijun Zhang 0002",NeurIPS,2022,http://papers.nips.cc/paper_files/paper/2022/hash/407fb8c5f3fda374c57d1bb18313ea5d-Abstract-Conference.html
MineDojo: Building Open-Ended Embodied Agents with Internet-Scale Knowledge.,"Linxi Fan, Guanzhi Wang, Yunfan Jiang 0001, Ajay Mandlekar, Yuncong Yang, Haoyi Zhu, Andrew Tang, De-An Huang, Yuke Zhu, Anima Anandkumar",NeurIPS,2022,http://papers.nips.cc/paper_files/paper/2022/hash/74a67268c5cc5910f64938cac4526a90-Abstract-Datasets_and_Benchmarks.html
Fully Sparse 3D Object Detection.,"Lue Fan, Feng Wang 0015, Naiyan Wang, Zhaoxiang Zhang 0001",NeurIPS,2022,http://papers.nips.cc/paper_files/paper/2022/hash/0247fa3c511bbc415c8b768ee7b32f9e-Abstract-Conference.html
DigGAN: Discriminator gradIent Gap Regularization for GAN Training with Limited Data.,"Tiantian Fang, Ruoyu Sun 0001, Alexander G. Schwing",NeurIPS,2022,http://papers.nips.cc/paper_files/paper/2022/hash/ce26d21662c979d515164b416d4571fe-Abstract-Conference.html
Is Out-of-Distribution Detection Learnable?,"Zhen Fang 0001, Yixuan Li 0001, Jie Lu 0001, Jiahua Dong 0001, Bo Han 0003, Feng Liu 0003",NeurIPS,2022,http://papers.nips.cc/paper_files/paper/2022/hash/f0e91b1314fa5eabf1d7ef6d1561ecec-Abstract-Conference.html
An In-depth Study of Stochastic Backpropagation.,"Jun Fang, Mingze Xu, Hao Chen 0024, Bing Shuai, Zhuowen Tu, Joseph Tighe",NeurIPS,2022,http://papers.nips.cc/paper_files/paper/2022/hash/890e018ca9c879c5ac01757239538f7c-Abstract-Conference.html
Thompson Sampling Efficiently Learns to Control Diffusion Processes.,"Mohamad Kazem Shirani Faradonbeh, Mohamad Sadegh Shirani Faradonbeh, Mohsen Bayati",NeurIPS,2022,http://papers.nips.cc/paper_files/paper/2022/hash/18c54ed6e0cc390d750f64927dbc4e93-Abstract-Conference.html
Markovian Interference in Experiments.,"Vivek F. Farias, Andrew A. Li, Tianyi Peng, Andrew Zheng",NeurIPS,2022,http://papers.nips.cc/paper_files/paper/2022/hash/03a9a9c1e15850439653bb971a4ad4b3-Abstract-Conference.html
Near-Optimal No-Regret Learning Dynamics for General Convex Games.,"Gabriele Farina, Ioannis Anagnostides, Haipeng Luo, Chung-Wei Lee, Christian Kroer, Tuomas Sandholm",NeurIPS,2022,http://papers.nips.cc/paper_files/paper/2022/hash/ffa1301939cc707d6e986e6c4124340b-Abstract-Conference.html
Semi-Supervised Generative Models for Multiagent Trajectories.,"Dennis Fassmeyer, Pascal Fassmeyer, Ulf Brefeld",NeurIPS,2022,http://papers.nips.cc/paper_files/paper/2022/hash/f1fb6b2746332167f6670655372186cb-Abstract-Conference.html
Sharp Analysis of Stochastic Optimization under Global Kurdyka-Lojasiewicz Inequality.,"Ilyas Fatkhullin, Jalal Etesami, Niao He, Negar Kiyavash",NeurIPS,2022,http://papers.nips.cc/paper_files/paper/2022/hash/65ae674df2fb642518ae8d2b5435e1b8-Abstract-Conference.html
In the Eye of the Beholder: Robust Prediction with Causal User Modeling.,"Amir Feder, Guy Horowitz, Yoav Wald, Roi Reichart, Nir Rosenfeld",NeurIPS,2022,http://papers.nips.cc/paper_files/paper/2022/hash/5cebc89b113920dbff7c79854ba765a3-Abstract-Conference.html
UDC: Unified DNAS for Compressible TinyML Models for Neural Processing Units.,"Igor Fedorov, Ramon Matas Navarro, Hokchhay Tann, Chuteng Zhou, Matthew Mattina, Paul N. Whatmough",NeurIPS,2022,http://papers.nips.cc/paper_files/paper/2022/hash/753d9584b57ba01a10482f1ea7734a89-Abstract-Conference.html
Masked Autoencoders As Spatiotemporal Learners.,"Christoph Feichtenhofer, Haoqi Fan 0001, Yanghao Li, Kaiming He",NeurIPS,2022,http://papers.nips.cc/paper_files/paper/2022/hash/e97d1081481a4017df96b51be31001d3-Abstract-Conference.html
Off-Policy Evaluation with Deficient Support Using Side Information.,"Nicolò Felicioni, Maurizio Ferrari Dacrema, Marcello Restelli, Paolo Cremonesi",NeurIPS,2022,http://papers.nips.cc/paper_files/paper/2022/hash/c32be49c09eec3aad1f2bb587543e7f6-Abstract-Conference.html
Cross-Image Context for Single Image Inpainting.,"Tingliang Feng, Wei Feng 0005, Weiqi Li, Di Lin 0002",NeurIPS,2022,http://papers.nips.cc/paper_files/paper/2022/hash/09b6e009612875dd0a7291d5f4fd8b49-Abstract-Conference.html
How Powerful are K-hop Message Passing Graph Neural Networks.,"Jiarui Feng, Yixin Chen 0001, Fuhai Li, Anindya Sarkar, Muhan Zhang",NeurIPS,2022,http://papers.nips.cc/paper_files/paper/2022/hash/1ece70d2259b8e9510e2d4ca8754cecf-Abstract-Conference.html
Left Heavy Tails and the Effectiveness of the Policy and Value Networks in DNN-based best-first search for Sokoban Planning.,"Dieqiao Feng, Carla P. Gomes, Bart Selman",NeurIPS,2022,http://papers.nips.cc/paper_files/paper/2022/hash/eb7295a8bc613b375726659c2ecd6f14-Abstract-Conference.html
Factored Adaptation for Non-Stationary Reinforcement Learning.,"Fan Feng, Biwei Huang, Kun Zhang 0001, Sara Magliacane",NeurIPS,2022,http://papers.nips.cc/paper_files/paper/2022/hash/cf4356f994917177213c55ff438ddf71-Abstract-Conference.html
Lipschitz Bandits with Batched Feedback.,"Yasong Feng, Zengfeng Huang, Tianyu Wang 0008",NeurIPS,2022,http://papers.nips.cc/paper_files/paper/2022/hash/7d6ab81bfaa3a3ea45833e21907453c3-Abstract-Conference.html
FOF: Learning Fourier Occupancy Field for Monocular Real-time Human Reconstruction.,"Qiao Feng, Yebin Liu, Yu-Kun Lai, Jingyu Yang 0002, Kun Li 0001",NeurIPS,2022,http://papers.nips.cc/paper_files/paper/2022/hash/30d046e94d7b8037d6ef27c4357a8dd4-Abstract-Conference.html
Recommender Forest for Efficient Retrieval.,"Chao Feng, Wuchao Li, Defu Lian, Zheng Liu 0011, Enhong Chen",NeurIPS,2022,http://papers.nips.cc/paper_files/paper/2022/hash/fe2fe749d329627f161484876630c689-Abstract-Conference.html
On A Mallows-type Model For (Ranked) Choices.,"Yifan Feng, Yuxuan Tang",NeurIPS,2022,http://papers.nips.cc/paper_files/paper/2022/hash/145c28cd4b1df9b426990fd68045f4f7-Abstract-Conference.html
TwiBot-22: Towards Graph-Based Twitter Bot Detection.,"Shangbin Feng, Zhaoxuan Tan, Herun Wan, Ningnan Wang, Zilong Chen, Binchi Zhang, Qinghua Zheng, Wenqian Zhang, Zhenyu Lei 0004, Shujie Yang, Xinshun Feng, Qingyue Zhang, Hongrui Wang 0004, Yuhan Liu, Yuyang Bai, Heng Wang 0008, Zijian Cai, Yanbo Wang, Lijing Zheng, Zihan Ma, Jundong Li, Minnan Luo",NeurIPS,2022,http://papers.nips.cc/paper_files/paper/2022/hash/e4fd610b1d77699a02df07ae97de992a-Abstract-Datasets_and_Benchmarks.html
Peer Prediction for Learning Agents.,"Shi Feng 0002, Fang-Yi Yu, Yiling Chen 0001",NeurIPS,2022,http://papers.nips.cc/paper_files/paper/2022/hash/6e469fbdc43ade121170f61096f4458b-Abstract-Conference.html
Rank Diminishing in Deep Neural Networks.,"Ruili Feng, Kecheng Zheng, Yukun Huang, Deli Zhao, Michael I. Jordan, Zheng-Jun Zha",NeurIPS,2022,http://papers.nips.cc/paper_files/paper/2022/hash/d5cd70b708f726737e2ebace18c3f71b-Abstract-Conference.html
Learning to Scaffold: Optimizing Model Explanations for Teaching.,"Patrick Fernandes, Marcos V. Treviso, Danish Pruthi, André F. T. Martins, Graham Neubig",NeurIPS,2022,http://papers.nips.cc/paper_files/paper/2022/hash/ea64883d500d31738cd39eb49a748fa4-Abstract-Conference.html
Efficient and Effective Optimal Transport-Based Biclustering.,"Chakib Fettal, Lazhar Labiod, Mohamed Nadif",NeurIPS,2022,http://papers.nips.cc/paper_files/paper/2022/hash/d4e1c24ac41ff0b82ca1b171731f0b23-Abstract-Conference.html
Wavelet Feature Maps Compression for Image-to-Image CNNs.,"Shahaf E. Finder, Yair Zohav, Maor Ashkenazi, Eran Treister",NeurIPS,2022,http://papers.nips.cc/paper_files/paper/2022/hash/81f19c0e9f3e06c831630ab6662fd8ea-Abstract-Conference.html
Explainable Reinforcement Learning via Model Transforms.,"Mira Finkelstein, Nitsan Levy Schlot, Lucy Liu, Yoav Kolumbus, David C. Parkes, Jeffrey S. Rosenschein, Sarah Keren",NeurIPS,2022,http://papers.nips.cc/paper_files/paper/2022/hash/dbef234be68d8b170240511639610fd1-Abstract-Conference.html
A Dataset for Efforts Towards Achieving the Sustainable Development Goal of Safe Working Environments.,"Eirik Lund Flogard, Ole Jakob Mengshoel",NeurIPS,2022,http://papers.nips.cc/paper_files/paper/2022/hash/93e4d161bdd93d1dc0202b4044159edb-Abstract-Datasets_and_Benchmarks.html
SnAKe: Bayesian Optimization with Pathwise Exploration.,"Jose Pablo Folch, Shiqiang Zhang, Robert M. Lee, Behrang Shafei, David Walz, Calvin Tsay, Mark van der Wilk, Ruth Misener",NeurIPS,2022,http://papers.nips.cc/paper_files/paper/2022/hash/e4bab1843c8d5a69f5abfd0824593493-Abstract-Conference.html
Learning to Discover and Detect Objects.,"Vladimir Fomenko, Ismail Elezi, Deva Ramanan, Laura Leal-Taixé, Aljosa Osep",NeurIPS,2022,http://papers.nips.cc/paper_files/paper/2022/hash/39a636ecfecd89220aaf0fc79230e1f5-Abstract-Conference.html
Statistical Learning and Inverse Problems: A Stochastic Gradient Approach.,"Yuri R. Fonseca, Yuri F. Saporito",NeurIPS,2022,http://papers.nips.cc/paper_files/paper/2022/hash/3e8b1835833ef809059efa74b9df6805-Abstract-Conference.html
On the Complexity of Adversarial Decision Making.,"Dylan J. Foster, Alexander Rakhlin, Ayush Sekhari, Karthik Sridharan",NeurIPS,2022,http://papers.nips.cc/paper_files/paper/2022/hash/e5daf532498ebba4fe6544d49c811678-Abstract-Conference.html
So3krates: Equivariant attention for interactions on arbitrary length-scales in molecular systems.,"J. Thorben Frank, Oliver T. Unke, Klaus-Robert Müller",NeurIPS,2022,http://papers.nips.cc/paper_files/paper/2022/hash/bcf4ca90a8d405201d29dd47d75ac896-Abstract-Conference.html
Probabilistic Transformer: Modelling Ambiguities and Distributions for RNA Folding and Molecule Design.,"Jörg K. H. Franke, Frederic Runge, Frank Hutter",NeurIPS,2022,http://papers.nips.cc/paper_files/paper/2022/hash/abf0ea3ae33d1a931483e327ff8d94f8-Abstract-Conference.html
CLIPDraw: Exploring Text-to-Drawing Synthesis through Language-Image Encoders.,"Kevin Frans, Lisa B. Soros, Olaf Witkowski",NeurIPS,2022,http://papers.nips.cc/paper_files/paper/2022/hash/21f76686538a5f06dc431efea5f475f5-Abstract-Conference.html
Optimal Brain Compression: A Framework for Accurate Post-Training Quantization and Pruning.,"Elias Frantar, Dan Alistarh",NeurIPS,2022,http://papers.nips.cc/paper_files/paper/2022/hash/1caf09c9f4e6b0150b06a07e77f2710c-Abstract-Conference.html
Learn what matters: cross-domain imitation learning with task-relevant embeddings.,"Tim Franzmeyer, Philip H. S. Torr, João F. Henriques",NeurIPS,2022,http://papers.nips.cc/paper_files/paper/2022/hash/a862f5788fd09bb6843c694d8120d50c-Abstract-Conference.html
Understanding and Extending Subgraph GNNs by Rethinking Their Symmetries.,"Fabrizio Frasca, Beatrice Bevilacqua, Michael M. Bronstein, Haggai Maron",NeurIPS,2022,http://papers.nips.cc/paper_files/paper/2022/hash/cb2a4cc70db72ea779abd01107782c7b-Abstract-Conference.html
Models Out of Line: A Fourier Lens on Distribution Shift Robustness.,"Sara Fridovich-Keil, Brian R. Bartoldson, James Diffenderfer, Bhavya Kailkhura, Timo Bremer",NeurIPS,2022,http://papers.nips.cc/paper_files/paper/2022/hash/48736dba3b8d933fabbfdb4f22a7be71-Abstract-Conference.html
Spectral Bias in Practice: The Role of Function Frequency in Generalization.,"Sara Fridovich-Keil, Raphael Gontijo Lopes, Rebecca Roelofs",NeurIPS,2022,http://papers.nips.cc/paper_files/paper/2022/hash/306264db5698839230be3642aafc849c-Abstract-Conference.html
BigBio: A Framework for Data-Centric Biomedical Natural Language Processing.,"Jason A. Fries, Leon Weber, Natasha Seelam, Gabriel Altay, Debajyoti Datta, Samuele Garda, Sunny Kang, Rosaline Su, Wojciech Kusa, Samuel Cahyawijaya, Fabio Barth, Simon Ott, Matthias Samwald, Stephen H. Bach, Stella Biderman, Mario Sänger, Bo Wang 0044, Alison Callahan, Daniel León Periñán, Théo Gigant, Patrick Haller 0002, Jenny Chim, José D. Posada, John M. Giorgi, Karthik Rangasai Sivaraman, Marc Pàmies, Marianna Nezhurina, Robert Martin, Michael Cullan, Moritz Freidank, Nathan Dahlberg, Shubhanshu Mishra, Shamik Bose, Nicholas Broad, Yanis Labrak, Shlok Deshmukh, Sid Kiblawi, Ayush Singh, Minh Chien Vu, Trishala Neeraj, Jonas Golde, Albert Villanova del Moral, Benjamin Beilharz",NeurIPS,2022,http://papers.nips.cc/paper_files/paper/2022/hash/a583d2197eafc4afdd41f5b8765555c5-Abstract-Datasets_and_Benchmarks.html
A Closer Look at Offline RL Agents.,"Yuwei Fu, Di Wu 0044, Benoit Boulet",NeurIPS,2022,http://papers.nips.cc/paper_files/paper/2022/hash/3908cadfcc99db12001eafb1207353e9-Abstract-Conference.html
Reinforced Genetic Algorithm for Structure-based Drug Design.,"Tianfan Fu, Wenhao Gao 0001, Connor W. Coley, Jimeng Sun 0001",NeurIPS,2022,http://papers.nips.cc/paper_files/paper/2022/hash/4fe1859112230a032c7143a9adc3be78-Abstract-Conference.html
Geo-Neus: Geometry-Consistent Neural Implicit Surfaces Learning for Multi-view Reconstruction.,"Qiancheng Fu, Qingshan Xu 0001, Yew Soon Ong, Wenbing Tao",NeurIPS,2022,http://papers.nips.cc/paper_files/paper/2022/hash/16415eed5a0a121bfce79924db05d3fe-Abstract-Conference.html
Losses Can Be Blessings: Routing Self-Supervised Speech Representations Towards Efficient Multilingual and Multitask Speech Processing.,"Yonggan Fu, Yang Zhang 0001, Kaizhi Qian, Zhifan Ye, Zhongzhi Yu, Cheng-I Jeff Lai, Celine Lin",NeurIPS,2022,http://papers.nips.cc/paper_files/paper/2022/hash/83d349b6eb8125588b5f091e2d47525c-Abstract-Conference.html
Neuron with Steady Response Leads to Better Generalization.,"Qiang Fu 0015, Lun Du, Haitao Mao, Xu Chen 0022, Wei Fang, Shi Han, Dongmei Zhang 0001",NeurIPS,2022,http://papers.nips.cc/paper_files/paper/2022/hash/848784373188ddf641079524e89e0ac9-Abstract-Conference.html
Model-based Lifelong Reinforcement Learning with Bayesian Exploration.,"Haotian Fu, Shangqun Yu, Michael Littman 0002, George Konidaris 0001",NeurIPS,2022,http://papers.nips.cc/paper_files/paper/2022/hash/d0cf89927acd9136d27ebf08f9e8a888-Abstract-Conference.html
ShapeCrafter: A Recursive Text-Conditioned 3D Shape Generation Model.,"Rao Fu, Xiao Zhan, Yiwen Chen, Daniel Ritchie, Srinath Sridhar 0002",NeurIPS,2022,http://papers.nips.cc/paper_files/paper/2022/hash/3a33ae4d634b49b0866b4142a1f82a2f-Abstract-Conference.html
CLOOB: Modern Hopfield Networks with InfoLOOB Outperform CLIP.,"Andreas Fürst, Elisabeth Rumetshofer, Johannes Lehner, Viet T. Tran, Fei Tang, Hubert Ramsauer, David P. Kreil, Michael Kopp 0001, Günter Klambauer, Angela Bitto, Sepp Hochreiter",NeurIPS,2022,http://papers.nips.cc/paper_files/paper/2022/hash/8078e76f913e31b8467e85b4c0f0d22b-Abstract-Conference.html
Neural Topological Ordering for Computation Graphs.,"Mukul Gagrani, Corrado Rainone, Yang Yang, Harris Teague, Wonseok Jeon, Roberto Bondesan, Herke van Hoof, Christopher Lott, Weiliang Will Zeng, Piero Zappi",NeurIPS,2022,http://papers.nips.cc/paper_files/paper/2022/hash/6ef586bdf0af0b609b1d0386a3ce0e4b-Abstract-Conference.html
Adjoint-aided inference of Gaussian process driven differential equations.,"Paterne Gahungu, Christopher W. Lanyon, Mauricio A. Álvarez, Engineer Bainomugisha, Michael T. Smith 0003, Richard Wilkinson",NeurIPS,2022,http://papers.nips.cc/paper_files/paper/2022/hash/6dd16c884345ad63e4708367222410e5-Abstract-Conference.html
Data augmentation for efficient learning from parametric experts.,"Alexandre Galashov, Joshua Scott Merel, Nicolas Heess",NeurIPS,2022,http://papers.nips.cc/paper_files/paper/2022/hash/cc4d9cfc45325e460b455a820d5f212c-Abstract-Conference.html
Inductive Logical Query Answering in Knowledge Graphs.,"Michael Galkin, Zhaocheng Zhu, Hongyu Ren, Jian Tang 0005",NeurIPS,2022,http://papers.nips.cc/paper_files/paper/2022/hash/6246e04dcf42baf7c71e3a65d3d93b55-Abstract-Conference.html
Controlled Sparsity via Constrained Optimization or: How I Learned to Stop Tuning Penalties and Love Constraints.,"Jose Gallego-Posada, Juan Ramirez, Akram Erraqabi, Yoshua Bengio, Simon Lacoste-Julien",NeurIPS,2022,http://papers.nips.cc/paper_files/paper/2022/hash/089b592cccfafdca8e0178e85b609f19-Abstract-Conference.html
Envy-free Policy Teaching to Multiple Agents.,"Jiarui Gan, Rupak Majumdar, Adish Singla, Goran Radanovic",NeurIPS,2022,http://papers.nips.cc/paper_files/paper/2022/hash/5692c7dbc4abcaa50f9ce609819212e5-Abstract-Conference.html
MorphTE: Injecting Morphology in Tensorized Embeddings.,"Guobing Gan, Peng Zhang 0002, Sunzhu Li, Xiuqing Lu, Benyou Wang",NeurIPS,2022,http://papers.nips.cc/paper_files/paper/2022/hash/d68b4e80fd0dd8ac72092b3acd418f75-Abstract-Conference.html
Test-Time Training with Masked Autoencoders.,"Yossi Gandelsman, Yu Sun 0020, Xinlei Chen, Alexei A. Efros",NeurIPS,2022,http://papers.nips.cc/paper_files/paper/2022/hash/bcdec1c2d60f94a93b6e36f937aa0530-Abstract-Conference.html
