Title,Authors,Venue,Year,URL
Hybrid Stochastic-Deterministic Minibatch Proximal Gradient: Less-Than-Single-Pass Optimization with Nearly Optimal Generalization.,"Pan Zhou 0002, Xiao-Tong Yuan",ICML,2020,http://proceedings.mlr.press/v119/zhou20g.html
"Go Wide, Then Narrow: Efficient Training of Deep Thin Networks.","Denny Zhou, Mao Ye 0006, Chen Chen, Tianjian Meng, Mingxing Tan, Xiaodan Song, Quoc V. Le, Qiang Liu 0001, Dale Schuurmans",ICML,2020,http://proceedings.mlr.press/v119/zhou20f.html
"Divide, Conquer, and Combine: a New Inference Strategy for Probabilistic Programs with Stochastic Support.","Yuan Zhou 0013, Hongseok Yang, Yee Whye Teh, Tom Rainforth",ICML,2020,http://proceedings.mlr.press/v119/zhou20e.html
Robust Outlier Arm Identification.,"Yinglun Zhu, Sumeet Katariya, Robert D. Nowak",ICML,2020,http://proceedings.mlr.press/v119/zhu20a.html
Causal Effect Estimation and Optimal Dose Suggestions in Mobile Health.,"Liangyu Zhu, Wenbin Lu, Rui Song 0006",ICML,2020,http://proceedings.mlr.press/v119/zhu20c.html
Variance Reduction and Quasi-Newton for Particle-Based Variational Inference.,"Michael Zhu, Chang Liu 0030, Jun Zhu 0001",ICML,2020,http://proceedings.mlr.press/v119/zhu20b.html
Thompson Sampling Algorithms for Mean-Variance Bandits.,"Qiuyu Zhu, Vincent Y. F. Tan",ICML,2020,http://proceedings.mlr.press/v119/zhu20d.html
Learning Adversarially Robust Representations via Worst-Case Mutual Information Maximization.,"Sicheng Zhu, Xiao Zhang 0016, David Evans 0001",ICML,2020,http://proceedings.mlr.press/v119/zhu20e.html
Linear Convergence of Randomized Primal-Dual Coordinate Method for Large-scale Linear Constrained Convex Programming.,"Daoli Zhu, Lei Zhao",ICML,2020,http://proceedings.mlr.press/v119/zhu20f.html
When Demands Evolve Larger and Noisier: Learning and Earning in a Growing Environment.,"Feng Zhu, Zeyu Zheng",ICML,2020,http://proceedings.mlr.press/v119/zhu20g.html
Adaptive Checkpoint Adjoint Method for Gradient Estimation in Neural ODE.,"Juntang Zhuang, Nicha C. Dvornek, Xiaoxiao Li, Sekhar Tatikonda, Xenophon Papademetris, James S. Duncan",ICML,2020,http://proceedings.mlr.press/v119/zhuang20a.html
Learning Optimal Tree Models under Beam Search.,"Jingwei Zhuo, Ziru Xu, Wei Dai, Han Zhu 0001, Han Li, Jian Xu 0015, Kun Gai",ICML,2020,http://proceedings.mlr.press/v119/zhuo20a.html
Laplacian Regularized Few-Shot Learning.,"Imtiaz Masud Ziko, Jose Dolz, Eric Granger, Ismail Ben Ayed",ICML,2020,http://proceedings.mlr.press/v119/ziko20a.html
Influenza Forecasting Framework based on Gaussian Processes.,"Christoph Zimmer, Reza Yaesoubi",ICML,2020,http://proceedings.mlr.press/v119/zimmer20a.html
A general recurrent state space framework for modeling neural dynamics during decision-making.,"David M. Zoltowski, Jonathan W. Pillow, Scott W. Linderman",ICML,2020,http://proceedings.mlr.press/v119/zoltowski20a.html
Transformer Hawkes Process.,"Simiao Zuo, Haoming Jiang, Zichong Li, Tuo Zhao, Hongyuan Zha",ICML,2020,http://proceedings.mlr.press/v119/zuo20a.html
Double Trouble in Double Descent: Bias and Variance(s) in the Lazy Regime.,"Stéphane d&apos;Ascoli, Maria Refinetti, Giulio Biroli, Florent Krzakala",ICML,2020,http://proceedings.mlr.press/v119/d-ascoli20a.html
Student-Teacher Curriculum Learning via Reinforcement Learning: Predicting Hospital Inpatient Admission Location.,"Rasheed el-Bouri, David W. Eyre, Peter J. Watkinson, Tingting Zhu 0001, David A. Clifton",ICML,2020,http://proceedings.mlr.press/v119/el-bouri20a.html
Detection of Reckless Driving using Deep Learning.,"Arun Chauhan 0002, Shobhan Kumar, Lakshman Mahto, Jagadish D. N.",ICMLA,2020,https://doi.org/10.1109/ICMLA51294.2020.00139
Know-Linking: An approach to generate shared knowledge between several actors in companies application in aerospace manufacturer.,"Elamin Abderrahim, Nada Matta, Hassan Atifi",ICMLA,2020,https://doi.org/10.1109/ICMLA51294.2020.00192
Adaptive Data-driven Approach for the Remaining Useful Life Estimation when Few Historical Degradation Sequences are Available.,"Koceila Abid, Moamar Sayed Mouchaweh, Laurence Cornez",ICMLA,2020,https://doi.org/10.1109/ICMLA51294.2020.00184
Linguistic Features for Detecting Fake Reviews.,"Faranak Abri, Luis Felipe Gutiérrez, Akbar Siami Namin, Keith S. Jones, David R. W. Sears",ICMLA,2020,https://doi.org/10.1109/ICMLA51294.2020.00063
Deep Learning based Time Series Forecasting.,"Kushagra Agarwal, Lalasa Dheekollu, Gaurav Dhama, Ankur Arora, Siddhartha Asthana, Tanmoy Bhowmik",ICMLA,2020,https://doi.org/10.1109/ICMLA51294.2020.00140
Subword Contextual Embeddings for Languages with Rich Morphology.,"Arda Akdemir, Tetsuo Shibuya, Tunga Güngör",ICMLA,2020,https://doi.org/10.1109/ICMLA51294.2020.00161
Deep Learning-based Symbolic Indoor Positioning using the Serving eNodeB.,"Fahad Al-homayani, Mohammad H. Mahoor",ICMLA,2020,https://doi.org/10.1109/ICMLA51294.2020.00083
Reinforcement Learning based Evolutionary Metric Filtering for High Dimensional Problems.,"Bassel Ali, Koichi Moriyama, Masayuki Numao, Ken-ichi Fukui",ICMLA,2020,https://doi.org/10.1109/ICMLA51294.2020.00045
BWCFace: Open-set Face Recognition using Body-worn Camera.,"Ali Almadan, Anoop Krishnan, Ajita Rattani",ICMLA,2020,https://doi.org/10.1109/ICMLA51294.2020.00168
Adversarial Patch Defense for Optical Flow Networks in Video Action Recognition.,"Adithya Prem Anand, Gokul H, Harish Srinivasan, Pranav Vijay, Vineeth Vijayaraghavan",ICMLA,2020,https://doi.org/10.1109/ICMLA51294.2020.00202
Radar Trajectory-based Air-Writing Recognition using Temporal Convolutional Network.,"Muhammad Arsalan, Avik Santra, Vadim Issakov",ICMLA,2020,https://doi.org/10.1109/ICMLA51294.2020.00225
Single Camera Masked Face Identification.,"Vivek Aswal, Omkar Tupe, Shifa Shaikh, Nadir N. Charniya",ICMLA,2020,https://doi.org/10.1109/ICMLA51294.2020.00018
"Exploratory data analysis of the visitor&apos;s arrivals to Chichen-Itza&apos;s archaeological site, a case study.","Edgar Avalos-Gauna, León Felipe Palafox-Novack, Dayanara Carrasco-Yépez",ICMLA,2020,https://doi.org/10.1109/ICMLA51294.2020.00189
AARef: Exploiting Authorship Identifiers of Micro-Messages with Refinement Blocks.,"Sarp Aykent, Gerry V. Dozier",ICMLA,2020,https://doi.org/10.1109/ICMLA51294.2020.00169
Image Watermarking with Region of Interest Determination Using Deep Neural Networks.,"Mahnoosh Bagheri, Majid Mohrekesh, Nader Karimi, Shadrokh Samavi, Shahram Shirani, Pejman Khadivi",ICMLA,2020,https://doi.org/10.1109/ICMLA51294.2020.00172
Dimension Estimation Using Autoencoders with Applications to Financial Market Analysis.,"Nitish Bahadur, Randy C. Paffenroth",ICMLA,2020,https://doi.org/10.1109/ICMLA51294.2020.00088
Neural Architecture Search for Automotive Grid Fusion Networks Under Embedded Hardware Constraints.,"Gábor Balázs 0001, Walter Stechele",ICMLA,2020,https://doi.org/10.1109/ICMLA51294.2020.00022
A Methodology for Estimating Hospital Intensive Care Unit Length of Stay Using Novel Machine Learning Tools.,"Roberto Williams Batista, Reinaldo Sanchez-Arias",ICMLA,2020,https://doi.org/10.1109/ICMLA51294.2020.00135
Improving Fraud Detection and Concept Drift Adaptation in Credit Card Transactions Using Incremental Gradient Boosting Trees.,"Baris Bayram, Bilge Köroglu, Mehmet Gönen",ICMLA,2020,https://doi.org/10.1109/ICMLA51294.2020.00091
Generalized Adversarial Distances to Efficiently Discover Classifier Errors.,"Walter D. Bennette, Sally Dufek, Karsten Maurer, Sean Sisti, Bunyod Tusmatov",ICMLA,2020,https://doi.org/10.1109/ICMLA51294.2020.00084
A Curated Set of Labeled Code Tutorial Images for Deep Learning.,"Adrienne Bergh, Paul Harnack, Abigail Atchison, Jordan Ott, Elia Eiroa-Lledo, Erik Linstead",ICMLA,2020,https://doi.org/10.1109/ICMLA51294.2020.00200
A Collaborative Filtering Approach to Successfully Completing The Marathon.,"Jakim Berndsen, Barry Smyth, Aonghus Lawlor",ICMLA,2020,https://doi.org/10.1109/ICMLA51294.2020.00108
An embedded deep learning system for augmented reality in firefighting applications.,"Manish Bhattarai, Aura Rose Jensen-Curtis, Manel Martínez-Ramón",ICMLA,2020,https://doi.org/10.1109/ICMLA51294.2020.00193
SASBO: Self-Adapting Safe Bayesian Optimization.,"Stefano De Blasi, Alexander Gepperth",ICMLA,2020,https://doi.org/10.1109/ICMLA51294.2020.00044
Extending SpArSe: Automatic Gesture Recognition Architectures for Embedded Devices.,"Juan Borrego-Carazo, David Castells-Rufas, Jordi Carrabina, Ernesto Biempica",ICMLA,2020,https://doi.org/10.1109/ICMLA51294.2020.00011
Application of Machine Learning to Gasoline Direct Injection Systems: Towards a Data-Driven Development.,"Massimiliano Botticelli, Robin Hellmann, Paul Jochmann, Karl Georg Stapf, Erik Schünemann",ICMLA,2020,https://doi.org/10.1109/ICMLA51294.2020.00131
Toxic Comment Classification For French Online Comments.,"Nadira Boudjani, Yannis Haralambous, Inna Lyubareva",ICMLA,2020,https://doi.org/10.1109/ICMLA51294.2020.00164
Dual-encoder Bidirectional Generative Adversarial Networks for Anomaly Detection.,"Teguh Budianto, Tomohiro Nakai, Kazunori Imoto, Takahiro Takimoto, Kosuke Haruki",ICMLA,2020,https://doi.org/10.1109/ICMLA51294.2020.00114
Evaluating The Number of Trainable Parameters on Deep Maxout and LReLU Networks for Visual Recognition.,"Gabriel Castaneda, Paul Morris, Taghi M. Khoshgoftaar",ICMLA,2020,https://doi.org/10.1109/ICMLA51294.2020.00072
Deep Multiple Instance Learning Ensemble for the Acoustic Detection of Tropical Birds.,"Jorge Castro, Roberto Vargas-Masís, Danny Alfaro Rojas",ICMLA,2020,https://doi.org/10.1109/ICMLA51294.2020.00051
Deduplication of Advertisement Assets Using Deep Learning Ensembles.,"Abhijith Chakiat, Nishant Oli, Varun Kumar Modi",ICMLA,2020,https://doi.org/10.1109/ICMLA51294.2020.00145
Bayesian Sampler: Fairness in Sampling.,Ishani Chakraborty,ICMLA,2020,https://doi.org/10.1109/ICMLA51294.2020.00048
Writer identification for historical handwritten documents using a single feature extraction method.,"Michel Chammas, Abdallah Makhoul, Jacques Demerjian",ICMLA,2020,https://doi.org/10.1109/ICMLA51294.2020.00010
"Road Accident Proneness Indicator Based On Time, Weather And Location Specificity Using Graph Neural Networks.","Srikanth Chandar, Anish Reddy, Muvazima Mansoor, Suresh Jamadagni",ICMLA,2020,https://doi.org/10.1109/ICMLA51294.2020.00235
Cell Type Identification from Single-Cell Transcriptomic Data via Gene Embedding.,"Shanta Chowdhury, Xishuang Dong, Oscar A. Solis, Lijun Qian, Xiangfang Li",ICMLA,2020,https://doi.org/10.1109/ICMLA51294.2020.00050
Anomaly Detection in Unsupervised Surveillance Setting Using Ensemble of Multimodal Data with Adversarial Defense.,"Sayeed Shafayet Chowdhury, Kazi Mejbaul Islam, Rouhan Noor",ICMLA,2020,https://doi.org/10.1109/ICMLA51294.2020.00039
A Power-aware Approach for Smart Health Monitoring and Decision Support.,"Carmela Comito, Deborah Falcone, Agostino Forestiero",ICMLA,2020,https://doi.org/10.1109/ICMLA51294.2020.00216
Combining Temporal Event Relations and Pre-Trained Language Models for Text Summarization.,Divyanshu Daiya,ICMLA,2020,https://doi.org/10.1109/ICMLA51294.2020.00106
ARC-Net: Activity Recognition Through Capsules.,"Hamed Damirchi, Rooholla Khorrambakht, Hamid D. Taghirad",ICMLA,2020,https://doi.org/10.1109/ICMLA51294.2020.00215
Finding and Segmenting Mathematical Equations in Students&apos; Online Handwritten Assignments.,"Amirali Darvishzadeh, Thomas F. Stahovich",ICMLA,2020,https://doi.org/10.1109/ICMLA51294.2020.00115
Use of Auxiliary Classifier Generative Adversarial Network in Touchstroke Authentication.,"Debzani Deb, Mina M. Guirguis",ICMLA,2020,https://doi.org/10.1109/ICMLA51294.2020.00049
Use of Machine Learning in Exploring Spatial (In)Justices1.,"Debzani Deb, Russell M. Smith",ICMLA,2020,https://doi.org/10.1109/ICMLA51294.2020.00191
Geographic Boosting Tree: Modeling Non-Stationary Spatial Data.,"Liangdong Deng, Malek Adjouadi, Naphtali Rishe",ICMLA,2020,https://doi.org/10.1109/ICMLA51294.2020.00190
Gene Subset Selection for Transfer Learning using Bilevel Particle Swarm Optimization.,"Hassen Dhrif, Verónica Bolón-Canedo, Stefan Wuchty",ICMLA,2020,https://doi.org/10.1109/ICMLA51294.2020.00206
Deep Learning Based Vehicle Detection From Aerial Images.,"Hüseyin Seçkin Dikbayir, Halil-Ibrahim Bülbül",ICMLA,2020,https://doi.org/10.1109/ICMLA51294.2020.00155
Lower Bounds for Adversarially Robust PAC Learning under Evasion and Hybrid Attacks.,"Dimitrios I. Diochnos, Saeed Mahloujifar, Mohammad Mahmoody",ICMLA,2020,https://doi.org/10.1109/ICMLA51294.2020.00117
TransCrossCF: Transition-based Cross-Domain Collaborative Filtering.,"Thanh-Nam Doan, Shaghayegh Sahebi",ICMLA,2020,https://doi.org/10.1109/ICMLA51294.2020.00059
Using Undersampling with Ensemble Learning to Identify Factors Contributing to Preterm Birth.,"Shi Dong 0002, Zlatan Feric, Guangyu Li, Chieh Wu, April Z. Gu, Jennifer G. Dy, John Meeker, Ingrid Y. Padilla, José Cordero, Carmen Velez Vega, Zaira Rosario, Akram Alshawabkeh, David R. Kaeli",ICMLA,2020,https://doi.org/10.1109/ICMLA51294.2020.00124
What are they Reporting? Examining Student Cybersecurity Course Surveys through the Lens of Machine Learning.,"Denise Dragos, Suzanna Schmeelk",ICMLA,2020,https://doi.org/10.1109/ICMLA51294.2020.00156
Learning to Solve Combinatorial Optimization Problems on Real-World Graphs in Linear Time.,"Iddo Drori, Anant Kharkar, William R. Sickinger, Brandon Kates, Qiang Ma 0004, Suwen Ge, Eden Dolev, Brenda Dietrich, David P. Williamson, Madeleine Udell",ICMLA,2020,https://doi.org/10.1109/ICMLA51294.2020.00013
Efficient Defect Detection from Consecutive Monocular Images by Deep Learning.,"Truong Vinh Truong Duy, Naotake Natori",ICMLA,2020,https://doi.org/10.1109/ICMLA51294.2020.00080
Multi-view Data Mining Approach for Behaviour Analysis of Smart Control Valve.,"Amirmohammad Eghbalian, Shahrooz Abghari, Veselka Boeva, Farhad Basiri",ICMLA,2020,https://doi.org/10.1109/ICMLA51294.2020.00195
Predicting Residential Energy Consumption Using Wavelet Decomposition With Deep Neural Network.,"Dagimawi D. Eneyew, Miriam A. M. Capretz, Girma T. Bitsuamlak, Syed Mir",ICMLA,2020,https://doi.org/10.1109/ICMLA51294.2020.00146
Theoretical Analysis of the Advantage of Deepening Neural Networks.,"Yasushi Esaki, Yuta Nakahara, Toshiyasu Matsushima",ICMLA,2020,https://doi.org/10.1109/ICMLA51294.2020.00081
On The Application of Domain Adversarial Neural Network to Fault Detection and Isolation in Power Plants.,"Hossein Shahabadi Farahani, Alireza Fatehi, Mahdi Aliyari Shoorehdeli",ICMLA,2020,https://doi.org/10.1109/ICMLA51294.2020.00182
A Comparative Study of Deep Learning-based RGB-depth Fusion Methods for Object Detection.,"Fahimeh Farahnakian, Jukka Heikkonen",ICMLA,2020,https://doi.org/10.1109/ICMLA51294.2020.00228
"Multi-class segmentation of Diabetic Retinopathy lesions: effects of metrics, improvements and loss.",Pedro Furtado 0001,ICMLA,2020,https://doi.org/10.1109/ICMLA51294.2020.00219
CRUFT: Context Recognition under Uncertainty using Fusion and Temporal Learning.,"Wen Ge, Emmanuel Agu",ICMLA,2020,https://doi.org/10.1109/ICMLA51294.2020.00122
AI-based prediction for early detection of Tuberculosis in India based on environmental factors.,"Nupur Giri, Richard Joseph, Sanika Chavan, Raghav Heda, Reema Israni, Ritika Sethiya",ICMLA,2020,https://doi.org/10.1109/ICMLA51294.2020.00053
Quantifying Challenges in the Application of Graph Representation Learning.,"Antonia Gogoglou, C. Bayan Bruss, Brian Nguyen, Reza Sarshogh, Keegan E. Hines",ICMLA,2020,https://doi.org/10.1109/ICMLA51294.2020.00234
Deep neural network for load forecasting centred on architecture evolution.,"Santiago Gomez-Rosero, Miriam A. M. Capretz, Syed Mir",ICMLA,2020,https://doi.org/10.1109/ICMLA51294.2020.00028
Resource Management in Cloud Computing Using Machine Learning: A Survey.,"Sepideh Goodarzy, Maziyar Nazari, Richard Han 0001, Eric Keller, Eric Rozner",ICMLA,2020,https://doi.org/10.1109/ICMLA51294.2020.00132
Tsallis Entropy Based Labelling.,"Kentaro Goto, Masato Uchida",ICMLA,2020,https://doi.org/10.1109/ICMLA51294.2020.00015
Analysis of Generalizability of Deep Neural Networks Based on the Complexity of Decision Boundary.,"Shuyue Guan, Murray H. Loew",ICMLA,2020,https://doi.org/10.1109/ICMLA51294.2020.00025
SummaTRIZ : Summarization Networks for Mining Patent Contradiction.,"Guillaume Guarino, Ahmed Samet, Amir Nafi, Denis Cavallucci",ICMLA,2020,https://doi.org/10.1109/ICMLA51294.2020.00159
Enhancing ontology-based home Care Services platform using Bayesian networks.,"Abdelweheb Gueddes, Mohamed Ali Mahjoub",ICMLA,2020,https://doi.org/10.1109/ICMLA51294.2020.00205
Robust Detection of Objects under Periodic Motion with Gaussian Process Filtering.,"Joris Guérin, Anne Magály de Paula Canuto, Luiz Marcos Garcia Gonçalves",ICMLA,2020,https://doi.org/10.1109/ICMLA51294.2020.00113
Multimodal Word Sense Disambiguation in Creative Practice.,"Manuel Ladron de Guevara, Christopher George, Akshat Gupta, Daragh Byrne, Ramesh Krishnamurti",ICMLA,2020,https://doi.org/10.1109/ICMLA51294.2020.00055
Evaluation of Local Binary Pattern Algorithm for User Authentication with Face Biometric.,"Tony Gwyn, Mustafa Atay, Kaushik Roy 0003, Albert C. Esterline",ICMLA,2020,https://doi.org/10.1109/ICMLA51294.2020.00170
Domain adaptation from clinical trials data to the tertiary care clinic - Application to ALS.,"Ben Hadad, Boaz Lerner",ICMLA,2020,https://doi.org/10.1109/ICMLA51294.2020.00090
Performance of CatBoost and XGBoost in Medicare Fraud Detection.,"John T. Hancock, Taghi M. Khoshgoftaar",ICMLA,2020,https://doi.org/10.1109/ICMLA51294.2020.00095
Unsupervised Open Set Recognition using Adversarial Autoencoders.,"Mehadi Hassen, Philip K. Chan",ICMLA,2020,https://doi.org/10.1109/ICMLA51294.2020.00064
DEAL: Deep Evidential Active Learning for Image Classification.,"Patrick Hemmer, Niklas Kühl 0001, Jakob Schöffer",ICMLA,2020,https://doi.org/10.1109/ICMLA51294.2020.00141
Verifying Artificial Neural Network Classifier Performance Using Dataset Dissimilarity Measures.,"Darryl Hond, Hamid Asgari, Daniel Jeffery",ICMLA,2020,https://doi.org/10.1109/ICMLA51294.2020.00027
An Investigation of Fine-tuning Pre-trained Model for MR-to-Text Generation.,"Ting Hu, Christoph Meinel",ICMLA,2020,https://doi.org/10.1109/ICMLA51294.2020.00163
Partly Supervised Multi-Task Learning.,"Abdullah-Al-Zubaer Imran, Chao Huang 0016, Hui Tang, Wei Fan 0001, Yuan Xiao, Dingjun Hao, Zhen Qian, Demetri Terzopoulos",ICMLA,2020,https://doi.org/10.1109/ICMLA51294.2020.00126
FedAR: Activity and Resource-Aware Federated Learning Model for Distributed Mobile Robots.,"Ahmed Imteaj, M. Hadi Amini",ICMLA,2020,https://doi.org/10.1109/ICMLA51294.2020.00185
DEDPUL: Difference-of-Estimated-Densities-based Positive-Unlabeled Learning.,Dmitry Ivanov,ICMLA,2020,https://doi.org/10.1109/ICMLA51294.2020.00128
Estimating the Effect of General Health Checkup Using Uncertainty Aware Attention of Deep Instrument Variable 2-Stage Network.,"SangKyun Jo, Duk Bin Jun, Sungho Park",ICMLA,2020,https://doi.org/10.1109/ICMLA51294.2020.00144
New ANN results on a major benchmark for the prediction of RUL of Lithium Ion batteries in electric vehicles.,"Inès Jorge, Ahmed Samet, Tedjani Mesbahi, Romuald Boné",ICMLA,2020,https://doi.org/10.1109/ICMLA51294.2020.00196
Pixel-Level Feature Space Modeling and Brain Tumor Detection Using Machine Learning.,"Ritu Joshi, Shan Suthaharan",ICMLA,2020,https://doi.org/10.1109/ICMLA51294.2020.00134
MarioDAgger: A Time and Space Efficient Autonomous Driver.,"Farzad Kamrani, Andreas Elers, Mika Cohen, Amir Hossein Payberah",ICMLA,2020,https://doi.org/10.1109/ICMLA51294.2020.00230
HASeparator: Hyperplane-Assisted Softmax.,"Ioannis Kansizoglou, Nicholas Santavas, Loukas Bampis, Antonios Gasteratos",ICMLA,2020,https://doi.org/10.1109/ICMLA51294.2020.00087
Hybrid Approaches for Augmentation of Translation Tables for Indian Languages.,"K. M. Kavitha, Vaishnavi Naik, Sahana Angadi, Sandra Satish, Suman Nayak",ICMLA,2020,https://doi.org/10.1109/ICMLA51294.2020.00157
Accelerated Deep Learning on HPCC Systems.,"Robert K. L. Kennedy, Taghi M. Khoshgoftaar",ICMLA,2020,https://doi.org/10.1109/ICMLA51294.2020.00138
Fiji-FIN: A Fault Injection Framework on Quantized Neural Network Inference Accelerator.,"Navid Khoshavi, Connor Broyles, Yu Bi, Arman Roohi",ICMLA,2020,https://doi.org/10.1109/ICMLA51294.2020.00183
Multi-UCAV Air Combat in Short-Range Maneuver Strategy Generation using Reinforcement Learning and Curriculum Learning.,"Weiren Kong, Deyun Zhou, Kai Zhang 0037, Zhen Yang, Wansha Yang",ICMLA,2020,https://doi.org/10.1109/ICMLA51294.2020.00238
Enhanced Anisotropic Diffusion-based CNN-LSTM Architecture for Video Face Liveness Detection.,"Ranjana Koshy, Ausif Mahmood",ICMLA,2020,https://doi.org/10.1109/ICMLA51294.2020.00074
Defending Against Localized Adversarial Attacks on Edge-Deployed Monocular Depth Estimators.,"Nanda H. Krishna, Praveen Kumar R, Rishi Vardhan K, Vineeth Vijayaraghavan",ICMLA,2020,https://doi.org/10.1109/ICMLA51294.2020.00201
Understanding Fairness of Gender Classification Algorithms Across Gender-Race Groups.,"Anoop Krishnan, Ali Almadan, Ajita Rattani",ICMLA,2020,https://doi.org/10.1109/ICMLA51294.2020.00167
Towards Machine Learning Explainability in Text Classification for Fake News Detection.,"Lukas Kurasinski, Radu-Casian Mihailescu",ICMLA,2020,https://doi.org/10.1109/ICMLA51294.2020.00127
Application of deep learning to distinguish multiple deep brain stimulation parameter configurations for the treatment of Parkinson&apos;s disease.,"Robert LeMoyne, Timothy Mastroianni, Donald Whiting, Nestor D. Tomycz",ICMLA,2020,https://doi.org/10.1109/ICMLA51294.2020.00178
Improving the Donor Journey with Convolutional and Recurrent Neural Networks.,"Greg Lee, Ajith Kumar Veera Raghavan, Mark Hobbs",ICMLA,2020,https://doi.org/10.1109/ICMLA51294.2020.00149
Deep Metric Learning for Proteomics.,"Mark Lennox, Neil Robertson 0002, Barry Devereux",ICMLA,2020,https://doi.org/10.1109/ICMLA51294.2020.00057
DAT-RNN: Trajectory Prediction with Diverse Attention.,"Zheng Li 0020, Xiaocong Du, Yu Cao 0001",ICMLA,2020,https://doi.org/10.1109/ICMLA51294.2020.00233
Deep Learning Based Covert Attack Identification for Industrial Control Systems.,"Dan Li 0030, Paritosh Ramanan, Nagi Gebraeel, Kamran Paynabar",ICMLA,2020,https://doi.org/10.1109/ICMLA51294.2020.00075
An Efficient Pipeline for Pruning Convolutional Neural Networks.,"Chengcheng Li, Zi Wang 0002, Hairong Qi 0001",ICMLA,2020,https://doi.org/10.1109/ICMLA51294.2020.00148
EVISClass: a new evaluation method for image data stream classifiers.,"Mateus Curcino de Lima, Maria Camila Nardini Barioni, Elaine R. Faria, Humberto Luiz Razente",ICMLA,2020,https://doi.org/10.1109/ICMLA51294.2020.00070
HPT-RL: Calibrating Power System Models based on Hierarchical Parameter Tuning and Reinforcement Learning.,"Lei Lin, Wencheng Wu, Zhongkai Shangguan, Safwan Wshah, Ramadan Elmoudi, Beilei Xu",ICMLA,2020,https://doi.org/10.1109/ICMLA51294.2020.00194
Low-Rank Sparse Tensor Approximations for Large High-Resolution Videos.,"Xiang Liu, Huyunting Huang, Weitao Tang, Tonglin Zhang, Baijian Yang 0001",ICMLA,2020,https://doi.org/10.1109/ICMLA51294.2020.00020
Ensemble CNN in Transform Domains for Image Super-resolution from Small Data Sets.,"Yingnan Liu, Randy Clinton Paffenroth",ICMLA,2020,https://doi.org/10.1109/ICMLA51294.2020.00068
Regression Ensembles for Fast Design Space Exploration of Heterogeneous Hardware Designs.,"Alba Sandyra Bezerra Lopes, Anne Magály de Paula Canuto, Monica Magalhães Pereira",ICMLA,2020,https://doi.org/10.1109/ICMLA51294.2020.00041
Learning with Unpaired Data.,Jiebo Luo,ICMLA,2020,https://doi.org/10.1109/ICMLA51294.2020.00008
Enhance CNN Robustness Against Noises for Classification of 12-Lead ECG with Variable Length.,"Linhai Ma, Liang Liang",ICMLA,2020,https://doi.org/10.1109/ICMLA51294.2020.00137
Knowledge Graph Extraction from Videos.,"Louis Mahon, Eleonora Giunchiglia, Bowen Li 0001, Thomas Lukasiewicz",ICMLA,2020,https://doi.org/10.1109/ICMLA51294.2020.00014
Multi-Class Object Detection Using 2D Poses.,"Christopher Mayershofer, Ala Hammami, Johannes Fottner",ICMLA,2020,https://doi.org/10.1109/ICMLA51294.2020.00107
LOCO: Logistics Objects in Context.,"Christopher Mayershofer, Dimitrij-Marian Holm, Benjamin Molter, Johannes Fottner",ICMLA,2020,https://doi.org/10.1109/ICMLA51294.2020.00102
Technical Indicators and Prediction for Energy Market Forecasting.,"Catherine McHugh, Sonya Coleman, Dermot Kerr",ICMLA,2020,https://doi.org/10.1109/ICMLA51294.2020.00197
DeL-haTE: A Deep Learning Tunable Ensemble for Hate Speech Detection.,"Joshua Melton, Arunkumar Bagavathi, Siddharth Krishnan",ICMLA,2020,https://doi.org/10.1109/ICMLA51294.2020.00165
Online Cluster Drift Detection for Novelty Detection in Data Streams.,"Shon Mendelson, Boaz Lerner",ICMLA,2020,https://doi.org/10.1109/ICMLA51294.2020.00036
MuSeM: Detecting Incongruent News Headlines using Mutual Attentive Semantic Matching.,"Rahul Mishra 0004, Piyush Yadav, Rémi Calizzano, Markus Leippold",ICMLA,2020,https://doi.org/10.1109/ICMLA51294.2020.00116
Discovering Gene-Disease Associations with Biomedical Word Embeddings.,"Payal Mitra, Thom Pijnenburg, Viachaslau Sazonau",ICMLA,2020,https://doi.org/10.1109/ICMLA51294.2020.00035
Crafting Adversarial Examples for Deep Learning Based Prognostics.,"Gautam Raj Mode, Khaza Anuarul Hoque",ICMLA,2020,https://doi.org/10.1109/ICMLA51294.2020.00079
Online Gaussian LDA for Unsupervised Pattern Mining from Utility Usage Data.,"Saad Mohamad, Abdelhamid Bouchachia",ICMLA,2020,https://doi.org/10.1109/ICMLA51294.2020.00016
Connecting Distributed Pockets of Energy Flexibility through Federated Computations: Limitations and Possibilities.,"Javad Mohammadi, Jesse Thornburg",ICMLA,2020,https://doi.org/10.1109/ICMLA51294.2020.00186
