Title,Authors,Venue,Year,URL
"ICMLC 2020: 2020 12th International Conference on Machine Learning and Computing, Shenzhen, China, February 15-17, 2020",,ICMLC,2020,https://doi.org/10.1145/3383972
"Proceedings of the 37th International Conference on Machine Learning, ICML 2020, 13-18 July 2020, Virtual Event.",,"['ICML', 'Proceedings of Machine Learning Research']",2020,http://proceedings.mlr.press/v119/
"19th IEEE International Conference on Machine Learning and Applications, ICMLA 2020, Miami, FL, USA, December 14-17, 2020","M. Arif Wani, Feng Luo 0001, Xiaolin Andy Li, Dejing Dou, Francesco Bonchi",ICMLA,2020,https://doi.org/10.1109/ICMLA51294.2020
"International Conference on Machine Learning and Cybernetics, ICMLC 2020, Adelaide, Australia, December 2, 2020",,ICMLC,2020,https://doi.org/10.1109/ICMLC51923.2020
"ICMLSC 2020: The 4th International Conference on Machine Learning and Soft Computing, Haiphong City, Viet Nam, January 17-19, 2020",,ICMLSC,2020,https://doi.org/10.1145/3380688
"ICMLT 2020: 5th International Conference on Machine Learning Technologies, Beijing, China, June, 2020",,ICMLT,2020,https://doi.org/10.1145/3409073
"xxAI - Beyond Explainable AI - International Workshop, Held in Conjunction with ICML 2020, July 18, 2020, Vienna, Austria, Revised and Extended Papers","Andreas Holzinger, Randy Goebel, Ruth Fong, Taesup Moon, Klaus-Robert Müller, Wojciech Samek","['xxAI@ICML', 'Lecture Notes in Computer Science']",2022,https://doi.org/10.1007/978-3-031-04083-2
GraphCleaner: Detecting Mislabelled Samples in Popular Graph Learning Benchmarks.,"Yuwen Li, Miao Xiong, Bryan Hooi",ICML,2023,https://proceedings.mlr.press/v202/li23ai.html
Impact of Sentiment Analysis for the 2020 U.S. Presidential Election on Social Media Data.,"Miftahul Qorib, Rahel S. Gizaw, Junwhan Kim",ICMLT,2023,https://doi.org/10.1145/3589883.3589888
Structure-preserving GANs.,"Jeremiah Birrell, Markos A. Katsoulakis, Luc Rey-Bellet, Wei Zhu",ICML,2022,https://proceedings.mlr.press/v162/birrell22a.html
Phasic Policy Gradient.,"Karl Cobbe, Jacob Hilton, Oleg Klimov, John Schulman",ICML,2021,http://proceedings.mlr.press/v139/cobbe21a.html
Development of ICMLS Version 2 (Integrated Communication and Mobile Laboratory Simulator) To Improve 4.0 Century Industry Skills in Vocational Schools.,Deni Darmawan,Int. J. Interact. Mob. Technol.,2020,https://doi.org/10.3991/ijim.v14i08.12625
Rank Aggregation from Pairwise Comparisons in the Presence of Adversarial Corruptions.,"Arpit Agarwal, Shivani Agarwal 0001, Sanjeev Khanna, Prathamesh Patil",ICML,2020,http://proceedings.mlr.press/v119/agarwal20a.html
"BINOCULARS for efficient, nonmyopic sequential experimental design.","Shali Jiang 0001, Henry Chai, Javier Gonzalez, Roman Garnett",ICML,2020,http://proceedings.mlr.press/v119/jiang20b.html
ROMA: Multi-Agent Reinforcement Learning with Emergent Roles.,"Tonghan Wang 0001, Heng Dong, Victor R. Lesser, Chongjie Zhang",ICML,2020,http://proceedings.mlr.press/v119/wang20f.html
Learning and Sampling of Atomic Interventions from Observations.,"Arnab Bhattacharyya 0001, Sutanu Gayen, Saravanan Kandasamy 0002, Ashwin Maran, N. Variyam Vinodchandran",ICML,2020,http://proceedings.mlr.press/v119/bhattacharyya20a.html
ECLIPSE: An Extreme-Scale Linear Program Solver for Web-Applications.,"Kinjal Basu 0001, Amol Ghoting, Rahul Mazumder, Yao Pan",ICML,2020,http://proceedings.mlr.press/v119/basu20a.html
Do RNN and LSTM have Long Memory?,"Jingyu Zhao 0001, Feiqing Huang, Jia Lv, Yanjie Duan, Zhen Qin, Guodong Li, Guangjian Tian",ICML,2020,http://proceedings.mlr.press/v119/zhao20c.html
TrajectoryNet: A Dynamic Optimal Transport Network for Modeling Cellular Dynamics.,"Alexander Tong 0001, Jessie Huang, Guy Wolf, David van Dijk, Smita Krishnaswamy",ICML,2020,http://proceedings.mlr.press/v119/tong20a.html
Understanding Contrastive Representation Learning through Alignment and Uniformity on the Hypersphere.,"Tongzhou Wang 0001, Phillip Isola",ICML,2020,http://proceedings.mlr.press/v119/wang20k.html
Graphical Models Meet Bandits: A Variational Thompson Sampling Approach.,"Tong Yu 0001, Branislav Kveton, Zheng Wen, Ruiyi Zhang, Ole J. Mengshoel",ICML,2020,http://proceedings.mlr.press/v119/yu20b.html
Min-Max Optimization without Gradients: Convergence and Applications to Black-Box Evasion and Poisoning Attacks.,"Sijia Liu 0001, Songtao Lu, Xiangyi Chen, Yao Feng, Kaidi Xu, Abdullah Al-Dujaili, Mingyi Hong 0001, Una-May O&apos;Reilly",ICML,2020,http://proceedings.mlr.press/v119/liu20j.html
VFlow: More Expressive Generative Flows with Variational Data Augmentation.,"Jianfei Chen 0001, Cheng Lu 0011, Biqi Chenli, Jun Zhu 0001, Tian Tian 0001",ICML,2020,http://proceedings.mlr.press/v119/chen20p.html
Implicit Class-Conditioned Domain Alignment for Unsupervised Domain Adaptation.,"Xiang Jiang 0001, Qicheng Lao, Stan Matwin, Mohammad Havaei",ICML,2020,http://proceedings.mlr.press/v119/jiang20d.html
Invariant Causal Prediction for Block MDPs.,"Amy Zhang 0001, Clare Lyle, Shagun Sodhani, Angelos Filos, Marta Kwiatkowska, Joelle Pineau, Yarin Gal, Doina Precup",ICML,2020,http://proceedings.mlr.press/v119/zhang20t.html
The Tree Ensemble Layer: Differentiability meets Conditional Computation.,"Hussein Hazimeh 0001, Natalia Ponomareva 0001, Petros Mol, Zhenyu Tan, Rahul Mazumder",ICML,2020,http://proceedings.mlr.press/v119/hazimeh20a.html
Data-Dependent Differentially Private Parameter Learning for Directed Graphical Models.,"Amrita Roy Chowdhury 0001, Theodoros Rekatsinas, Somesh Jha",ICML,2020,http://proceedings.mlr.press/v119/chowdhury20a.html
Low-Variance and Zero-Variance Baselines for Extensive-Form Games.,"Trevor Davis 0001, Martin Schmid, Michael Bowling",ICML,2020,http://proceedings.mlr.press/v119/davis20a.html
InfoGAN-CR and ModelCentrality: Self-supervised Model Training and Selection for Disentangling GANs.,"Zinan Lin 0001, Kiran Koshy Thekumparampil, Giulia Fanti, Sewoong Oh",ICML,2020,http://proceedings.mlr.press/v119/lin20e.html
Sharp Statistical Guaratees for Adversarially Robust Gaussian Classification.,"Chen Dan 0001, Yuting Wei 0001, Pradeep Ravikumar",ICML,2020,http://proceedings.mlr.press/v119/dan20b.html
Adversarial Nonnegative Matrix Factorization.,"Lei Luo 0001, Yanfu Zhang, Heng Huang",ICML,2020,http://proceedings.mlr.press/v119/luo20c.html
Near-optimal Regret Bounds for Stochastic Shortest Path.,"Aviv Rosenberg 0002, Alon Cohen, Yishay Mansour, Haim Kaplan",ICML,2020,http://proceedings.mlr.press/v119/rosenberg20a.html
High-dimensional Robust Mean Estimation via Gradient Descent.,"Yu Cheng 0002, Ilias Diakonikolas, Rong Ge 0001, Mahdi Soltanolkotabi",ICML,2020,http://proceedings.mlr.press/v119/cheng20a.html
Efficient Continuous Pareto Exploration in Multi-Task Learning.,"Pingchuan Ma 0002, Tao Du 0001, Wojciech Matusik",ICML,2020,http://proceedings.mlr.press/v119/ma20a.html
Second-Order Provable Defenses against Adversarial Attacks.,"Sahil Singla 0002, Soheil Feizi",ICML,2020,http://proceedings.mlr.press/v119/singla20a.html
A Finite-Time Analysis of Q-Learning with Neural Network Function Approximation.,"Pan Xu 0002, Quanquan Gu",ICML,2020,http://proceedings.mlr.press/v119/xu20c.html
Optimal Bounds between f-Divergences and Integral Probability Metrics.,"Rohit Agrawal 0002, Thibaut Horel",ICML,2020,http://proceedings.mlr.press/v119/agrawal20a.html
On Learning Language-Invariant Representations for Universal Machine Translation.,"Han Zhao 0002, Junjie Hu 0001, Andrej Risteski",ICML,2020,http://proceedings.mlr.press/v119/zhao20b.html
Structural Language Models of Code.,"Uri Alon 0002, Roy Sadaka, Omer Levy, Eran Yahav",ICML,2020,http://proceedings.mlr.press/v119/alon20a.html
Temporal Logic Point Processes.,"Shuang Li 0002, Lu Wang 0008, Ruizhi Zhang, Xiaofu Chang, Xuqin Liu, Yao Xie 0002, Yuan Qi 0001, Le Song",ICML,2020,http://proceedings.mlr.press/v119/li20p.html
RIFLE: Backpropagation in Depth for Deep Transfer Learning through Re-Initializing the Fully-connected LayEr.,"Xingjian Li 0002, Haoyi Xiong, Haozhe An, Cheng-Zhong Xu 0001, Dejing Dou",ICML,2020,http://proceedings.mlr.press/v119/li20r.html
SIGUA: Forgetting May Make Learning with Noisy Labels More Robust.,"Bo Han 0003, Gang Niu 0001, Xingrui Yu, Quanming Yao, Miao Xu, Ivor W. Tsang, Masashi Sugiyama",ICML,2020,http://proceedings.mlr.press/v119/han20c.html
Decentralized Reinforcement Learning: Global Decision-Making via Local Economic Transactions.,"Michael Chang 0003, Sidhant Kaushik, S. Matthew Weinberg, Tom Griffiths 0001, Sergey Levine",ICML,2020,http://proceedings.mlr.press/v119/chang20b.html
Converging to Team-Maxmin Equilibria in Zero-Sum Multiplayer Games.,"Youzhi Zhang 0001, Bo An 0001",ICML,2020,http://proceedings.mlr.press/v119/zhang20c.html
Understanding and Stabilizing GANs&apos; Training Dynamics Using Control Theory.,"Kun Xu 0004, Chongxuan Li, Jun Zhu 0001, Bo Zhang 0010",ICML,2020,http://proceedings.mlr.press/v119/xu20d.html
The Intrinsic Robustness of Stochastic Bandits to Strategic Manipulation.,"Zhe Feng 0004, David C. Parkes, Haifeng Xu",ICML,2020,http://proceedings.mlr.press/v119/feng20c.html
Stochastic Optimization for Non-convex Inf-Projection Problems.,"Yan Yan 0006, Yi Xu 0008, Lijun Zhang 0005, Xiaoyu Wang 0002, Tianbao Yang",ICML,2020,http://proceedings.mlr.press/v119/yan20a.html
Information Particle Filter Tree: An Online Algorithm for POMDPs with Belief-Based Rewards on Continuous Domains.,"Johannes Fischer 0007, Ömer Sahin Tas",ICML,2020,http://proceedings.mlr.press/v119/fischer20a.html
Understanding the Curse of Horizon in Off-Policy Evaluation via Conditional Importance Sampling.,"Yao Liu 0009, Pierre-Luc Bacon, Emma Brunskill",ICML,2020,http://proceedings.mlr.press/v119/liu20a.html
Variational Label Enhancement.,"Ning Xu 0009, Jun Shu, Yun-Peng Liu, Xin Geng 0001",ICML,2020,http://proceedings.mlr.press/v119/xu20g.html
Exploration Through Reward Biasing: Reward-Biased Maximum Likelihood Estimation for Stochastic Multi-Armed Bandits.,"Xi Liu 0011, Ping-Chun Hsieh, Yu-Heng Hung, Anirban Bhattacharya, P. R. Kumar 0001",ICML,2020,http://proceedings.mlr.press/v119/liu20g.html
Optimization from Structured Samples for Coverage Functions.,"Wei Chen 0013, Xiaoming Sun 0001, Jialin Zhang 0001, Zhijie Zhang",ICML,2020,http://proceedings.mlr.press/v119/chen20u.html
On Differentially Private Stochastic Convex Optimization with Heavy-tailed Data.,"Di Wang 0015, Hanshen Xiao, Srinivas Devadas, Jinhui Xu 0001",ICML,2020,http://proceedings.mlr.press/v119/wang20y.html
Amortized Population Gibbs Samplers with Neural Sufficient Statistics.,"Hao Wu 0020, Heiko Zimmermann, Eli Sennesh, Tuan Anh Le 0001, Jan-Willem van de Meent",ICML,2020,http://proceedings.mlr.press/v119/wu20h.html
On Efficient Constructions of Checkpoints.,"Yu Chen 0036, Zhenming Liu, Bin Ren, Xin Jin 0008",ICML,2020,http://proceedings.mlr.press/v119/chen20m.html
Enhanced POET: Open-ended Reinforcement Learning through Unbounded Invention of Learning Challenges and their Solutions.,"Rui Wang 0052, Joel Lehman, Aditya Rawal, Jiale Zhi, Yulun Li, Jeffrey Clune, Kenneth O. Stanley",ICML,2020,http://proceedings.mlr.press/v119/wang20l.html
CAUSE: Learning Granger Causality from Event Sequences using Attribution Methods.,"Wei Zhang 0058, Thomas Kobber Panum, Somesh Jha, Prasad Chalasani, David Page",ICML,2020,http://proceedings.mlr.press/v119/zhang20v.html
Concentration bounds for CVaR estimation: The cases of light-tailed and heavy-tailed distributions.,"Prashanth L. A., Krishna P. Jagannathan, Ravi Kumar Kolla",ICML,2020,http://proceedings.mlr.press/v119/l-a-20a.html
Selective Dyna-Style Planning Under Limited Model Capacity.,"Zaheer Abbas, Samuel Sokota, Erin Talvitie, Martha White",ICML,2020,http://proceedings.mlr.press/v119/abbas20a.html
A distributional view on multi-objective policy optimization.,"Abbas Abdolmaleki, Sandy H. Huang, Leonard Hasenclever, Michael Neunert, H. Francis Song, Martina Zambelli, Murilo F. Martins, Nicolas Heess, Raia Hadsell, Martin A. Riedmiller",ICML,2020,http://proceedings.mlr.press/v119/abdolmaleki20a.html
Efficient Optimistic Exploration in Linear-Quadratic Regulators via Lagrangian Relaxation.,"Marc Abeille, Alessandro Lazaric",ICML,2020,http://proceedings.mlr.press/v119/abeille20a.html
Super-efficiency of automatic differentiation for functions defined as a minimum.,"Pierre Ablin, Gabriel Peyré, Thomas Moreau 0001",ICML,2020,http://proceedings.mlr.press/v119/ablin20a.html
A Geometric Approach to Archetypal Analysis via Sparse Projections.,"Vinayak Abrol, Pulkit Sharma",ICML,2020,http://proceedings.mlr.press/v119/abrol20a.html
Context Aware Local Differential Privacy.,"Jayadev Acharya, Kallista A. Bonawitz, Peter Kairouz, Daniel Ramage, Ziteng Sun",ICML,2020,http://proceedings.mlr.press/v119/acharya20a.html
Efficient Intervention Design for Causal Discovery with Latents.,"Raghavendra Addanki, Shiva Prasad Kasiviswanathan, Andrew McGregor 0001, Cameron Musco",ICML,2020,http://proceedings.mlr.press/v119/addanki20a.html
The Neural Tangent Kernel in High Dimensions: Triple Descent and a Multi-Scale Theory of Generalization.,"Ben Adlam, Jeffrey Pennington",ICML,2020,http://proceedings.mlr.press/v119/adlam20a.html
Boosting for Control of Dynamical Systems.,"Naman Agarwal, Nataly Brukhim, Elad Hazan, Zhou Lu",ICML,2020,http://proceedings.mlr.press/v119/agarwal20b.html
An Optimistic Perspective on Offline Reinforcement Learning.,"Rishabh Agarwal, Dale Schuurmans, Mohammad Norouzi 0002",ICML,2020,http://proceedings.mlr.press/v119/agarwal20c.html
LazyIter: A Fast Algorithm for Counting Markov Equivalent DAGs and Designing Experiments.,"Ali AhmadiTeshnizi, Saber Salehkaleybar, Negar Kiyavash",ICML,2020,http://proceedings.mlr.press/v119/ahmaditeshnizi20a.html
Learning What to Defer for Maximum Independent Sets.,"Sungsoo Ahn, Younggyo Seo, Jinwoo Shin",ICML,2020,http://proceedings.mlr.press/v119/ahn20a.html
Invariant Risk Minimization Games.,"Kartik Ahuja, Karthikeyan Shanmugam, Kush R. Varshney, Amit Dhurandhar",ICML,2020,http://proceedings.mlr.press/v119/ahuja20a.html
Why bigger is not always better: on finite and infinite neural networks.,Laurence Aitchison,ICML,2020,http://proceedings.mlr.press/v119/aitchison20a.html
Discriminative Jackknife: Quantifying Uncertainty in Deep Learning via Higher-Order Influence Functions.,"Ahmed M. Alaa, Mihaela van der Schaar",ICML,2020,http://proceedings.mlr.press/v119/alaa20a.html
Frequentist Uncertainty in Recurrent Neural Networks via Blockwise Influence Functions.,"Ahmed M. Alaa, Mihaela van der Schaar",ICML,2020,http://proceedings.mlr.press/v119/alaa20b.html
Random extrapolation for primal-dual coordinate descent.,"Ahmet Alacaoglu, Olivier Fercoq, Volkan Cevher",ICML,2020,http://proceedings.mlr.press/v119/alacaoglu20a.html
A new regret analysis for Adam-type algorithms.,"Ahmet Alacaoglu, Yura Malitsky, Panayotis Mertikopoulos, Volkan Cevher",ICML,2020,http://proceedings.mlr.press/v119/alacaoglu20b.html
Restarted Bayesian Online Change-point Detector achieves Optimal Detection Delay.,"Réda Alami, Odalric Maillard, Raphaël Féraud",ICML,2020,http://proceedings.mlr.press/v119/alami20a.html
Maximum Likelihood with Bias-Corrected Calibration is Hard-To-Beat at Label Shift Adaptation.,"Amr Alexandari, Anshul Kundaje, Avanti Shrikumar",ICML,2020,http://proceedings.mlr.press/v119/alexandari20a.html
The Implicit Regularization of Stochastic Gradient Flow for Least Squares.,"Alnur Ali, Edgar Dobriban, Ryan J. Tibshirani",ICML,2020,http://proceedings.mlr.press/v119/ali20a.html
Uncertainty Estimation Using a Single Deep Deterministic Neural Network.,"Joost van Amersfoort, Lewis Smith, Yee Whye Teh, Yarin Gal",ICML,2020,http://proceedings.mlr.press/v119/van-amersfoort20a.html
LowFER: Low-rank Bilinear Pooling for Link Prediction.,"Saadullah Amin, Stalin Varanasi, Katherine Ann Dunfield, Günter Neumann",ICML,2020,http://proceedings.mlr.press/v119/amin20a.html
Discount Factor as a Regularizer in Reinforcement Learning.,"Ron Amit, Ron Meir, Kamil Ciosek",ICML,2020,http://proceedings.mlr.press/v119/amit20a.html
Neuro-Symbolic Visual Reasoning: Disentangling &quot;Visual&quot; from &quot;Reasoning&quot;.,"Saeed Amizadeh, Hamid Palangi, Alex Polozov, Yichen Huang, Kazuhito Koishida",ICML,2020,http://proceedings.mlr.press/v119/amizadeh20a.html
The Differentiable Cross-Entropy Method.,"Brandon Amos, Denis Yarats",ICML,2020,http://proceedings.mlr.press/v119/amos20a.html
Customizing ML Predictions for Online Algorithms.,"Keerti Anand, Rong Ge 0001, Debmalya Panigrahi",ICML,2020,http://proceedings.mlr.press/v119/anand20a.html
Fairwashing explanations with off-manifold detergent.,"Christopher J. Anders, Plamen Pasliev, Ann-Kathrin Dombrowski, Klaus-Robert Müller, Pan Kessel",ICML,2020,http://proceedings.mlr.press/v119/anders20a.html
Population-Based Black-Box Optimization for Biological Sequence Design.,"Christof Angermüller, David Belanger, Andreea Gane, Zelda Mariet, David Dohan, Kevin Murphy 0002, Lucy J. Colwell, D. Sculley",ICML,2020,http://proceedings.mlr.press/v119/angermueller20a.html
Low-loss connection of weight vectors: distribution-based approaches.,"Ivan Anokhin, Dmitry Yarotsky",ICML,2020,http://proceedings.mlr.press/v119/anokhin20a.html
Online metric algorithms with untrusted predictions.,"Antonios Antoniadis 0001, Christian Coester, Marek Eliás 0001, Adam Polak 0001, Bertrand Simon 0001",ICML,2020,http://proceedings.mlr.press/v119/antoniadis20a.html
NADS: Neural Architecture Distribution Search for Uncertainty Awareness.,"Randy Ardywibowo, Shahin Boluki, Xinyu Gong, Zhangyang Wang, Xiaoning Qian",ICML,2020,http://proceedings.mlr.press/v119/ardywibowo20a.html
Provable Representation Learning for Imitation Learning via Bi-level Optimization.,"Sanjeev Arora, Simon S. Du, Sham M. Kakade, Yuping Luo, Nikunj Saunshi",ICML,2020,http://proceedings.mlr.press/v119/arora20a.html
Quantum Boosting.,"Srinivasan Arunachalam, Reevu Maity",ICML,2020,http://proceedings.mlr.press/v119/arunachalam20a.html
Black-box Certification and Learning under Adversarial Perturbations.,"Hassan Ashtiani, Vinayak Pathak, Ruth Urner",ICML,2020,http://proceedings.mlr.press/v119/ashtiani20a.html
Invertible generative models for inverse problems: mitigating representation error and dataset bias.,"Muhammad Asim 0005, Max Daniels, Oscar Leong, Ali Ahmed 0004, Paul Hand",ICML,2020,http://proceedings.mlr.press/v119/asim20a.html
On the Convergence of Nesterov&apos;s Accelerated Gradient Method in Stochastic Settings.,"Mahmoud Assran, Mike Rabbat",ICML,2020,http://proceedings.mlr.press/v119/assran20a.html
Safe screening rules for L0-regression from Perspective Relaxations.,"Alper Atamtürk, Andrés Gómez 0001",ICML,2020,http://proceedings.mlr.press/v119/atamturk20a.html
Adversarial Learning Guarantees for Linear Hypotheses and Neural Networks.,"Pranjal Awasthi, Natalie Frank, Mehryar Mohri",ICML,2020,http://proceedings.mlr.press/v119/awasthi20a.html
Sample Amplification: Increasing Dataset Size even when Learning is Impossible.,"Brian Axelrod, Shivam Garg 0001, Vatsal Sharan, Gregory Valiant",ICML,2020,http://proceedings.mlr.press/v119/axelrod20a.html
Sparse Convex Optimization via Adaptively Regularized Hard Thresholding.,"Kyriakos Axiotis, Maxim Sviridenko",ICML,2020,http://proceedings.mlr.press/v119/axiotis20a.html
Model-Based Reinforcement Learning with Value-Targeted Regression.,"Alex Ayoub, Zeyu Jia, Csaba Szepesvári, Mengdi Wang, Lin Yang 0011",ICML,2020,http://proceedings.mlr.press/v119/ayoub20a.html
Forecasting Sequential Data Using Consistent Koopman Autoencoders.,"Omri Azencot, N. Benjamin Erichson, Vanessa Lin, Michael W. Mahoney",ICML,2020,http://proceedings.mlr.press/v119/azencot20a.html
Constant Curvature Graph Convolutional Networks.,"Gregor Bachmann, Gary Bécigneul, Octavian Ganea",ICML,2020,http://proceedings.mlr.press/v119/bachmann20a.html
Scalable Nearest Neighbor Search for Optimal Transport.,"Arturs Backurs, Yihe Dong, Piotr Indyk, Ilya P. Razenshteyn, Tal Wagner",ICML,2020,http://proceedings.mlr.press/v119/backurs20a.html
Agent57: Outperforming the Atari Human Benchmark.,"Adrià Puigdomènech Badia, Bilal Piot, Steven Kapturowski, Pablo Sprechmann, Alex Vitvitskyi, Zhaohan Daniel Guo, Charles Blundell",ICML,2020,http://proceedings.mlr.press/v119/badia20a.html
Fiduciary Bandits.,"Gal Bahar, Omer Ben-Porat, Kevin Leyton-Brown, Moshe Tennenholtz",ICML,2020,http://proceedings.mlr.press/v119/bahar20a.html
Learning De-biased Representations with Biased Representations.,"Hyojin Bahng, Sanghyuk Chun, Sangdoo Yun, Jaegul Choo, Seong Joon Oh",ICML,2020,http://proceedings.mlr.press/v119/bahng20a.html
Deep k-NN for Noisy Labels.,"Dara Bahri, Heinrich Jiang, Maya R. Gupta",ICML,2020,http://proceedings.mlr.press/v119/bahri20a.html
Provable Self-Play Algorithms for Competitive Reinforcement Learning.,"Yu Bai 0017, Chi Jin 0001",ICML,2020,http://proceedings.mlr.press/v119/bai20a.html
Sparse Subspace Clustering with Entropy-Norm.,"Liang Bai, Jiye Liang",ICML,2020,http://proceedings.mlr.press/v119/bai20b.html
Coresets for Clustering in Graphs of Bounded Treewidth.,"Daniel N. Baker, Vladimir Braverman, Lingxiao Huang, Shaofeng H.-C. Jiang, Robert Krauthgamer, Xuan Wu 0002",ICML,2020,http://proceedings.mlr.press/v119/baker20a.html
Refined bounds for algorithm configuration: The knife-edge of dual class approximability.,"Maria-Florina Balcan, Tuomas Sandholm, Ellen Vitercik",ICML,2020,http://proceedings.mlr.press/v119/balcan20a.html
Ready Policy One: World Building Through Active Learning.,"Philip J. Ball, Jack Parker-Holder, Aldo Pacchiano, Krzysztof Choromanski, Stephen J. Roberts",ICML,2020,http://proceedings.mlr.press/v119/ball20a.html
Stochastic Optimization for Regularized Wasserstein Estimators.,"Marin Ballu, Quentin Berthet, Francis R. Bach",ICML,2020,http://proceedings.mlr.press/v119/ballu20a.html
Dual Mirror Descent for Online Allocation Problems.,"Santiago R. Balseiro, Haihao Lu, Vahab S. Mirrokni",ICML,2020,http://proceedings.mlr.press/v119/balseiro20a.html
Inductive-bias-driven Reinforcement Learning For Efficient Schedules in Heterogeneous Clusters.,"Subho S. Banerjee, Saurabh Jha, Zbigniew Kalbarczyk, Ravishankar K. Iyer",ICML,2020,http://proceedings.mlr.press/v119/banerjee20a.html
UniLMv2: Pseudo-Masked Language Models for Unified Language Model Pre-Training.,"Hangbo Bao, Li Dong 0004, Furu Wei, Wenhui Wang 0003, Nan Yang 0002, Xiaodong Liu 0003, Yu Wang 0009, Jianfeng Gao 0001, Songhao Piao, Ming Zhou 0001, Hsiao-Wuen Hon",ICML,2020,http://proceedings.mlr.press/v119/bao20a.html
Fast OSCAR and OWL Regression via Safe Screening Rules.,"Runxue Bao, Bin Gu 0001, Heng Huang",ICML,2020,http://proceedings.mlr.press/v119/bao20b.html
Option Discovery in the Absence of Rewards with Manifold Analysis.,"Amitay Bar, Ronen Talmon, Ron Meir",ICML,2020,http://proceedings.mlr.press/v119/bar20a.html
Beyond the Visual Analysis of Deep Model Saliency.,"Sarah Adel Bargal, Andrea Zunino, Vitali Petsiuk, Jianming Zhang 0001, Vittorio Murino, Stan Sclaroff, Kate Saenko",xxAI@ICML,2020,https://doi.org/10.1007/978-3-031-04083-2_13
Learning the piece-wise constant graph structure of a varying Ising model.,"Batiste Le Bars, Pierre Humbert, Argyris Kalogeratos, Nicolas Vayatis",ICML,2020,http://proceedings.mlr.press/v119/bars20a.html
Frequency Bias in Neural Networks for Input of Non-Uniform Density.,"Ronen Basri, Meirav Galun, Amnon Geifman, David W. Jacobs, Yoni Kasten, Shira Kritchman",ICML,2020,http://proceedings.mlr.press/v119/basri20a.html
Private Query Release Assisted by Public Data.,"Raef Bassily, Albert Cheu, Shay Moran, Aleksandar Nikolov, Jonathan R. Ullman, Zhiwei Steven Wu",ICML,2020,http://proceedings.mlr.press/v119/bassily20a.html
"Interpretable, Verifiable, and Robust Reinforcement Learning via Program Synthesis.","Osbert Bastani, Jeevana Priya Inala, Armando Solar-Lezama",xxAI@ICML,2020,https://doi.org/10.1007/978-3-031-04083-2_11
On Second-Order Group Influence Functions for Black-Box Predictions.,"Samyadeep Basu, Xuchen You, Soheil Feizi",ICML,2020,http://proceedings.mlr.press/v119/basu20b.html
ECQ x: Explainability-Driven Quantization for Low-Bit and Sparse DNNs.,"Daniel Becking, Maximilian Dreyer, Wojciech Samek, Karsten Müller 0001, Sebastian Lapuschkin",xxAI@ICML,2020,https://doi.org/10.1007/978-3-031-04083-2_14
Combining Differentiable PDE Solvers and Graph Neural Networks for Fluid Flow Prediction.,"Filipe de Avila Belbute-Peres, Thomas D. Economon, J. Zico Kolter",ICML,2020,http://proceedings.mlr.press/v119/de-avila-belbute-peres20a.html
Kernel interpolation with continuous volume sampling.,"Ayoub Belhadji, Rémi Bardenet, Pierre Chainais",ICML,2020,http://proceedings.mlr.press/v119/belhadji20a.html
Decoupled Greedy Learning of CNNs.,"Eugene Belilovsky, Michael Eickenberg, Edouard Oyallon",ICML,2020,http://proceedings.mlr.press/v119/belilovsky20a.html
The Cost-free Nature of Optimally Tuning Tikhonov Regularizers and Other Ordered Smoothers.,"Pierre Bellec, Dana Yang",ICML,2020,http://proceedings.mlr.press/v119/bellec20a.html
Defense Through Diverse Directions.,"Christopher M. Bender, Yang Li 0012, Yifeng Shi, Michael K. Reiter, Junier Oliva",ICML,2020,http://proceedings.mlr.press/v119/bender20a.html
Interference and Generalization in Temporal Difference Learning.,"Emmanuel Bengio, Joelle Pineau, Doina Precup",ICML,2020,http://proceedings.mlr.press/v119/bengio20a.html
Preselection Bandits.,"Viktor Bengs, Eyke Hüllermeier",ICML,2020,http://proceedings.mlr.press/v119/bengs20a.html
Efficient Policy Learning from Surrogate-Loss Classification Reductions.,"Andrew Bennett, Nathan Kallus",ICML,2020,http://proceedings.mlr.press/v119/bennett20a.html
Training Neural Networks for and by Interpolation.,"Leonard Berrada, Andrew Zisserman, M. Pawan Kumar",ICML,2020,http://proceedings.mlr.press/v119/berrada20a.html
