Title,Authors,Venue,Year,URL
Counterfactual Cross-Validation: Stable Model Selection Procedure for Causal Inference Models.,"Yuta Saito, Shota Yasui",ICML,2020,http://proceedings.mlr.press/v119/saito20a.html
Inferring DQN structure for high-dimensional continuous control.,"Andrey Sakryukin, Chedy Raïssi, Mohan S. Kankanhalli",ICML,2020,http://proceedings.mlr.press/v119/sakryukin20a.html
The Performance Analysis of Generalized Margin Maximizers on Separable Data.,"Fariborz Salehi, Ehsan Abbasi, Babak Hassibi",ICML,2020,http://proceedings.mlr.press/v119/salehi20a.html
CLEVR-X: A Visual Reasoning Dataset for Natural Language Explanations.,"Leonard Salewski, A. Sophia Koepke, Hendrik P. A. Lensch, Zeynep Akata",xxAI@ICML,2020,https://doi.org/10.1007/978-3-031-04083-2_5
Stochastic Coordinate Minimization with Progressive Precision for Stochastic Convex Optimization.,"Sudeep Salgia, Qing Zhao 0001, Sattar Vakili",ICML,2020,http://proceedings.mlr.press/v119/salgia20a.html
A Quantile-based Approach for Hyperparameter Transfer Learning.,"David Salinas, Huibin Shen, Valerio Perrone",ICML,2020,http://proceedings.mlr.press/v119/salinas20a.html
Spectral Subsampling MCMC for Stationary Time Series.,"Robert Salomone, Matias Quiroz, Robert Kohn, Mattias Villani, Minh-Ngoc Tran",ICML,2020,http://proceedings.mlr.press/v119/salomone20a.html
Learning to Simulate Complex Physics with Graph Networks.,"Alvaro Sanchez-Gonzalez, Jonathan Godwin, Tobias Pfaff, Rex Ying, Jure Leskovec, Peter W. Battaglia",ICML,2020,http://proceedings.mlr.press/v119/sanchez-gonzalez20a.html
The Impact of Neural Network Overparameterization on Gradient Confusion and Stochastic Gradient Descent.,"Karthik Abinav Sankararaman, Soham De, Zheng Xu 0002, W. Ronny Huang, Tom Goldstein",ICML,2020,http://proceedings.mlr.press/v119/sankararaman20a.html
Explicit Gradient Learning for Black-Box Optimization.,"Elad Sarafian, Mor Sinay, Yoram Louzoun, Noa Agmon, Sarit Kraus",ICML,2020,http://proceedings.mlr.press/v119/sarafian20a.html
Detecting Out-of-Distribution Examples with Gram Matrices.,"Chandramouli Shama Sastry, Sageev Oore",ICML,2020,http://proceedings.mlr.press/v119/sastry20a.html
Constrained Markov Decision Processes via Backward Value Functions.,"Harsh Satija, Philip Amortila, Joelle Pineau",ICML,2020,http://proceedings.mlr.press/v119/satija20a.html
A Sample Complexity Separation between Non-Convex and Convex Meta-Learning.,"Nikunj Saunshi, Yi Zhang 0074, Mikhail Khodak, Sanjeev Arora",ICML,2020,http://proceedings.mlr.press/v119/saunshi20a.html
Harmonic Decompositions of Convolutional Networks.,"Meyer Scetbon, Zaïd Harchaoui",ICML,2020,http://proceedings.mlr.press/v119/scetbon20a.html
Implicit competitive regularization in GANs.,"Florian Schäfer, Hongkai Zheng, Animashree Anandkumar",ICML,2020,http://proceedings.mlr.press/v119/schaefer20a.html
Off-Policy Actor-Critic with Shared Experience Replay.,"Simon Schmitt, Matteo Hessel, Karen Simonyan",ICML,2020,http://proceedings.mlr.press/v119/schmitt20a.html
Discriminative Adversarial Search for Abstractive Summarization.,"Thomas Scialom, Paul-Alexis Dray, Sylvain Lamprier, Benjamin Piwowarski, Jacopo Staiano",ICML,2020,http://proceedings.mlr.press/v119/scialom20a.html
Universal Asymptotic Optimality of Polyak Momentum.,"Damien Scieur, Fabian Pedregosa",ICML,2020,http://proceedings.mlr.press/v119/scieur20a.html
Random Matrix Theory Proves that Deep Learning Representations of GAN-data Behave as Gaussian Mixtures.,"Mohamed El Amine Seddik, Cosme Louart, Mohamed Tamaazousti, Romain Couillet",ICML,2020,http://proceedings.mlr.press/v119/seddik20a.html
Planning to Explore via Self-Supervised World Models.,"Ramanan Sekar, Oleh Rybkin, Kostas Daniilidis, Pieter Abbeel, Danijar Hafner, Deepak Pathak",ICML,2020,http://proceedings.mlr.press/v119/sekar20a.html
An Explicitly Relational Neural Network Architecture.,"Murray Shanahan, Kyriacos Nikiforou, Antonia Creswell, Christos Kaplanis, David G. T. Barrett, Marta Garnelo",ICML,2020,http://proceedings.mlr.press/v119/shanahan20a.html
Optimistic Policy Optimization with Bandit Feedback.,"Lior Shani, Yonathan Efroni, Aviv Rosenberg 0002, Shie Mannor",ICML,2020,http://proceedings.mlr.press/v119/shani20a.html
Learning Robot Skills with Temporal Variational Inference.,"Tanmay Shankar, Abhinav Gupta 0001",ICML,2020,http://proceedings.mlr.press/v119/shankar20b.html
Neural Kernels Without Tangents.,"Vaishaal Shankar, Alex Fang, Wenshuo Guo, Sara Fridovich-Keil, Jonathan Ragan-Kelley, Ludwig Schmidt, Benjamin Recht",ICML,2020,http://proceedings.mlr.press/v119/shankar20a.html
Evaluating Machine Accuracy on ImageNet.,"Vaishaal Shankar, Rebecca Roelofs, Horia Mania, Alex Fang, Benjamin Recht, Ludwig Schmidt",ICML,2020,http://proceedings.mlr.press/v119/shankar20c.html
Channel Equilibrium Networks for Learning Deep Representation.,"Wenqi Shao, Shitao Tang, Xingang Pan, Ping Tan, Xiaogang Wang 0001, Ping Luo 0002",ICML,2020,http://proceedings.mlr.press/v119/shao20a.html
ControlVAE: Controllable Variational Autoencoder.,"Huajie Shao, Shuochao Yao, Dachun Sun, Aston Zhang, Shengzhong Liu, Dongxin Liu, Jun Wang, Tarek F. Abdelzaher",ICML,2020,http://proceedings.mlr.press/v119/shao20b.html
Lookahead-Bounded Q-learning.,"Ibrahim El Shar, Daniel R. Jiang",ICML,2020,http://proceedings.mlr.press/v119/shar20a.html
Causal Strategic Linear Regression.,"Yonadav Shavit, Benjamin L. Edelman, Brian Axelrod",ICML,2020,http://proceedings.mlr.press/v119/shavit20a.html
Adaptive Sampling for Estimating Probability Distributions.,"Shubhanshu Shekhar, Tara Javidi, Mohammad Ghavamzadeh",ICML,2020,http://proceedings.mlr.press/v119/shekhar20a.html
PDO-eConvs: Partial Differential Operator Based Equivariant Convolutions.,"Zhengyang Shen, Lingshen He, Zhouchen Lin, Jinwen Ma",ICML,2020,http://proceedings.mlr.press/v119/shen20a.html
Deep Reinforcement Learning with Robust and Smooth Policy.,"Qianli Shen, Yan Li 0074, Haoming Jiang, Zhaoran Wang 0001, Tuo Zhao",ICML,2020,http://proceedings.mlr.press/v119/shen20b.html
Educating Text Autoencoders: Latent Representation Guidance via Denoising.,"Tianxiao Shen, Jonas Mueller 0001, Regina Barzilay, Tommi S. Jaakkola",ICML,2020,http://proceedings.mlr.press/v119/shen20c.html
Learning for Dose Allocation in Adaptive Clinical Trials with Safety Constraints.,"Cong Shen 0001, Zhiyang Wang, Sofia S. Villar, Mihaela van der Schaar",ICML,2020,http://proceedings.mlr.press/v119/shen20d.html
PowerNorm: Rethinking Batch Normalization in Transformers.,"Sheng Shen, Zhewei Yao, Amir Gholami, Michael W. Mahoney, Kurt Keutzer",ICML,2020,http://proceedings.mlr.press/v119/shen20e.html
Extreme Multi-label Classification from Aggregated Labels.,"Yanyao Shen, Hsiang-Fu Yu, Sujay Sanghavi, Inderjit S. Dhillon",ICML,2020,http://proceedings.mlr.press/v119/shen20f.html
One-shot Distributed Ridge Regression in High Dimensions.,"Yue Sheng, Edgar Dobriban",ICML,2020,http://proceedings.mlr.press/v119/sheng20a.html
Landscape Connectivity and Dropout Stability of SGD Solutions for Over-parameterized Neural Networks.,"Alexander Shevchenko, Marco Mondelli",ICML,2020,http://proceedings.mlr.press/v119/shevchenko20a.html
Incremental Sampling Without Replacement for Sequence Models.,"Kensen Shi, David Bieber, Charles Sutton",ICML,2020,http://proceedings.mlr.press/v119/shi20a.html
Message Passing Least Squares Framework and its Application to Rotation Synchronization.,"Yunpeng Shi, Gilad Lerman",ICML,2020,http://proceedings.mlr.press/v119/shi20b.html
Does the Markov Decision Process Fit the Data: Testing for the Markov Property in Sequential Decision Making.,"Chengchun Shi, Runzhe Wan, Rui Song 0006, Wenbin Lu, Ling Leng",ICML,2020,http://proceedings.mlr.press/v119/shi20c.html
A Graph to Graphs Framework for Retrosynthesis Prediction.,"Chence Shi, Minkai Xu, Hongyu Guo, Ming Zhang 0004, Jian Tang 0005",ICML,2020,http://proceedings.mlr.press/v119/shi20d.html
Informative Dropout for Robust Representation Learning: A Shape-bias Perspective.,"Baifeng Shi, Dinghuai Zhang, Qi Dai 0001, Zhanxing Zhu, Yadong Mu, Jingdong Wang 0001",ICML,2020,http://proceedings.mlr.press/v119/shi20e.html
Dispersed Exponential Family Mixture VAEs for Interpretable Text Generation.,"Wenxian Shi, Hao Zhou 0012, Ning Miao, Lei Li 0005",ICML,2020,http://proceedings.mlr.press/v119/shi20f.html
On Conditional Versus Marginal Bias in Multi-Armed Bandits.,"Jaehyeok Shin, Aaditya Ramdas, Alessandro Rinaldo",ICML,2020,http://proceedings.mlr.press/v119/shin20a.html
Predictive Coding for Locally-Linear Control.,"Rui Shu, Tung Nguyen, Yinlam Chow, Tuan Pham, Khoat Than, Mohammad Ghavamzadeh, Stefano Ermon, Hung H. Bui",ICML,2020,http://proceedings.mlr.press/v119/shu20a.html
A Markov Decision Process Model for Socio-Economic Systems Impacted by Climate Change.,"Salman Sadiq Shuvo, Yasin Yilmaz, Alan Bush, Mark Hafen",ICML,2020,http://proceedings.mlr.press/v119/shuvo20a.html
Distributionally Robust Policy Evaluation and Learning in Offline Contextual Bandits.,"Nian Si, Fan Zhang 0059, Zhengyuan Zhou, Jose H. Blanchet",ICML,2020,http://proceedings.mlr.press/v119/si20a.html
Piecewise Linear Regression via a Difference of Convex Functions.,"Ali Siahkamari, Aditya Gangrade, Brian Kulis, Venkatesh Saligrama",ICML,2020,http://proceedings.mlr.press/v119/siahkamari20a.html
Learning Fair Policies in Multi-Objective (Deep) Reinforcement Learning with Average and Discounted Rewards.,"Umer Siddique, Paul Weng, Matthieu Zimmer",ICML,2020,http://proceedings.mlr.press/v119/siddique20a.html
Deep Gaussian Markov Random Fields.,"Per Sidén, Fredrik Lindsten",ICML,2020,http://proceedings.mlr.press/v119/siden20a.html
Collaborative Machine Learning with Incentive-Aware Model Rewards.,"Rachael Hwee Ling Sim, Yehong Zhang, Mun Choon Chan, Bryan Kian Hsiang Low",ICML,2020,http://proceedings.mlr.press/v119/sim20a.html
Naive Exploration is Optimal for Online LQR.,"Max Simchowitz, Dylan J. Foster",ICML,2020,http://proceedings.mlr.press/v119/simchowitz20a.html
A Generative Model for Molecular Distance Geometry.,"Gregor N. C. Simm, José Miguel Hernández-Lobato",ICML,2020,http://proceedings.mlr.press/v119/simm20a.html
Reinforcement Learning for Molecular Design Guided by Quantum Mechanics.,"Gregor N. C. Simm, Robert Pinsler, José Miguel Hernández-Lobato",ICML,2020,http://proceedings.mlr.press/v119/simm20b.html
Fractional Underdamped Langevin Dynamics: Retargeting SGD with Momentum under Heavy-Tailed Gradient Noise.,"Umut Simsekli, Lingjiong Zhu, Yee Whye Teh, Mert Gürbüzbalaban",ICML,2020,http://proceedings.mlr.press/v119/simsekli20a.html
Interpreting and Improving Deep-Learning Models with Reality Checks.,"Chandan Singh, Wooseok Ha, Bin Yu 0001",xxAI@ICML,2020,https://doi.org/10.1007/978-3-031-04083-2_12
FormulaZero: Distributionally Robust Online Adaptation via Offline Population Synthesis.,"Aman Sinha 0001, Matthew O&apos;Kelly, Hongrui Zheng, Rahul Mangharam, John C. Duchi, Russ Tedrake",ICML,2020,http://proceedings.mlr.press/v119/sinha20a.html
Small-GAN: Speeding up GAN Training using Core-Sets.,"Samarth Sinha, Han Zhang 0010, Anirudh Goyal, Yoshua Bengio, Hugo Larochelle, Augustus Odena",ICML,2020,http://proceedings.mlr.press/v119/sinha20b.html
"Interpretable, Multidimensional, Multimodal Anomaly Detection with Negative Sampling for Detection of Device Failure.",John Sipple,ICML,2020,http://proceedings.mlr.press/v119/sipple20a.html
Structured Linear Contextual Bandits: A Sharp and Geometric Smoothed Analysis.,"Vidyashankar Sivakumar, Zhiwei Steven Wu, Arindam Banerjee 0001",ICML,2020,http://proceedings.mlr.press/v119/sivakumar20a.html
Optimizer Benchmarking Needs to Account for Hyperparameter Tuning.,"Prabhu Teja Sivaprasad, Florian Mai, Thijs Vogels, Martin Jaggi, François Fleuret",ICML,2020,http://proceedings.mlr.press/v119/sivaprasad20a.html
When Explanations Lie: Why Many Modified BP Attributions Fail.,"Leon Sixt, Maximilian Granz, Tim Landgraf",ICML,2020,http://proceedings.mlr.press/v119/sixt20a.html
On the Generalization Benefit of Noise in Stochastic Gradient Descent.,"Samuel L. Smith, Erich Elsen, Soham De",ICML,2020,http://proceedings.mlr.press/v119/smith20a.html
Multiclass Neural Network Minimization via Tropical Newton Polytope Approximation.,"Georgios Smyrnis, Petros Maragos",ICML,2020,http://proceedings.mlr.press/v119/smyrnis20a.html
Bridging the Gap Between f-GANs and Wasserstein GANs.,"Jiaming Song, Stefano Ermon",ICML,2020,http://proceedings.mlr.press/v119/song20a.html
Provably Efficient Model-based Policy Adaptation.,"Yuda Song 0001, Aditi Mavalankar, Wen Sun 0002, Sicun Gao",ICML,2020,http://proceedings.mlr.press/v119/song20b.html
Hypernetwork approach to generating point clouds.,"Przemyslaw Spurek, Sebastian Winczowski, Jacek Tabor, Maciej Zamorski, Maciej Zieba, Tomasz Trzcinski",ICML,2020,http://proceedings.mlr.press/v119/spurek20a.html
Robustness to Spurious Correlations via Human Annotations.,"Megha Srivastava, Tatsunori B. Hashimoto, Percy Liang",ICML,2020,http://proceedings.mlr.press/v119/srivastava20a.html
Which Tasks Should Be Learned Together in Multi-task Learning?,"Trevor Standley, Amir Zamir, Dawn Chen, Leonidas J. Guibas, Jitendra Malik, Silvio Savarese",ICML,2020,http://proceedings.mlr.press/v119/standley20a.html
Responsive Safety in Reinforcement Learning by PID Lagrangian Methods.,"Adam Stooke, Joshua Achiam, Pieter Abbeel",ICML,2020,http://proceedings.mlr.press/v119/stooke20a.html
Learning Discrete Structured Representations by Adversarially Maximizing Mutual Information.,"Karl Stratos, Sam Wiseman",ICML,2020,http://proceedings.mlr.press/v119/stratos20a.html
Confidence-Calibrated Adversarial Training: Generalizing to Unseen Attacks.,"David Stutz, Matthias Hein 0001, Bernt Schiele",ICML,2020,http://proceedings.mlr.press/v119/stutz20a.html
Doubly robust off-policy evaluation with shrinkage.,"Yi Su, Maria Dimakopoulou, Akshay Krishnamurthy, Miroslav Dudík",ICML,2020,http://proceedings.mlr.press/v119/su20a.html
Task Understanding from Confusing Multi-task Data.,"Xin Su, Yizhou Jiang, Shangqi Guo, Feng Chen 0007",ICML,2020,http://proceedings.mlr.press/v119/su20b.html
ConQUR: Mitigating Delusional Bias in Deep Q-Learning.,"Dijia Su, Jayden Ooi, Tyler Lu, Dale Schuurmans, Craig Boutilier",ICML,2020,http://proceedings.mlr.press/v119/su20c.html
Adaptive Estimator Selection for Off-Policy Evaluation.,"Yi Su, Pavithra Srinath, Akshay Krishnamurthy",ICML,2020,http://proceedings.mlr.press/v119/su20d.html
Generative Teaching Networks: Accelerating Neural Architecture Search by Learning to Generate Synthetic Training Data.,"Felipe Petroski Such, Aditya Rawal, Joel Lehman, Kenneth O. Stanley, Jeffrey Clune",ICML,2020,http://proceedings.mlr.press/v119/such20a.html
Improving the Sample and Communication Complexity for Decentralized Non-Convex Optimization: Joint Gradient Estimation and Tracking.,"Haoran Sun, Songtao Lu, Mingyi Hong 0001",ICML,2020,http://proceedings.mlr.press/v119/sun20a.html
Test-Time Training with Self-Supervision for Generalization under Distribution Shifts.,"Yu Sun 0020, Xiaolong Wang 0004, Zhuang Liu 0003, John Miller 0001, Alexei A. Efros, Moritz Hardt",ICML,2020,http://proceedings.mlr.press/v119/sun20b.html
An EM Approach to Non-autoregressive Conditional Sequence Generation.,"Zhiqing Sun, Yiming Yang",ICML,2020,http://proceedings.mlr.press/v119/sun20c.html
The Shapley Taylor Interaction Index.,"Mukund Sundararajan, Kedar Dhamdhere, Ashish Agarwal",ICML,2020,http://proceedings.mlr.press/v119/sundararajan20a.html
The Many Shapley Values for Model Explanation.,"Mukund Sundararajan, Amir Najmi",ICML,2020,http://proceedings.mlr.press/v119/sundararajan20b.html
Multi-objective Bayesian Optimization using Pareto-frontier Entropy.,"Shinya Suzuki, Shion Takeno, Tomoyuki Tamura, Kazuki Shitara, Masayuki Karasuyama",ICML,2020,http://proceedings.mlr.press/v119/suzuki20a.html
The k-tied Normal Distribution: A Compact Parameterization of Gaussian Mean Field Posteriors in Bayesian Neural Networks.,"Jakub Swiatkowski, Kevin Roth, Bastiaan S. Veeling, Linh Tran, Joshua V. Dillon, Jasper Snoek, Stephan Mandt, Tim Salimans, Rodolphe Jenatton, Sebastian Nowozin",ICML,2020,http://proceedings.mlr.press/v119/swiatkowski20a.html
Multi-Agent Routing Value Iteration Network.,"Quinlan Sykora, Mengye Ren, Raquel Urtasun",ICML,2020,http://proceedings.mlr.press/v119/sykora20a.html
Distinguishing Cause from Effect Using Quantiles: Bivariate Quantile Causal Discovery.,"Natasa Tagasovska, Valérie Chavez-Demoulin, Thibault Vatter",ICML,2020,http://proceedings.mlr.press/v119/tagasovska20a.html
Quantized Decentralized Stochastic Learning over Directed Graphs.,"Hossein Taheri, Aryan Mokhtari, Hamed Hassani, Ramtin Pedarsani",ICML,2020,http://proceedings.mlr.press/v119/taheri20a.html
Multi-fidelity Bayesian Optimization with Max-value Entropy Search and its Parallelization.,"Shion Takeno, Hitoshi Fukuoka, Yuhki Tsukada, Toshiyuki Koyama, Motoki Shiga, Ichiro Takeuchi, Masayuki Karasuyama",ICML,2020,http://proceedings.mlr.press/v119/takeno20a.html
Fiedler Regularization: Learning Neural Networks with Graph Sparsity.,"Edric Tam, David B. Dunson",ICML,2020,http://proceedings.mlr.press/v119/tam20a.html
DropNet: Reducing Neural Network Complexity via Iterative Pruning.,"Chong Min John Tan, Mehul Motani",ICML,2020,http://proceedings.mlr.press/v119/tan20a.html
Reinforcement Learning for Integer Programming: Learning to Cut.,"Yunhao Tang, Shipra Agrawal 0001, Yuri Faenza",ICML,2020,http://proceedings.mlr.press/v119/tang20a.html
Clinician-in-the-Loop Decision Making: Reinforcement Learning with Near-Optimal Set-Valued Policies.,"Shengpu Tang, Aditya Modi 0002, Michael W. Sjoding, Jenna Wiens",ICML,2020,http://proceedings.mlr.press/v119/tang20c.html
The Buckley-Osthus model and the block preferential attachment model: statistical analysis and application.,"Wenpin Tang, Xin Guo, Fengmin Tang",ICML,2020,http://proceedings.mlr.press/v119/tang20b.html
Taylor Expansion Policy Optimization.,"Yunhao Tang, Michal Valko, Rémi Munos",ICML,2020,http://proceedings.mlr.press/v119/tang20d.html
Variational Imitation Learning with Diverse-quality Demonstrations.,"Voot Tangkaratt, Bo Han 0003, Mohammad Emtiyaz Khan, Masashi Sugiyama",ICML,2020,http://proceedings.mlr.press/v119/tangkaratt20a.html
Learning disconnected manifolds: a no GAN&apos;s land.,"Ugo Tanielian, Thibaut Issenhuth, Elvis Dohmatob, Jérémie Mary",ICML,2020,http://proceedings.mlr.press/v119/tanielian20a.html
No-Regret Exploration in Goal-Oriented Reinforcement Learning.,"Jean Tarbouriech, Evrard Garcelon, Michal Valko, Matteo Pirotta, Alessandro Lazaric",ICML,2020,http://proceedings.mlr.press/v119/tarbouriech20a.html
Sparse Sinkhorn Attention.,"Yi Tay, Dara Bahri, Liu Yang, Donald Metzler, Da-Cheng Juan",ICML,2020,http://proceedings.mlr.press/v119/tay20a.html
Inductive Relation Prediction by Subgraph Reasoning.,"Komal K. Teru, Etienne G. Denis, William L. Hamilton",ICML,2020,http://proceedings.mlr.press/v119/teru20a.html
Few-shot Domain Adaptation by Causal Mechanism Transfer.,"Takeshi Teshima, Issei Sato, Masashi Sugiyama",ICML,2020,http://proceedings.mlr.press/v119/teshima20a.html
Student Specialization in Deep Rectified Networks With Finite Width and Input Dimension.,Yuandong Tian,ICML,2020,http://proceedings.mlr.press/v119/tian20a.html
Sequential Transfer in Reinforcement Learning with a Generative Model.,"Andrea Tirinzoni, Riccardo Poiani, Marcello Restelli",ICML,2020,http://proceedings.mlr.press/v119/tirinzoni20a.html
Convolutional dictionary learning based auto-encoders for natural exponential-family distributions.,"Bahareh Tolooshams, Andrew H. Song, Simona Temereanca, Demba E. Ba",ICML,2020,http://proceedings.mlr.press/v119/tolooshams20a.html
Multi-step Greedy Reinforcement Learning Algorithms.,"Manan Tomar, Yonathan Efroni, Mohammad Ghavamzadeh",ICML,2020,http://proceedings.mlr.press/v119/tomar20a.html
Choice Set Optimization Under Discrete Choice Models of Group Decisions.,"Kiran Tomlinson, Austin R. Benson",ICML,2020,http://proceedings.mlr.press/v119/tomlinson20a.html
Alleviating Privacy Attacks via Causal Learning.,"Shruti Tople, Amit Sharma 0007, Aditya Nori",ICML,2020,http://proceedings.mlr.press/v119/tople20a.html
Bayesian Learning from Sequential Data using Gaussian Processes with Signature Covariances.,"Csaba Tóth, Harald Oberhauser",ICML,2020,http://proceedings.mlr.press/v119/toth20a.html
Fundamental Tradeoffs between Invariance and Sensitivity to Adversarial Perturbations.,"Florian Tramèr, Jens Behrmann, Nicholas Carlini, Nicolas Papernot, Jörn-Henrik Jacobsen",ICML,2020,http://proceedings.mlr.press/v119/tramer20a.html
Stochastic Gauss-Newton Algorithms for Nonconvex Compositional Optimization.,"Quoc Tran-Dinh, Nhan H. Pham, Lam M. Nguyen",ICML,2020,http://proceedings.mlr.press/v119/tran-dinh20a.html
Bayesian Differential Privacy for Machine Learning.,"Aleksei Triastcyn, Boi Faltings",ICML,2020,http://proceedings.mlr.press/v119/triastcyn20a.html
Single Point Transductive Prediction.,"Nilesh Tripuraneni, Lester Mackey",ICML,2020,http://proceedings.mlr.press/v119/tripuraneni20a.html
GraphOpt: Learning Optimization Models of Graph Formation.,"Rakshit Trivedi, Jiachen Yang, Hongyuan Zha",ICML,2020,http://proceedings.mlr.press/v119/trivedi20a.html
Logic and Pragmatics in AI Explanation.,"Chun-Hua Tsai, John M. Carroll 0001",xxAI@ICML,2020,https://doi.org/10.1007/978-3-031-04083-2_19
Transfer Learning without Knowing: Reprogramming Black-box Machine Learning Models with Scarce Data and Limited Resources.,"Yun-Yun Tsai, Pin-Yu Chen, Tsung-Yi Ho",ICML,2020,http://proceedings.mlr.press/v119/tsai20a.html
From ImageNet to Image Classification: Contextualizing Progress on Benchmarks.,"Dimitris Tsipras, Shibani Santurkar, Logan Engstrom, Andrew Ilyas, Aleksander Madry",ICML,2020,http://proceedings.mlr.press/v119/tsipras20a.html
Normalized Flat Minima: Exploring Scale Invariant Definition of Flat Minima for Neural Networks Using PAC-Bayesian Analysis.,"Yusuke Tsuzuku, Issei Sato, Masashi Sugiyama",ICML,2020,http://proceedings.mlr.press/v119/tsuzuku20a.html
Approximating Stacked and Bidirectional Recurrent Architectures with the Delayed Recurrent Neural Network.,"Javier Turek, Shailee Jain, Vy A. Vo, Mihai Capota, Alexander Huth, Theodore L. Willke",ICML,2020,http://proceedings.mlr.press/v119/turek20a.html
Minimax Weight and Q-Function Learning for Off-Policy Evaluation.,"Masatoshi Uehara, Jiawei Huang, Nan Jiang 0008",ICML,2020,http://proceedings.mlr.press/v119/uehara20a.html
StochasticRank: Global Optimization of Scale-Free Discrete Functions.,"Aleksei Ustimenko, Liudmila Prokhorenkova",ICML,2020,http://proceedings.mlr.press/v119/ustimenko20a.html
Undirected Graphical Models as Approximate Posteriors.,"Arash Vahdat, Evgeny Andriyash, William G. Macready",ICML,2020,http://proceedings.mlr.press/v119/vahdat20a.html
Deep Molecular Programming: A Natural Implementation of Binary-Weight ReLU Neural Networks.,"Marko Vasic, Cameron T. Chalk, Sarfraz Khurshid, David Soloveichik",ICML,2020,http://proceedings.mlr.press/v119/vasic20a.html
Non-Stationary Delayed Bandits with Intermediate Observations.,"Claire Vernade, András György 0001, Timothy A. Mann",ICML,2020,http://proceedings.mlr.press/v119/vernade20b.html
Linear bandits with Stochastic Delayed Feedback.,"Claire Vernade, Alexandra Carpentier, Tor Lattimore, Giovanni Zappella, Beyza Ermis, Michael Brückner",ICML,2020,http://proceedings.mlr.press/v119/vernade20a.html
OPtions as REsponses: Grounding behavioural hierarchies in multi-agent reinforcement learning.,"Alexander Vezhnevets, Yuhuai Wu, Maria K. Eckstein, Rémi Leblond, Joel Z. Leibo",ICML,2020,http://proceedings.mlr.press/v119/vezhnevets20a.html
Born-Again Tree Ensembles.,"Thibaut Vidal, Maximilian Schiffer",ICML,2020,http://proceedings.mlr.press/v119/vidal20a.html
Private Reinforcement Learning with PAC and Regret Guarantees.,"Giuseppe Vietri, Borja Balle, Akshay Krishnamurthy, Zhiwei Steven Wu",ICML,2020,http://proceedings.mlr.press/v119/vietri20a.html
New Oracle-Efficient Algorithms for Private Synthetic Data Release.,"Giuseppe Vietri, Grace Tian, Mark Bun, Thomas Steinke 0002, Zhiwei Steven Wu",ICML,2020,http://proceedings.mlr.press/v119/vietri20b.html
Conditional gradient methods for stochastically constrained convex minimization.,"Maria-Luiza Vladarean, Ahmet Alacaoglu, Ya-Ping Hsieh, Volkan Cevher",ICML,2020,http://proceedings.mlr.press/v119/vladarean20a.html
Unsupervised Discovery of Interpretable Directions in the GAN Latent Space.,"Andrey Voynov, Artem Babenko",ICML,2020,http://proceedings.mlr.press/v119/voynov20a.html
Safe Reinforcement Learning in Constrained Markov Decision Processes.,"Akifumi Wachi, Yanan Sui",ICML,2020,http://proceedings.mlr.press/v119/wachi20a.html
Orthogonalized SGD and Nested Architectures for Anytime Neural Networks.,"Chengcheng Wan 0001, Henry Hoffmann, Shan Lu 0001, Michael Maire",ICML,2020,http://proceedings.mlr.press/v119/wan20a.html
Projection-free Distributed Online Convex Optimization with $O(\sqrt{T})$ Communication Complexity.,"Yuanyu Wan, Wei-Wei Tu, Lijun Zhang 0005",ICML,2020,http://proceedings.mlr.press/v119/wan20b.html
Logistic Regression for Massive Data with Rare Events.,Haiying Wang 0004,ICML,2020,http://proceedings.mlr.press/v119/wang20a.html
Towards Accurate Post-training Network Quantization via Bit-Split and Stitching.,"Peisong Wang, Qiang Chen 0007, Xiangyu He, Jian Cheng 0001",ICML,2020,http://proceedings.mlr.press/v119/wang20c.html
On the Global Optimality of Model-Agnostic Meta-Learning.,"Lingxiao Wang 0003, Qi Cai, Zhuoran Yang, Zhaoran Wang 0001",ICML,2020,http://proceedings.mlr.press/v119/wang20b.html
Self-Modulating Nonparametric Event-Tensor Factorization.,"Zheng Wang 0042, Xinqi Chu, Shandian Zhe",ICML,2020,http://proceedings.mlr.press/v119/wang20d.html
Upper bounds for Model-Free Row-Sparse Principal Component Analysis.,"Guanyi Wang, Santanu S. Dey",ICML,2020,http://proceedings.mlr.press/v119/wang20e.html
