Title,Authors,Venue,Year,URL
Learning to Branch for Multi-Task Learning.,"Pengsheng Guo, Chen-Yu Lee, Daniel Ulbricht",ICML,2020,http://proceedings.mlr.press/v119/guo20e.html
Communication-Efficient Distributed Stochastic AUC Maximization with Deep Neural Networks.,"Zhishuai Guo, Mingrui Liu, Zhuoning Yuan, Li Shen 0005, Wei Liu 0005, Tianbao Yang",ICML,2020,http://proceedings.mlr.press/v119/guo20f.html
Bootstrap Latent-Predictive Representations for Multitask Reinforcement Learning.,"Zhaohan Daniel Guo, Bernardo Ávila Pires, Bilal Piot, Jean-Bastien Grill, Florent Altché, Rémi Munos, Mohammad Gheshlaghi Azar",ICML,2020,http://proceedings.mlr.press/v119/guo20g.html
Accelerating Large-Scale Inference with Anisotropic Vector Quantization.,"Ruiqi Guo, Philip Sun, Erik Lindgren, Quan Geng, David Simcha, Felix Chern, Sanjiv Kumar",ICML,2020,http://proceedings.mlr.press/v119/guo20h.html
Safe Deep Semi-Supervised Learning for Unseen-Class Unlabeled Data.,"Lan-Zhe Guo, Zhenyu Zhang, Yuan Jiang 0001, Yufeng Li 0008, Zhi-Hua Zhou",ICML,2020,http://proceedings.mlr.press/v119/guo20i.html
Neural Topic Modeling with Continual Lifelong Learning.,"Pankaj Gupta 0003, Yatin Chaudhary, Thomas A. Runkler, Hinrich Schütze",ICML,2020,http://proceedings.mlr.press/v119/gupta20a.html
Multidimensional Shape Constraints.,"Maya R. Gupta, Erez Louidor, Oleksandr Mangylov, Nobu Morioka, Taman Narayan, Sen Zhao",ICML,2020,http://proceedings.mlr.press/v119/gupta20b.html
Retrieval Augmented Language Model Pre-Training.,"Kelvin Guu, Kenton Lee, Zora Tung, Panupong Pasupat, Ming-Wei Chang",ICML,2020,http://proceedings.mlr.press/v119/guu20a.html
Streaming Submodular Maximization under a k-Set System Constraint.,"Ran Haba, Ehsan Kazemi 0001, Moran Feldman, Amin Karbasi",ICML,2020,http://proceedings.mlr.press/v119/haba20a.html
"Varieties of AI Explanations Under the Law. From the GDPR to the AIA, and Beyond.","Philipp Hacker, Jan-Hendrik Passoth",xxAI@ICML,2020,https://doi.org/10.1007/978-3-031-04083-2_17
Let&apos;s Agree to Agree: Neural Networks Share Classification Order on Real Datasets.,"Guy Hacohen, Leshem Choshen, Daphna Weinshall",ICML,2020,http://proceedings.mlr.press/v119/hacohen20a.html
Optimal approximation for unconstrained non-submodular minimization.,"Marwa El Halabi, Stefanie Jegelka",ICML,2020,http://proceedings.mlr.press/v119/halabi20a.html
FedBoost: A Communication-Efficient Algorithm for Federated Learning.,"Jenny Hamer, Mehryar Mohri, Ananda Theertha Suresh",ICML,2020,http://proceedings.mlr.press/v119/hamer20a.html
Polynomial Tensor Sketch for Element-wise Function of Low-Rank Matrix.,"Insu Han, Haim Avron, Jinwoo Shin",ICML,2020,http://proceedings.mlr.press/v119/han20a.html
DRWR: A Differentiable Renderer without Rendering for Unsupervised 3D Structure Learning from Silhouette Images.,"Zhizhong Han, Chao Chen, Yu-Shen Liu, Matthias Zwicker",ICML,2020,http://proceedings.mlr.press/v119/han20b.html
Training Binary Neural Networks through Learning with Noisy Supervision.,"Kai Han 0002, Yunhe Wang 0001, Yixing Xu, Chunjing Xu, Enhua Wu, Chang Xu 0002",ICML,2020,http://proceedings.mlr.press/v119/han20d.html
Stochastic Subspace Cubic Newton Method.,"Filip Hanzely, Nikita Doikov, Yurii E. Nesterov, Peter Richtárik",ICML,2020,http://proceedings.mlr.press/v119/hanzely20a.html
Variance Reduced Coordinate Descent with Acceleration: New Method With a Surprising Application to Finite-Sum Problems.,"Filip Hanzely, Dmitry Kovalev, Peter Richtárik",ICML,2020,http://proceedings.mlr.press/v119/hanzely20b.html
Data Amplification: Instance-Optimal Property Estimation.,"Yi Hao, Alon Orlitsky",ICML,2020,http://proceedings.mlr.press/v119/hao20a.html
Dynamic Knapsack Optimization Towards Efficient Multi-Channel Sequential Advertising.,"Xiaotian Hao, Zhaoqing Peng, Yi Ma 0005, Guan Wang, Junqi Jin, Jianye Hao, Shan Chen, Rongquan Bai, Mingzhou Xie, Miao Xu, Zhenzhe Zheng, Chuan Yu, Han Li, Jian Xu 0015, Kun Gai",ICML,2020,http://proceedings.mlr.press/v119/hao20b.html
Improving generalization by controlling label-noise information in neural network weights.,"Hrayr Harutyunyan, Kyle Reing, Greg Ver Steeg, Aram Galstyan",ICML,2020,http://proceedings.mlr.press/v119/harutyunyan20a.html
A Natural Lottery Ticket Winner: Reinforcement Learning with Ordinary Neural Circuits.,"Ramin M. Hasani, Mathias Lechner, Alexander Amini, Daniela Rus, Radu Grosu",ICML,2020,http://proceedings.mlr.press/v119/hasani20a.html
Bayesian Graph Neural Networks with Adaptive Connection Sampling.,"Arman Hasanzadeh, Ehsan Hajiramezanali, Shahin Boluki, Mingyuan Zhou, Nick Duffield, Krishna Narayanan 0001, Xiaoning Qian",ICML,2020,http://proceedings.mlr.press/v119/hasanzadeh20a.html
CoMic: Complementary Task Learning &amp; Mimicry for Reusable Skills.,"Leonard Hasenclever, Fabio Pardo, Raia Hadsell, Nicolas Heess, Josh Merel",ICML,2020,http://proceedings.mlr.press/v119/hasenclever20a.html
Contrastive Multi-View Representation Learning on Graphs.,"Kaveh Hassani, Amir Hosein Khas Ahmadi",ICML,2020,http://proceedings.mlr.press/v119/hassani20a.html
Nested Subspace Arrangement for Representation of Relational Data.,"Nozomi Hata, Shizuo Kaji, Akihiro Yoshida, Katsuki Fujisawa",ICML,2020,http://proceedings.mlr.press/v119/hata20a.html
Compressive sensing with un-trained neural networks: Gradient descent finds a smooth approximation.,"Reinhard Heckel, Mahdi Soltanolkotabi",ICML,2020,http://proceedings.mlr.press/v119/heckel20a.html
Hierarchically Decoupled Imitation For Morphological Transfer.,"Donald J. Hejna III, Lerrel Pinto, Pieter Abbeel",ICML,2020,http://proceedings.mlr.press/v119/hejna20a.html
Gradient-free Online Learning in Continuous Games with Delayed Rewards.,"Amélie Héliou, Panayotis Mertikopoulos, Zhengyuan Zhou",ICML,2020,http://proceedings.mlr.press/v119/heliou20a.html
Data-Efficient Image Recognition with Contrastive Predictive Coding.,Olivier J. Hénaff,ICML,2020,http://proceedings.mlr.press/v119/henaff20a.html
Minimax Rate for Learning From Pairwise Comparisons in the BTL Model.,"Julien M. Hendrickx, Alex Olshevsky, Venkatesh Saligrama",ICML,2020,http://proceedings.mlr.press/v119/hendrickx20a.html
Statistically Preconditioned Accelerated Gradient Method for Distributed Optimization.,"Hadrien Hendrikx, Lin Xiao, Sébastien Bubeck, Francis R. Bach, Laurent Massoulié",ICML,2020,http://proceedings.mlr.press/v119/hendrikx20a.html
Cost-Effective Interactive Attention Learning with Neural Attention Processes.,"Jay Heo, Junhyeon Park, Hyewon Jeong, Kwang Joon Kim, Juho Lee 0001, Eunho Yang, Sung Ju Hwang",ICML,2020,http://proceedings.mlr.press/v119/heo20a.html
Likelihood-free MCMC with Amortized Approximate Ratio Estimators.,"Joeri Hermans, Volodimir Begy, Gilles Louppe",ICML,2020,http://proceedings.mlr.press/v119/hermans20a.html
Towards Non-Parametric Drift Detection via Dynamic Adapting Window Independence Drift Detection (DAWIDD).,"Fabian Hinder, André Artelt, Barbara Hammer",ICML,2020,http://proceedings.mlr.press/v119/hinder20a.html
Optimization and Analysis of the pAp@k Metric for Recommender Systems.,"Gaurush Hiranandani, Warut Vijitbenjaronk, Sanmi Koyejo, Prateek Jain",ICML,2020,http://proceedings.mlr.press/v119/hiranandani20a.html
Optimizing Dynamic Structures with Bayesian Generative Search.,"Minh Hoang, Carleton Kingsford",ICML,2020,http://proceedings.mlr.press/v119/hoang20a.html
Learning Task-Agnostic Embedding of Multiple Black-Box Experts for Multi-Task Model Fusion.,"Trong Nghia Hoang, Thanh Lam, Bryan Kian Hsiang Low, Patrick Jaillet",ICML,2020,http://proceedings.mlr.press/v119/hoang20b.html
Parameterized Rate-Distortion Stochastic Encoder.,"Quan Hoang, Trung Le, Dinh Phung 0001",ICML,2020,http://proceedings.mlr.press/v119/hoang20c.html
Topologically Densified Distributions.,"Christoph D. Hofer, Florian Graf, Marc Niethammer, Roland Kwitt",ICML,2020,http://proceedings.mlr.press/v119/hofer20a.html
Graph Filtration Learning.,"Christoph D. Hofer, Florian Graf, Bastian Rieck, Marc Niethammer, Roland Kwitt",ICML,2020,http://proceedings.mlr.press/v119/hofer20b.html
Black-Box Variational Inference as a Parametric Approximation to Langevin Dynamics.,"Matthew D. Hoffman, Yian Ma",ICML,2020,http://proceedings.mlr.press/v119/hoffman20a.html
Learning Mixtures of Graphs from Epidemic Cascades.,"Jessica Hoffmann, Soumya Basu 0001, Surbhi Goel, Constantine Caramanis",ICML,2020,http://proceedings.mlr.press/v119/hoffmann20a.html
xxAI - Beyond Explainable Artificial Intelligence.,"Andreas Holzinger, Randy Goebel, Ruth Fong, Taesup Moon, Klaus-Robert Müller, Wojciech Samek",xxAI@ICML,2020,https://doi.org/10.1007/978-3-031-04083-2_1
Explainable AI Methods - A Brief Overview.,"Andreas Holzinger, Anna Saranti, Christoph Molnar, Przemyslaw Biecek, Wojciech Samek",xxAI@ICML,2020,https://doi.org/10.1007/978-3-031-04083-2_2
Set Functions for Time Series.,"Max Horn, Michael Moor, Christian Bock, Bastian Rieck, Karsten M. Borgwardt",ICML,2020,http://proceedings.mlr.press/v119/horn20a.html
Lifted Disjoint Paths with Application in Multiple Object Tracking.,"Andrea Hornáková, Roberto Henschel, Bodo Rosenhahn, Paul Swoboda",ICML,2020,http://proceedings.mlr.press/v119/hornakova20a.html
Infinite attention: NNGP and NTK for deep attention networks.,"Jiri Hron, Yasaman Bahri, Jascha Sohl-Dickstein, Roman Novak",ICML,2020,http://proceedings.mlr.press/v119/hron20a.html
The Non-IID Data Quagmire of Decentralized Machine Learning.,"Kevin Hsieh, Amar Phanishayee, Onur Mutlu, Phillip B. Gibbons",ICML,2020,http://proceedings.mlr.press/v119/hsieh20a.html
&quot;Other-Play&quot; for Zero-Shot Coordination.,"Hengyuan Hu, Adam Lerer, Alex Peysakhovich, Jakob N. Foerster",ICML,2020,http://proceedings.mlr.press/v119/hu20a.html
XTREME: A Massively Multilingual Multi-task Benchmark for Evaluating Cross-lingual Generalisation.,"Junjie Hu 0001, Sebastian Ruder, Aditya Siddhant, Graham Neubig, Orhan Firat, Melvin Johnson",ICML,2020,http://proceedings.mlr.press/v119/hu20b.html
InstaHide: Instance-hiding Schemes for Private Distributed Learning.,"Yangsibo Huang, Zhao Song 0002, Kai Li 0001, Sanjeev Arora",ICML,2020,http://proceedings.mlr.press/v119/huang20i.html
Momentum-Based Policy Gradient Methods.,"Feihu Huang 0001, Shangqian Gao, Jian Pei, Heng Huang",ICML,2020,http://proceedings.mlr.press/v119/huang20a.html
From Importance Sampling to Doubly Robust Policy Gradient.,"Jiawei Huang, Nan Jiang 0008",ICML,2020,http://proceedings.mlr.press/v119/huang20b.html
Evaluating Lossy Compression Rates of Deep Generative Models.,"Sicong Huang 0001, Alireza Makhzani, Yanshuai Cao, Roger B. Grosse",ICML,2020,http://proceedings.mlr.press/v119/huang20c.html
One Policy to Control Them All: Shared Modular Policies for Agent-Agnostic Control.,"Wenlong Huang, Igor Mordatch, Deepak Pathak",ICML,2020,http://proceedings.mlr.press/v119/huang20d.html
Communication-Efficient Distributed PCA by Riemannian Optimization.,"Long-Kai Huang, Sinno Jialin Pan",ICML,2020,http://proceedings.mlr.press/v119/huang20e.html
Improving Transformer Optimization Through Better Initialization.,"Xiao Shi Huang, Felipe Pérez, Jimmy Ba, Maksims Volkovs",ICML,2020,http://proceedings.mlr.press/v119/huang20f.html
More Information Supervised Probabilistic Deep Face Embedding Learning.,"Ying Huang, Shangfeng Qiu, Wenwei Zhang, Xianghui Luo, Jinzhuo Wang",ICML,2020,http://proceedings.mlr.press/v119/huang20g.html
Generating Programmatic Referring Expressions via Program Synthesis.,"Jiani Huang, Calvin Smith, Osbert Bastani, Rishabh Singh, Aws Albarghouthi, Mayur Naik",ICML,2020,http://proceedings.mlr.press/v119/huang20h.html
Accelerated Stochastic Gradient-free and Projection-free Methods.,"Feihu Huang 0001, Lue Tao, Songcan Chen",ICML,2020,http://proceedings.mlr.press/v119/huang20j.html
Deep Graph Random Process for Relational-Thinking-Based Speech Recognition.,"Hengguan Huang, Fuzhao Xue, Hao Wang 0014, Ye Wang 0007",ICML,2020,http://proceedings.mlr.press/v119/huang20k.html
Dynamics of Deep Neural Networks and Neural Tangent Hierarchy.,"Jiaoyang Huang, Horng-Tzer Yau",ICML,2020,http://proceedings.mlr.press/v119/huang20l.html
Curvature-corrected learning dynamics in deep neural networks.,Dongsung Huh,ICML,2020,http://proceedings.mlr.press/v119/huh20a.html
Multigrid Neural Memory.,"Tri Huynh, Michael Maire, Matthew R. Walter",ICML,2020,http://proceedings.mlr.press/v119/huynh20a.html
Meta-Learning with Shared Amortized Variational Inference.,"Ekaterina Iakovleva, Jakob Verbeek, Karteek Alahari",ICML,2020,http://proceedings.mlr.press/v119/iakovleva20a.html
Linear Lower Bounds and Conditioning of Differentiable Games.,"Adam Ibrahim, Waïss Azizian, Gauthier Gidel, Ioannis Mitliagkas",ICML,2020,http://proceedings.mlr.press/v119/ibrahim20a.html
Fast Deterministic CUR Matrix Decomposition with Accuracy Assurance.,"Yasutoshi Ida, Sekitoshi Kanai, Yasuhiro Fujiwara, Tomoharu Iwata, Koh Takeuchi, Hisashi Kashima",ICML,2020,http://proceedings.mlr.press/v119/ida20a.html
Do We Need Zero Training Loss After Achieving Zero Training Error?,"Takashi Ishida 0001, Ikko Yamane, Tomoya Sakai 0001, Gang Niu 0001, Masashi Sugiyama",ICML,2020,http://proceedings.mlr.press/v119/ishida20a.html
Semi-Supervised Learning with Normalizing Flows.,"Pavel Izmailov, Polina Kirichenko, Marc Finzi, Andrew Gordon Wilson",ICML,2020,http://proceedings.mlr.press/v119/izmailov20a.html
Implicit Regularization of Random Feature Models.,"Arthur Jacot, Berfin Simsek, Francesco Spadaro, Clément Hongler, Franck Gabriel",ICML,2020,http://proceedings.mlr.press/v119/jacot20a.html
Correlation Clustering with Asymmetric Classification Errors.,"Jafar Jafarov, Sanchit Kalhan, Konstantin Makarychev, Yury Makarychev",ICML,2020,http://proceedings.mlr.press/v119/jafarov20a.html
Optimal Robust Learning of Discrete Distributions from Batches.,"Ayush Jain 0001, Alon Orlitsky",ICML,2020,http://proceedings.mlr.press/v119/jain20a.html
Generalization to New Actions in Reinforcement Learning.,"Ayush Jain 0003, Andrew Szot, Joseph J. Lim",ICML,2020,http://proceedings.mlr.press/v119/jain20b.html
Tails of Lipschitz Triangular Flows.,"Priyank Jaini, Ivan Kobyzev, Yaoliang Yu, Marcus A. Brubaker",ICML,2020,http://proceedings.mlr.press/v119/jaini20a.html
Learning Portable Representations for High-Level Planning.,"Steven James 0001, Benjamin Rosman, George Konidaris 0001",ICML,2020,http://proceedings.mlr.press/v119/james20a.html
Debiased Sinkhorn barycenters.,"Hicham Janati, Marco Cuturi, Alexandre Gramfort",ICML,2020,http://proceedings.mlr.press/v119/janati20a.html
Parametric Gaussian Process Regressors.,"Martin Jankowiak, Geoff Pleiss, Jacob R. Gardner",ICML,2020,http://proceedings.mlr.press/v119/jankowiak20a.html
Inverse Active Sensing: Modeling and Understanding Timely Decision-Making.,"Daniel Jarrett, Mihaela van der Schaar",ICML,2020,http://proceedings.mlr.press/v119/jarrett20a.html
Source Separation with Deep Generative Priors.,"Vivek Jayaram, John Thickstun",ICML,2020,http://proceedings.mlr.press/v119/jayaram20a.html
Extra-gradient with player sampling for faster convergence in n-player games.,"Samy Jelassi, Carles Domingo-Enrich, Damien Scieur, Arthur Mensch, Joan Bruna",ICML,2020,http://proceedings.mlr.press/v119/jelassi20a.html
T-GD: Transferable GAN-generated Images Detection Framework.,"Hyeonseong Jeon, Youngoh Bang, Junyaup Kim, Simon S. Woo",ICML,2020,http://proceedings.mlr.press/v119/jeon20a.html
History-Gradient Aided Batch Size Adaptation for Variance Reduced Algorithms.,"Kaiyi Ji, Zhe Wang 0021, Bowen Weng, Yi Zhou 0017, Wei Zhang 0013, Yingbin Liang",ICML,2020,http://proceedings.mlr.press/v119/ji20a.html
Information-Theoretic Local Minima Characterization and Regularization.,"Zhiwei Jia, Hao Su 0001",ICML,2020,http://proceedings.mlr.press/v119/jia20a.html
Optimizing Black-box Metrics with Adaptive Surrogates.,"Qijia Jiang, Olaoluwa Adigun, Harikrishna Narasimhan, Mahdi Milani Fard, Maya R. Gupta",ICML,2020,http://proceedings.mlr.press/v119/jiang20a.html
Beyond Synthetic Noise: Deep Learning on Controlled Noisy Labels.,"Lu Jiang 0004, Di Huang, Mason Liu, Weilong Yang",ICML,2020,http://proceedings.mlr.press/v119/jiang20c.html
Associative Memory in Iterated Overparameterized Sigmoid Autoencoders.,"Yibo Jiang, Cengiz Pehlevan",ICML,2020,http://proceedings.mlr.press/v119/jiang20e.html
Hierarchical Generation of Molecular Graphs using Structural Motifs.,"Wengong Jin, Regina Barzilay, Tommi S. Jaakkola",ICML,2020,http://proceedings.mlr.press/v119/jin20a.html
Multi-Objective Molecule Generation using Interpretable Substructures.,"Wengong Jin, Regina Barzilay, Tommi S. Jaakkola",ICML,2020,http://proceedings.mlr.press/v119/jin20b.html
Learning Adversarial Markov Decision Processes with Bandit Feedback and Unknown Transition.,"Chi Jin 0001, Tiancheng Jin, Haipeng Luo, Suvrit Sra, Tiancheng Yu",ICML,2020,http://proceedings.mlr.press/v119/jin20c.html
Reward-Free Exploration for Reinforcement Learning.,"Chi Jin 0001, Akshay Krishnamurthy, Max Simchowitz, Tiancheng Yu",ICML,2020,http://proceedings.mlr.press/v119/jin20d.html
What is Local Optimality in Nonconvex-Nonconcave Minimax Optimization?,"Chi Jin 0001, Praneeth Netrapalli, Michael I. Jordan",ICML,2020,http://proceedings.mlr.press/v119/jin20e.html
Efficiently Solving MDPs with Stochastic Mirror Descent.,"Yujia Jin, Aaron Sidford",ICML,2020,http://proceedings.mlr.press/v119/jin20f.html
Computational and Statistical Tradeoffs in Inferring Combinatorial Structures of Ising Model.,"Ying Jin, Zhaoran Wang 0001, Junwei Lu",ICML,2020,http://proceedings.mlr.press/v119/jin20g.html
Guided Learning of Nonconvex Models through Successive Functional Gradient Optimization.,"Rie Johnson, Tong Zhang 0001",ICML,2020,http://proceedings.mlr.press/v119/johnson20b.html
AdaScale SGD: A User-Friendly Algorithm for Distributed Training.,"Tyler B. Johnson, Pulkit Agrawal 0002, Haijie Gu, Carlos Guestrin",ICML,2020,http://proceedings.mlr.press/v119/johnson20a.html
On Relativistic f-Divergences.,Alexia Jolicoeur-Martineau,ICML,2020,http://proceedings.mlr.press/v119/jolicoeur-martineau20a.html
Fair k-Centers via Maximum Matching.,"Matthew Jones, Huy L. Nguyen, Thy Dinh Nguyen",ICML,2020,http://proceedings.mlr.press/v119/jones20a.html
Being Bayesian about Categorical Probability.,"Taejong Joo, Uijung Chung, Min-Gwan Seo",ICML,2020,http://proceedings.mlr.press/v119/joo20a.html
Evaluating the Performance of Reinforcement Learning Algorithms.,"Scott M. Jordan, Yash Chandak, Daniel Cohen, Mengxue Zhang, Philip S. Thomas",ICML,2020,http://proceedings.mlr.press/v119/jordan20a.html
Stochastic Differential Equations with Variational Wishart Diffusions.,"Martin Jørgensen, Marc Peter Deisenroth, Hugh Salimbeni",ICML,2020,http://proceedings.mlr.press/v119/jorgensen20a.html
A simpler approach to accelerated optimization: iterative averaging meets optimism.,"Pooria Joulani, Anant Raj, András György 0001, Csaba Szepesvári",ICML,2020,http://proceedings.mlr.press/v119/joulani20a.html
Sets Clustering.,"Ibrahim Jubran, Murad Tukan, Alaa Maalouf, Dan Feldman",ICML,2020,http://proceedings.mlr.press/v119/jubran20a.html
Distribution Augmentation for Generative Modeling.,"Heewoo Jun, Rewon Child, Mark Chen 0003, John Schulman, Aditya Ramesh, Alec Radford, Ilya Sutskever",ICML,2020,http://proceedings.mlr.press/v119/jun20a.html
Sub-Goal Trees a Framework for Goal-Based Reinforcement Learning.,"Tom Jurgenson, Or Avner, Edward Groshev, Aviv Tamar",ICML,2020,http://proceedings.mlr.press/v119/jurgenson20a.html
Partial Trace Regression and Low-Rank Kraus Decomposition.,"Hachem Kadri, Stéphane Ayache, Riikka Huusari, Alain Rakotomamonjy, Liva Ralaivola",ICML,2020,http://proceedings.mlr.press/v119/kadri20a.html
Strategyproof Mean Estimation from Multiple-Choice Questions.,"Anson Kahng, Gregory Kehne, Ariel D. Procaccia",ICML,2020,http://proceedings.mlr.press/v119/kahng20a.html
Variational Autoencoders with Riemannian Brownian Motion Priors.,"Dimitrios Kalatzis, David Eklund, Georgios Arvanitidis, Søren Hauberg",ICML,2020,http://proceedings.mlr.press/v119/kalatzis20a.html
DeepMatch: Balancing Deep Covariate Representations for Causal Inference Using Adversarial Training.,Nathan Kallus,ICML,2020,http://proceedings.mlr.press/v119/kallus20a.html
Double Reinforcement Learning for Efficient and Robust Off-Policy Evaluation.,"Nathan Kallus, Masatoshi Uehara",ICML,2020,http://proceedings.mlr.press/v119/kallus20b.html
Statistically Efficient Off-Policy Policy Gradients.,"Nathan Kallus, Masatoshi Uehara",ICML,2020,http://proceedings.mlr.press/v119/kallus20c.html
On the Power of Compressed Sensing with Generative Models.,"Akshay Kamath, Eric Price 0001, Sushrut Karmalkar",ICML,2020,http://proceedings.mlr.press/v119/kamath20a.html
Learning and Evaluating Contextual Embedding of Source Code.,"Aditya Kanade, Petros Maniatis, Gogul Balakrishnan, Kensen Shi",ICML,2020,http://proceedings.mlr.press/v119/kanade20a.html
Operation-Aware Soft Channel Pruning using Differentiable Masks.,"Minsoo Kang, Bohyung Han",ICML,2020,http://proceedings.mlr.press/v119/kang20a.html
Towards Causal Algorithmic Recourse.,"Amir-Hossein Karimi, Julius von Kügelgen, Bernhard Schölkopf, Isabel Valera",xxAI@ICML,2020,https://doi.org/10.1007/978-3-031-04083-2_8
SCAFFOLD: Stochastic Controlled Averaging for Federated Learning.,"Sai Praneeth Karimireddy, Satyen Kale, Mehryar Mohri, Sashank J. Reddi, Sebastian U. Stich, Ananda Theertha Suresh",ICML,2020,http://proceedings.mlr.press/v119/karimireddy20a.html
Non-autoregressive Machine Translation with Disentangled Context Transformer.,"Jungo Kasai, James Cross, Marjan Ghazvininejad, Jiatao Gu",ICML,2020,http://proceedings.mlr.press/v119/kasai20a.html
Transformers are RNNs: Fast Autoregressive Transformers with Linear Attention.,"Angelos Katharopoulos, Apoorv Vyas, Nikolaos Pappas 0002, François Fleuret",ICML,2020,http://proceedings.mlr.press/v119/katharopoulos20a.html
Rate-distortion optimization guided autoencoder for isometric embedding in Euclidean latent space.,"Keizo Kato, Jing Zhou, Tomotake Sasaki, Akira Nakagawa",ICML,2020,http://proceedings.mlr.press/v119/kato20a.html
Efficient Non-conjugate Gaussian Process Factor Models for Spike Count Data using Polynomial Approximations.,"Stephen L. Keeley, David M. Zoltowski, Yiyi Yu, Spencer L. Smith, Jonathan W. Pillow",ICML,2020,http://proceedings.mlr.press/v119/keeley20a.html
Quantum Expectation-Maximization for Gaussian mixture models.,"Iordanis Kerenidis, Alessandro Luongo, Anupam Prakash",ICML,2020,http://proceedings.mlr.press/v119/kerenidis20a.html
Differentiable Likelihoods for Fast Inversion of &apos;Likelihood-Free&apos; Dynamical Systems.,"Hans Kersting, Nicholas Krämer, Martin Schiegg, Christian Daniel, Michael Tiemann, Philipp Hennig",ICML,2020,http://proceedings.mlr.press/v119/kersting20a.html
Feature Noise Induces Loss Discrepancy Across Groups.,"Fereshte Khani, Percy Liang",ICML,2020,http://proceedings.mlr.press/v119/khani20a.html
Entropy Minimization In Emergent Languages.,"Eugene Kharitonov, Rahma Chaabouni 0001, Diane Bouchacourt, Marco Baroni",ICML,2020,http://proceedings.mlr.press/v119/kharitonov20a.html
Private Outsourced Bayesian Optimization.,"Dmitrii Kharkovskii, Zhongxiang Dai, Bryan Kian Hsiang Low",ICML,2020,http://proceedings.mlr.press/v119/kharkovskii20a.html
What can I do here? A Theory of Affordances in Reinforcement Learning.,"Khimya Khetarpal, Zafarali Ahmed, Gheorghe Comanici, David Abel, Doina Precup",ICML,2020,http://proceedings.mlr.press/v119/khetarpal20a.html
Uniform Convergence of Rank-weighted Learning.,"Justin Khim, Liu Leqi, Adarsh Prasad, Pradeep Ravikumar",ICML,2020,http://proceedings.mlr.press/v119/khim20a.html
Puzzle Mix: Exploiting Saliency and Local Statistics for Optimal Mixup.,"Jang-Hyun Kim, Wonho Choo, Hyun Oh Song",ICML,2020,http://proceedings.mlr.press/v119/kim20b.html
FACT: A Diagnostic for Group Fairness Trade-offs.,"Joon Sik Kim, Jiahao Chen 0001, Ameet Talwalkar",ICML,2020,http://proceedings.mlr.press/v119/kim20a.html
Domain Adaptive Imitation Learning.,"Kuno Kim, Yihong Gu, Jiaming Song, Shengjia Zhao, Stefano Ermon",ICML,2020,http://proceedings.mlr.press/v119/kim20c.html
Variational Inference for Sequential Data with Future Likelihood Estimates.,"Geon-Hyeong Kim, Youngsoo Jang, Hongseok Yang, Kee-Eung Kim",ICML,2020,http://proceedings.mlr.press/v119/kim20d.html
Active World Model Learning with Progress Curiosity.,"Kuno Kim, Megumi Sano, Julian De Freitas, Nick Haber, Daniel Yamins",ICML,2020,http://proceedings.mlr.press/v119/kim20e.html
Bayesian Experimental Design for Implicit Models by Mutual Information Neural Estimation.,"Steven Kleinegesse, Michael U. Gutmann",ICML,2020,http://proceedings.mlr.press/v119/kleinegesse20a.html
Optimal Continual Learning has Perfect Memory and is NP-hard.,"Jeremias Knoblauch, Hisham Husain, Tom Diethe",ICML,2020,http://proceedings.mlr.press/v119/knoblauch20a.html
Concept Bottleneck Models.,"Pang Wei Koh, Thao Nguyen, Yew Siang Tang, Stephen Mussmann, Emma Pierson, Been Kim, Percy Liang",ICML,2020,http://proceedings.mlr.press/v119/koh20a.html
Learning Similarity Metrics for Numerical Simulations.,"Georg Kohl, Kiwon Um, Nils Thuerey",ICML,2020,http://proceedings.mlr.press/v119/kohl20a.html
Equivariant Flows: Exact Likelihood Generative Learning for Symmetric Densities.,"Jonas Köhler 0001, Leon Klein, Frank Noé",ICML,2020,http://proceedings.mlr.press/v119/kohler20a.html
A Rate-Distortion Framework for Explaining Black-Box Model Decisions.,"Stefan Kolek, Duc Anh Nguyen, Ron Levie, Joan Bruna, Gitta Kutyniok",xxAI@ICML,2020,https://doi.org/10.1007/978-3-031-04083-2_6
Online Learning for Active Cache Synchronization.,"Andrey Kolobov, Sébastien Bubeck, Julian Zimmert",ICML,2020,http://proceedings.mlr.press/v119/kolobov20a.html
A Unified Theory of Decentralized SGD with Changing Topology and Local Updates.,"Anastasia Koloskova, Nicolas Loizou, Sadra Boreiri, Martin Jaggi, Sebastian U. Stich",ICML,2020,http://proceedings.mlr.press/v119/koloskova20a.html
